id,product_id,score,comment_time,comment,sentiment
12448,6723160.0,5.0,2019-10-20 09:40:01,噪音大小声音很小比以前的轻多了好棒安装服务服务很好安装到位恒温效果没有忽冷忽热效果超棒外形外观美观大方出水速度出水很大比以前用的大多了很满意耗能情况耗能可以,0.9999990406803781
12449,6723160.0,5.0,2019-06-20 13:25:50,性价比高安装之后非常高大上是智能触屏的之前热水器经常熄火然后冷水这个热水器使用一段时间从来没有熄火过温感控制的非常棒物超所值售后非常好刚刚下单都有客服联系预约时间售后也非常好主动联系我们整体感觉非常好非常庆幸选择美的品牌没有买其他的,0.9999992839401761
12451,6723160.0,5.0,2018-10-23 10:57:09,1我家是正儿八经的安装费元消除了我在网上看到的乱收费的顾虑余师傅热情礼貌进门立即拿出自己的鞋套戴上安装时一直在给我们说ldquo有什么问题随时联系客服8年质保的这个热水器很好用的rdquo安装好还主动交我们怎么使用最后还送了一对开关必须手动再次点赞2热水器比在网上看到的更好看大气上档次3试了一下出水量很大水也是立竿见影马上就热了海尔老品牌值得信赖,0.9347310482037027
12452,6723160.0,5.0,2018-10-06 16:17:12,美的的东西确实很不错美观大方安装也很到位只是还没有使用使用后再追评,0.9997547139569428
12453,6723160.0,5.0,2019-12-07 19:51:10,好看恒温效果好噪音大小小出水速度快安装服务非常好耗能情况不错师傅已安装完成非常满意服务非常好,0.9896499632177235
12454,6723160.0,5.0,2019-11-06 20:52:19,外形外观颜色大气美观恒温效果舒适度积佳噪音大小噪音不大和之前的比较这台太让人满意了出水速度速度很快安装服务安装师傅的态度非常好够专业耗能情况2级能效简直不要太赞了,0.9940870720683935
12455,6723160.0,5.0,2018-11-17 12:18:41,热水器双十一晚上买的转天下午就送货到家了美的和京东的送货速度堪称完美在双十一的时候依然保证了快速的送货服务非常满意同时安排好了安装时间师傅按时上门安装服务态度很好帮我解决了一些问题装好后热水很快出来了和电热水器出水速度一样又没有水量的限制对于喜欢泡澡的人真是完美,0.9991464673214902
12456,6723160.0,5.0,2019-11-15 20:01:16,热水器安装好几天了热水器外观漂亮大方上档次功能强大用起来方便显示很清楚服务人员态度很好美的热水器值得拥有下次还会选用美的的产品,0.9999999787410123
12457,6723160.0,5.0,2020-01-12 17:12:02,双十一买的价格很优惠物流是很快的这一点让我很满意还有就是师傅安装过程中很耐心不愧是大品牌推荐了朋友购买给个赞,0.9999806003218595
12459,6723160.0,5.0,2019-03-12 23:24:27,真的超级喜欢非常支持质量非常好与卖家描述的完全一致非常满意真的很喜欢完全超出期望值发货速度非常快包装非常仔细严实物流公司服务态度很好运送速度很快安装师傅很靠谱很满意的一次购物,0.9998902892778883
12460,6723160.0,5.0,2018-10-13 17:41:48,老热水器工作了八年光荣退休新热水器美的上岗外观简洁大方买的16升还能调整升数最关键的是可以保修八年对美的的售后还是很有信心的安装的时候比较复杂锯了部分柜子好在师傅带的工具还是很齐全的顺手帮我把旧的也拿走了很省心,0.9999989991508648
12463,6723160.0,5.0,2020-01-20 14:00:34,第一次购买师傅安装服务态度很好超实用放心用我选美的超放心的,0.8269311015309565
12468,6723160.0,5.0,2020-03-25 13:01:03,给安装帅哥点个赞非常专业没有收费安装很及时服务特别好家里是老年人爸妈不会用安装好教他们怎么用很感动好评支持美的,0.9993959196276639
12469,6723160.0,5.0,2018-11-11 21:26:53,京东的物流速度越来越快了发货前有人打电话给我说明收货的大致时间点个赞热水器的质量很好用了几天效果不错热水温度稳定外壳也挺漂亮的我选了客服推荐的香槟色美观大方美的是大牌子品牌可靠,0.9999522785500937
12470,6723160.0,5.0,2018-08-05 08:25:36,质量不错触摸灵敏声音小颜色很好看很高大上最主要给安装师傅点赞安装仔细负责美的售后越来越好了,0.9650842931931941
12471,6723160.0,5.0,2020-06-30 13:29:29,外形外观非常的美观安装服务因为时间的关系货还没有到师傅就到了；很耐心的等货到了安装恒温效果还没有通气待验证耗能情况待验证出水速度还可以,0.9782183020730592
12475,6723160.0,5.0,2019-12-14 23:42:44,美的热水器是大品牌安装工人服务态度很好装好后出水速度很快京东购物值得信赖,0.9998125011059472
12476,6723160.0,5.0,2019-10-19 14:38:30,外形外观很漂亮不错的选择恒温效果非常合适还可以随季节自动调节温度安装服务师傅非常专业几下就搞定了,0.9998935973574591
12477,6723160.0,5.0,2019-11-17 18:15:32,外形外观高端大气上档次恒温效果温度非常稳定打开水开头就有热水噪音大小非常小出水速度快超快安装服务态度很好耗能情况耗电量低,0.9999853372092714
12478,6723160.0,5.0,2019-11-03 10:20:50,外形外观外观比较好看噪音大小有类风声在卫生间就很小安装服务送货很快当天安装,0.9996093335843861
12480,6723160.0,5.0,2018-12-17 14:50:32,关注这款很久了一贯相信美的的技术水平和品质服务双十二果断下手送货安装都很快很顺利外观是我喜欢的土豪金最吸引人的16L大容量水气双调可变升强劲又节能关键是少有的8年包修首年只换不修让我无忧使用期待房子装修好后尽快享受,0.999999759187945
12481,6723160.0,5.0,2018-09-23 22:58:43,外观精美喜欢服务也好水温控制很好物流也快第一天拍下第二天就到了质量也稳定美的大品牌就是不一样感谢京东感谢美的谢谢给我的好产品好服务,0.9999726112048559
12483,6723160.0,5.0,2019-06-29 16:42:54,燃气热水器今天安装质量怎么样得时间来证明安装师傅安装的很细心也很负责整体安装效果很不错,0.6565954564422224
12484,6723160.0,5.0,2019-05-15 17:30:14,热水器很不错家里几个美的的产品了质量不错售后有保障安装师傅人很好下单第二天就来安装了推荐大家购买,0.8353718695153373
12485,6723160.0,5.0,2019-03-25 17:32:31,外观大气功能强大选了16升的到时候肯定很好用家里也是用美的的挺好用的现在再买一次送货很快货到安装师傅就过来装了师傅很好说话服务态度也很好很满意一次购物,0.9999839658890757
12487,6723160.0,5.0,2018-11-04 15:33:19,大容量出热水快好启动送货快安装师傅很负责客服态度也很好很热情有问必答朋友看到了也要买这款在京东买家电就是放心很愉快的一次购物,0.9955712508600402
12489,6723160.0,5.0,2018-10-20 12:12:29,京东物流真的特别快安装师傅认真负责技术好这款热水器美观大气又实用质量有保障价钱也很划算非常不错值得购买,0.9998843747642843
12490,6723160.0,5.0,2018-12-03 23:01:39,非常漂亮容量非常大安装人员非常仔细有耐心高端大气上档次,0.9990096052004849
12491,6723160.0,5.0,2019-09-04 13:50:00,外观大方漂亮质感很好显示屏操作方便四季免调容量也大厨房用洗澡用都很方便京东服务很好值得信赖,0.9999975114352929
12492,6723160.0,5.0,2019-04-02 13:17:55,热水器外观漂亮大方水压大双变频触摸屏节能环保质量好物美价廉售后服务很满意安装师傅安装细质服务态度好物流也很快很满意的一次购物,0.99997930371205
12494,6723160.0,5.0,2018-11-02 12:29:32,京东自营购物放心售后安装很贴心外观简洁漂亮触控很灵敏关键是价保一个月呀很放心购买这两天价格更优惠了通过价保退了差价给我给京东大大的赞,0.9999927106993506
12495,6723160.0,5.0,2018-06-09 20:26:04,非常好的一款热水器选了很多最终就选了美的物流也非常的快而且京东的物流态度服务都特别好安装的师傅也很专业颜色也好看简单大气非常喜欢也介绍朋友买了这一型号,0.9989907370445517
12496,6723160.0,5.0,2019-11-05 17:47:40,外形美观大方恒温效果极佳噪音不大免费安装师傅非常细心火力旺能耗低推荐朋友也要买,0.9987561802857311
12497,6723160.0,5.0,2018-08-19 13:45:43,特地使用了几天再来评价新房装修家电选择的几乎都是美的大品牌值得信赖正好有活动还免安装费果断下单物流速度超级快第二天一早就送达售后客服尽心尽责下单当天就来电预约安装时间上门安装的师傅技术很好装完还耐心讲解如何使用最后真的免安装费机器使用下来出热水快不会忽冷忽热出水量大一边洗澡一边厨房洗刷都够用十分满意的购物体验,0.6442567970195443
12498,6723160.0,5.0,2018-09-02 16:26:55,机器外观精美颜色也是高大上安装师傅服务很是周到连安装掉落的灰尘都用抹布擦的干干净净赞,0.6932706530268492
12500,6723160.0,5.0,2020-01-03 12:44:12,使用了一段时间了出水量大特别舒服尤其是冬天太重要了质感也很不错按键也大操作方便,0.9890440208115352
12503,6723160.0,5.0,2019-11-04 11:26:10,物流真的很快凌晨下单当天就送到了安装师傅速度也很快热水器也很好性价比高出水速度快真的很满意美的大品牌值得信赖,0.9999943356602156
12504,6723160.0,5.0,2018-06-25 09:10:33,京东快递发货速度挺快的来安装时间等的有点迟不过安装师傅提前预约时间美的服务还是非常不错安装完成后细心讲解热水器的使用方法试了一次质量很好热水快点火声音也不大,0.935899211888727
12505,6723160.0,5.0,2018-11-30 12:05:44,安装师傅很好很客气进门还穿鞋套很讲究也很热情安装也很专业也有耐心就是材料费花了总体来说还是挺不错的推荐哦美的售后也很放心,0.9997974314234145
12508,6723160.0,5.0,2018-08-31 21:40:53,下单接着就发货了很快送到家里京东购物非常给力美的燃气热水器第二次购买了一直用的没问题简单方便支持国货热水器工业产品产品质量很好值得购买,0.989761743493849
12509,6723160.0,5.0,2019-02-20 15:31:01,物流非常快今天下单明天到后天安装服务非常到位产品质量非常好安装师傅的态度技术也非常好产品用起来非常舒心热水来的很快而且不间断比以前的好好多了非常喜欢美丽的产品值得点赞,0.9943291125489199
12510,6723160.0,5.0,2019-12-15 17:49:23,外形外观很经典很漂亮恒温效果效果杠杠的噪音大小还好出水速度很快安装服务很满意耗能情况还没测试应该不错在特价的时候买的京东还是不错的这次装修所以东西全是京东购入一如既往的支持,0.999999999378937
12511,6723160.0,5.0,2018-08-19 11:26:33,安装完成了机器很好正好赶上815水流水温都不错数字显示屏很清晰师傅说了这款有防冻功能冬天别关电源,0.8903818478868315
12512,6723160.0,5.0,2019-12-15 23:27:43,外形外观外观很大气很喜欢恒温效果水气双调用的舒心安装服务售后很热情打了好几次电话询问安装师傅很专业明码收费,0.9981148694282159
12515,6723160.0,5.0,2019-12-07 22:16:39,外形外观颜色漂亮恒温效果效果很好噪音大小声音很小出水速度出水很快安装服务安装师傅很专业耗能情况耗能小,0.9998219809543668
12516,6723160.0,5.0,2018-10-22 06:19:20,美的服务就是好安装师傅也很负责我的排烟孔打小了师傅也帮忙解决了不错不错使用效果好出热水很快,0.8761838694949602
12517,6723160.0,5.0,2019-11-22 18:22:01,外形外观外观时尚大气很不错恒温效果买回用了几天总体感觉温度稳定还没有出现忽高忽低的情况噪音大小噪音较小因为装在厨房外的小阳台基本听不到声音出水速度出热水速度比之前的要快这样长期下来可以节省不少水安装服务安装师傅很负责本人因为工作都是白天上班白天家里没人所以约了几次都没约上但是安装师傅为了将就我晚上等我下班了才来装安装过程很顺利还把注意事项都一一告知我安装完成都已经是晚上9点多饭都没有吃真的是很负责在京东买东西一百个放心,0.9959567520844468
12518,6723160.0,5.0,2019-12-14 15:25:58,外形外观简约大气恒温效果暂未使用刚收到货送货上门服务态度很好开箱查验货物完好无损包装很到位等有时间立即预约安装价格也比实体店便宜很多京东购物很安心,0.973484423320361
12519,6723160.0,5.0,2018-04-24 12:28:57,京东物流没得说快一直就再京东购物每次都很满意热水器自己安装的特别等安装后使用过才来评论特别好使上热也快赞,0.9532394652628131
12521,6723160.0,5.0,2019-10-09 15:06:38,外观大方秀丽响声小且纯正出水快屏显舒服美的的质量还是让人放心的特别表扬安装小哥超敬业,0.9999987816096404
12522,6723160.0,5.0,2018-08-11 18:57:06,为美的京东服务点个东西下货很快发货可以自己预约送货安装时间一个下午搞定啦果然是大品牌服务有保障热水器试用了出水效果很好,0.8262643323426276
12523,6723160.0,5.0,2019-11-27 12:18:22,头天晚上下单第二天送货及安装就位出水量大温度稳定可根据不同的用水目的调节出水升数很满意,0.7632890251556691
12524,6723160.0,5.0,2019-11-23 22:04:31,外观很好看出热水速度也很快用起来体验非常好水量也够用很好的一款热水器,0.999874819140925
12526,6723160.0,5.0,2018-08-19 11:34:03,首先给美的售后一个大大的赞冒雨前来安装安装师傅服务很好根据家里的烟道情况专门为我设计了烟道防止日后雨水倒流美的服务值得信赖,0.998722587518688
12527,6723160.0,5.0,2019-01-07 20:51:42,热水器外观漂亮大方上档次功能强大用起来方便显示很清晰服务人员态度很好服务到位家里老人用也很方便美的热水器值得拥有下次选热水器还要选美的的,0.9999999745936037
12529,6723160.0,5.0,2019-12-24 12:01:46,非常感谢京东商城给予的优质服务物流配送各方面都非常好送货快配送员也非常热情安装师傅也很负责材料费是安标准收取的没有乱收费热水器外观看着挺大气也容易操作非常满意,0.8834961376500238
12530,6723160.0,5.0,2018-11-05 23:27:19,美的电热水器性价比很高的美的电热水器产品节能环保遥控控制容量大水量大加热快速产品安全实用耗电少价格合理售后服务非常好的深受广大消费者的信任和好评等用的时候再给大家反馈,0.8376393363266302
12532,6723160.0,5.0,2019-03-17 17:47:14,送货快活动买的比原价优惠很多超级好一如既往的支持京东美的大品牌质量没得说安装很快用着很爽相信你没问题赶紧下手不后悔赞赞,0.9999968980230556
12534,6723160.0,5.0,2020-01-31 18:07:06,外形外观此热水器外形美观适用物流速度也很快安装服务态度给力给予好评恒温效果好非常好噪音大小无噪音出水速度出水速度行快安装服务安装态度很好耗能情况节能,0.999897879623914
12535,6723160.0,5.0,2019-11-05 08:29:11,外形外观外观很漂亮噪音大小基本上没什么声音恒温效果还行出水速度很快安装服务服务态度很好耗能情况暂时还没发现总之对热水器很满意,0.9999615128388177
12536,6723160.0,5.0,2019-11-11 09:48:38,热水器颜值高快递服务好送货快美的售后安装小哥热心负责非常满意的一次购物,0.8895703735374241
12537,6723160.0,5.0,2019-12-01 13:40:42,质量非常的好外观外形也非常好看一直相信京东自营的品质绝对正品安装师傅也非常细心会继续支持京东,0.9996154555534756
12538,6723160.0,5.0,2018-09-15 10:09:03,一直以来购买电器都是选择美的的质量没话说这次平台做活动优惠力度很大刚好装修新房再次买了美的热水器到货速度和安装速度很快安装服务也好这次安装和耗材费也节约了很不错的,0.9970075657921442
12539,6723160.0,5.0,2019-10-07 21:34:06,出水速度快外形外观漂亮大气噪音大小噪音小安装服务安装人员服务规范有礼快递人员送货快很棒,0.9999534931159526
12540,6723160.0,5.0,2018-08-30 09:36:57,热水器的选择很艰难在国外的林内能率在国内的海尔方太等热水器之间做了细致的比较最终选择了美的美观大方安全实用价格实惠也希望美的越做越好越做越大,0.999998698197043
12541,6723160.0,5.0,2018-11-13 21:05:45,热水器非常大器美观买来新房子用的还没开始用但是家里的家电都买了美的的相信美的,0.9976887846023804
12542,6723160.0,5.0,2018-08-21 19:12:54,已经使用一个星期了才来评价质量真心不错功能强大水气双调还有厨房一键洗适合家庭主妇使用安装师傅耐心解答快递给力不愧是大品牌售后服务跟踪及时大大的赞,0.9985501894495287
12543,6723160.0,5.0,2018-11-03 15:10:43,安装师傅很不错给个赞试用了一下效果很好热水器声音不是很大卫生间离厨房比较远选择了16L的出热水速度挺快的整体比较满意一直信任京东京东的售后没的说必须五星,0.7742062037518175
12544,6723160.0,5.0,2019-11-16 23:58:15,双十一买的发货很快安装安排很及时外观挺好的很大的一部机器外观高档但是家里没通煤气没有办法试用质量感觉很不错美的毕竟大牌子买了准没错不是顶级但也不会错师傅收费很透明除了加的两条进水管没其他收费安装免费,0.9977268101132756
12545,6723160.0,5.0,2018-11-05 17:53:39,特意选了美的大品牌天然气16L热水器一厨两卫用16L绰绰有余送货也及时安装态度很满意热水器时尚大方很前卫目前对产品都很满意,0.9999262727642667
12547,6723160.0,5.0,2019-12-17 16:12:35,外形外观漂亮大方出水速度可以安装服务服务到位恒温效果可以噪音大小声音非常小耗能情况节省,0.99998462169785
12548,6723160.0,5.0,2018-09-19 17:21:51,外观整体非常好看大气快递配送也是当天就送达美的的安装师傅非常专业高效很快就到现场并且安装到位就是目前还没有通气通电使用后续用一段时间再来评价,0.9919995453437184
12549,6723160.0,5.0,2019-10-10 13:37:01,外形外观大气上档次恒温效果非常理想噪音大小很小出水速度很大安装服务非常热心,0.9999950977384078
12550,6723160.0,5.0,2019-12-21 11:41:35,外形外观外形很好挺好看的噪音大小噪音比较小比原来家里使用的好多了美的就是不一样出水速度出水速度不错安装服务安装非常棒服务态度非常好安装及时技术杠杠的恒温效果恒温效果好,0.9999999960708315
12551,6723160.0,5.0,2018-10-16 09:10:07,这款美的热水器买来颜值很高看起来很高大上大家都很喜欢然后买来了很快就有师傅来安装了安装很顺利只是现在还没通气还没使用感觉应该是没问题的期待好用,0.9878953322839844
12553,6723160.0,5.0,2020-04-25 13:56:01,外形外观非常漂亮高端大气上档次恒温效果好噪音大小好出水速度好安装服务非常满意师傅上门防护措施很好安装很认真仔细干完活还把环境卫生清理的很干净师傅辛苦啦耗能情况低,0.9999998528539508
12554,6723160.0,5.0,2018-12-27 15:27:01,京东发货就是快客服服务态度好很满意打开看了特别大气上档次呢买的16L大容量的够用的了售后上门安装也很快非常棒的一次购物体验谢谢,0.9796450346508012
12556,6723160.0,5.0,2018-11-16 10:08:14,双十一购买的美的16L热水器12日下午就到了这送货速度真的一流13日下午安装师傅上门安装十分专业活干得干净利落没收一分安装费真正免费安装太给力了热水器美观大气出热水快太棒了洗衣机我也准备买京东的这服务一流百分之百点赞,0.7327856564907951
12557,6723160.0,5.0,2018-11-20 14:49:35,买时客服太度很好介绍的很到位物流也很快送货到家里客服态度也很好安装师傅态度很好细节处理的很到位使用的很不错热水速度很快一直在京东买东西很愉快的一次网购,0.9998390649639386
12558,6723160.0,5.0,2019-03-25 09:22:24,暂时还没有使用使用以后在追加评论不过很喜欢这款物流也很快服务也很好,0.994088243936456
12559,6723160.0,5.0,2019-12-03 18:53:58,送货速度很快东西也跟描述的一样安装师傅也挺专业没有安装费挺满意的,0.9304667409042083
12560,6723160.0,5.0,2019-10-20 15:49:41,外形外观美观出水速度快安装服务认真负责商品收到后当天就安装好商品外观很美观而且也很实用大气上档次,0.9999884905550452
12561,6723160.0,5.0,2019-02-26 10:48:08,刚安装好还没使用产品外观美观大气与描述相符触摸时手感也很舒服做工精致板面简洁总体还是比较满意的谢谢卖家客服的服务,0.9999346314118991
12562,6723160.0,5.0,2019-11-23 15:07:41,外形外观简洁大方噪音大小基本没什么噪音出水速度很快使用很方便安装服务安装师傅认真负责恒温效果好,0.9999794847959136
12564,6723160.0,5.0,2019-03-20 17:05:55,东西不错送货速度快质量很好质保时间长是全新的京东买东西还是挺靠谱的,0.9990539870804266
12565,6723160.0,5.0,2019-05-19 18:07:59,性价比高而且这款机器高大上安装师傅人很好让他喝水都不愿意而且安装很到位相信美的大牌子今晚宝宝可以舒服的洗澡,0.985637470862167
12566,6723160.0,5.0,2018-08-13 19:10:56,这款热水器外观非常漂亮颜色也很正装好使用了下出水量比以前旧的大很多美的大品牌家里很多电器都是用的美的包装那些都很结实送过来没有丝毫破损,0.9999976363753601
12568,6723160.0,5.0,2019-04-07 11:23:17,物流快服务一流安装师傅很快产品大气很好满意,0.9998292216198766
12570,6723160.0,5.0,2019-12-31 15:53:14,3/6页57东西收到很满意真的是超级好的卖家解答疑问不厌其烦细致认真关键是东西好而且货物发得超快包装仔细值得信赖安装服务非常满意安装过程非常安心比较细心,0.9999140264247566
12571,6723160.0,5.0,2019-08-22 08:26:08,使用半个月后评价金色外观大气价格是在最低时购入出水量比较温和水温也比较适宜当天下单第二天就送货上门打三天就安装完毕安装师傅也很礼貌客气细心周到值得购买让人放心,0.9998553036260551
12572,6723160.0,5.0,2019-11-18 16:10:38,外形外观外形简洁美观操作简单即使是老人也能很好的使用恒温效果恒温效果好不用经常调整热水器温度安装服务安装服务很到位因为家里房子比较老了管道什么的一直没有重新弄所以安装时遇到了不少困难不过工作人员很负责一直弄到晚上十点多第二天又也跑过来中午之前给弄好了这点真的很感动器材也都有价表明细出水速度出水速度很快以前家里用太阳能水温难调冬天基本用不了换成了燃气的方便太多本来担心6楼顶楼水压不够结果水压很大,0.999998585606683
12573,6723160.0,5.0,2018-12-30 20:58:59,美的热水器值得信赖看起来高端帅气上档次美的的安装师傅专业给力很晚了外面温度很低又大风都还过来帮忙安装而且安装完还帮忙搞好卫生nice,0.99539221665078
12574,6723160.0,5.0,2018-11-18 13:21:00,到货特别快第二天就给我安装调试好了功能很强大外观大气时尚热水效果稳定天冷了来的正是时候,0.9999271392398588
12575,6723160.0,5.0,2018-10-24 11:29:05,京东物流就是好订货后立马联系安装服务安装价保明确安装师傅准点到达安装速度快安装质量非常可靠天然气接头处密封很好产品看上去也非常喜欢相信美的大牌子售后一级棒赞一个,0.9519710110182878
12577,6723160.0,5.0,2019-03-27 21:28:22,昨天下的单今天就送到安装好这速度太棒了比去实体店方便多了热水器也很棒温度够比电热水器好太多之前还一直担心燃气的不好安安装师傅一看马上知道在哪安合适棒棒的,0.9970970174141766
12578,6723160.0,5.0,2019-12-28 13:03:17,外观大气比我家以前的那个品牌好很多了物流速度非常快我很满意,0.9999570921610719
12581,6723160.0,5.0,2018-07-19 23:54:25,很不错很精致一直信赖美的的产品安装师傅很认真很迅速安装的也很快装好了后试了下热水源源不断很好用,0.9999374440667751
12582,6723160.0,5.0,2018-10-18 09:29:06,物流速度很快安装售后也很及时到位按约定时间到家里安装安装师傅很热情很快安装完毕还帮我打扫了卫生绝对给个赞热水器加热很快水量不错个人感觉很不错的热水器,0.9997819399393997
12583,6723160.0,5.0,2019-02-10 17:24:48,热水器不错外观金色大气好看试了下热水上的挺快的专门去卫生间来热水看了热水很足安装师傅很尽职尽责热心肠棒棒哒,0.9845120096973081
12584,6723160.0,5.0,2018-11-23 16:30:55,双十一下单卖家和物流的服务态度都很好预约安装师傅很专业这款热水器颜色不错能正常使用后期使用以后再追加评论,0.781924710765586
12585,6723160.0,5.0,2019-10-18 18:14:25,外观金色的很喜欢今天买隔天就到货预约安装时间也来的很准时安装服务也很到位现在还没开始使用相信美的赞赞,0.9976983034567641
