id,product_id,score,comment_time,comment
11023,100006961267,5,2020-05-17 17:34:11,美的热水器还不错今天售后师傅已经安装好了由于我安装位置耗材料较多还是给了100多安装辅材费用机子很不错可以连wifi智能控制外观香槟金比较大气夏天不要零冷水功能可以关闭冬天再打开零冷水功能节约天然气等我使用一段时间再买几台送人吧
11024,100006961267,5,2020-06-06 16:04:59,不错的东西水温稳定不用设定太高的水温38度就可以了原来的要设定50度还是或冷或热的安装还可以但师傅说原的的角阀不能用要用他带来的換了4个阀加上煤气阀要200多打个9折185苐二图是新的第三图是换下的
11025,100006961267,5,2020-06-28 07:44:44,外形外观比较美观大方的颜值不错恒温效果被0冷水误导了如果是旧的安装没留回水孔实际意义不大要在洗脸盆出接通容易冷热水混了如果还有其他龙头打开所以我直接关了这个0冷水功能钱花冤枉了噪音大小噪音比原来的好多了最起码没有啪啪的打火声音
11026,100006961267,5,2020-05-06 21:41:40,外形外观外观非常时尚漂亮简约大方看着也很舒服整体效果非常好看恒温效果恒温效果也还可以温差可以说用手感觉不到噪音大小噪音那更是没的说相比其他热水器噪音要小得多比我家的油烟机声音还要小得多做饭炒菜的时候几乎听不到热水器的声音出水速度出水速度一般吧可能是因为房子大的原因还有没安装零冷水的h法第1次打开等了好一会儿才来热水安装服务安装师傅是一个年轻的小哥服务态度非常好大热天的来到乡下安装水都没喝一口遗憾的是安装师傅电锤在路上搞丢了我自己又去借了一把在乡下条件只有这样子不可能让师傅自己回去拿吧总体来说安装师傅态度比较好耗能情况能耗的话现在应该还不清楚用一段时间再说吧安装师傅说零冷水的话比较费气费电感觉安装师傅技术比较一般服务态度比较好
11027,100006961267,5,2020-05-02 23:54:41,出水速度快噪音大小不大恒温效果稳定安装服务快捷耗能情况有待观察外形外观小巧零冷水版本需要安装个水阀和单向水管安装过程很快声音不大外形小巧可以wifi控制提前预热希望省气
11028,100006961267,5,2020-06-15 10:15:01,6月5号熬夜零点39秒下单付款抢购的说是要送我礼品到现在还没有发放联系了美的客服他让我联系京东客服后来说数量有限赠完即止但我从头到尾没有看见宣传上面说这句话猛然有一种上当的感觉亏我这么多年对京东的信任热水器还没有用看着质量是不错等装起来以后再追评
11029,100006961267,5,2020-06-18 13:04:06,噪音大小声音有点大外形外观外观看着还不错安装服务安装费用挺贵的燃气管自己买的其他安装费就花了差不多小三百出水速度零冷水挺好的不浪费水比较智能连续开关两下可以自动开启零冷水功能
11030,100006961267,5,2020-06-30 11:18:33,款式不错师傅安装耐心手艺好因为这个是带回水功能的热水器加上水电师傅预留的孔位不是很理想导致需要的接管有些多但是不影响整体还是很满意不错
11031,100006961267,5,2020-06-22 16:49:58,由于房子装修才在水电改造也就没法安装但美的的品牌及服务我都信赖家里空调空调扇微波炉电饭煲净水器等等都是用的美的这次热水器也用他了烤箱洗碗机消毒柜也准备用美的五星必打
11032,100006961267,5,2020-05-24 22:25:01,恒温效果忽冷忽热尤其关水后开水后明显开龙头还是要放冷水达不到零冷水承诺安装服务态度很好但做事不精细无回水管的H阀装在热水器上没装在远端技术没过关哦最后是我自己改过来的
11033,100006961267,5,2020-05-07 21:23:55,美的热水器好好好支持国产货技术一流好用没有冷水方便快捷价格实惠家庭必备
11034,100006961267,5,2020-05-27 15:34:12,外形外观外观好看大气噪音大小声音挺小的还可以总体还不错
11035,100006961267,5,2020-05-11 14:55:58,两个安装师傅安装服务态度都可以热水器零冷水的信赖美的品牌
11036,100006961267,5,2020-06-24 17:29:27,装上了还没用看上去挺大气的挺好看的质量应该不会差毕竟大品牌
11037,100006961267,4,2020-06-03 16:12:46,使用一星期了热水效果不错但是循环热水没有太多感触家里用习惯燃气热水器了这款烧水挺快不用浪费凉水了只是安装挺不给力的原本约好周六安装结果周六一天没人来我给客服打电话安装师傅又改周日了周日来了以后又安装不了因为没有带打孔机最好周一才安装完成我也真是醉了helliphellip连续折腾三天一家老小全都没法洗澡
11038,100006961267,5,2020-05-30 13:29:46,外形外观外观看起来评论美丽恒温效果没有用啊这咋知道噪音大小同上应该不大出水速度同上安装服务安装的倒是挺快的安装时候注意安装师傅会偷偷换掉自带的配件的一些东西然后用他自己的然后就收费贼高290他以为我没看见把换掉自带的那俩管子放自己包里去了成年人这种事情说出来怕是搞得大家都不好看安装时候各位自己注意耗能情况还没有用啊宣传得倒是挺好的
11039,100006961267,5,2020-07-09 22:05:29,送货速度很快师傅安装也很尽责就是安装产生的费用高零冷水用的阀另外收费热水器连接水管也要收费我是用最基本的配件安装费用都要两百多不合理
11040,100006961267,4,2020-05-21 20:25:54,安装服务师傅挺好的爸妈特别交代要给人家好评因为确实挺好的安装材料费也在能接受的范围
11041,100006961267,5,2020-06-18 15:36:10,外形外观不错恒温效果待定安装服务师傅相当不错了耗能情况待定
11042,100006961267,5,2020-06-21 18:36:01,外形外观收到货了外观感觉挺好的一个月之后再安装安装服务待安装
11043,100006961267,5,2020-06-21 13:45:56,外形外观好漂亮恒温效果好噪音大小小有点点声音几乎可以忽略不计出水速度零冷水
11044,100006961267,5,2020-06-27 10:48:45,东西不错已安装完成都是智能产品
11045,100006961267,5,2020-06-06 13:57:29,外形外观漂亮恒温效果满意噪音大小满意安装服务满意耗能情况满意
11046,100006961267,5,2020-06-10 00:25:51,这次购买的热水器感觉是原厂正品没有出现故障的现象整体效果不错比上次的好多了但是有一点不得不说美的燃气热水器出厂必须做到严格检测有问题的产品杜绝出厂切实加强对售后人员的培训学习给客户营造一个好的购物环境
11047,100006961267,5,2020-06-21 21:06:27,还好特别是安装的郭师傅给力
11048,100006961267,5,2020-07-07 13:43:29,师傅安装及时热情态度好
11049,100006961267,5,2020-06-19 11:48:08,外形外观漂亮大方美观好
11050,100006961267,5,2020-05-31 22:44:16,外形外观简洁大方噪音大小一般不会很大安装服务服务尚可
11051,100006961267,5,2020-06-28 16:21:49,安装师傅服务蛮好技术也不错
11052,100006961267,5,2020-07-06 19:13:47,外形外观外形美观安装服务安装态度好
11053,100006961267,5,2020-05-02 23:27:16,挂上了还没有完全装好外观不错
11054,100006961267,5,2020-06-25 09:35:10,一直用美的热水器大品牌放心这次给家里人买的因为是老房子管道问题安装师傅跑了两次耐心负责好评
11055,100006961267,5,2020-07-05 16:09:41,外形外观外观看着大气漂亮出水速度快恒温效果好噪音大小不大
11056,100006961267,5,2020-06-18 22:07:39,恒温效果效果不错不会一冷一热噪音大小声音不是好大
11057,100006961267,5,2020-06-18 00:16:21,外形外观颜色好看出水速度很快噪音大小声音不大
11058,100006961267,5,2020-06-21 15:28:36,安装完成安装满意点赞
11059,100006961267,5,2020-06-22 14:52:22,0冷水很给力声音有些大安装费很贵
11060,100006961267,5,2020-06-20 10:52:04,安装服务师傅上门及时服务态度好技术优秀解释清晰满意
11061,100006961267,5,2020-06-15 14:29:15,服务准时安装专业好
11062,100006961267,5,2020-05-16 17:52:49,物流配送及时安装师傅也及时来安装美的大品牌值得信赖
11063,100006961267,5,2020-06-15 11:50:03,已快速收到货过段时间才安装相信品质没问题
11064,100006961267,5,2020-06-06 19:00:54,还不错安装师傅还挺负责的热水出得挺快
11065,100006961267,5,2020-06-03 16:10:35,安装服务送货师傅安装师傅都比较靠谱给个赞产品刚安装具体怎么还没用后期再来评价
11066,100006961267,5,2020-06-08 16:35:10,外形外观漂亮出水速度待用后追评恒温效果待用后追评安装服务服务到位噪音大小待观察耗能情况待用后追评
11067,100006961267,5,2020-06-28 17:41:53,好评感觉还不错符合预期如果有需要下次还会购买
11068,100006961267,5,2020-06-19 22:36:25,还没有用昨天订货今天到货到货后安装师傅就来安装了
11069,100006961267,5,2020-05-23 19:12:52,外形外观外观精美好看安装服务师傅认真负责
11070,100006961267,5,2020-06-22 07:54:35,不错美的服务周到出热水也挺快的
11071,100006961267,5,2020-07-02 10:39:21,大品牌一切放心品质物流服务安装都挺好
11072,100006961267,5,2020-07-03 12:29:16,安装服务安装及时外形外观美观大方出水速度快
11073,100006961267,5,2020-06-19 11:23:05,出水速度还行5秒内安装服务速度快外形外观简约
11074,100006961267,5,2020-06-03 16:22:37,安装服务服务好态度好干活麻利收费合理
11075,100006961267,5,2020-07-08 20:07:44,喜欢在京东购物物流快质量也有保证
11076,100006961267,5,2020-06-11 07:25:47,送货态度好安装师傅跑了好多次值得好评
11077,100006961267,5,2020-06-14 18:04:08,安装服务安装师傅安装专业时效性高服务态度好
11078,100006961267,5,2020-06-06 18:12:42,安装师傅服务态度好还没使用等待使用后再追评
11079,100006961267,5,2020-06-25 07:36:42,外形外观好看恒温效果这个还没有使用安装服务需要额外费用
11080,100006961267,5,2020-06-26 11:28:48,机子送货售后都挺好就是安装的人太不专业了
11081,100006961267,5,2020-06-08 11:06:46,安装满意师傅专业入室还自带鞋套
11082,100006961267,5,2020-05-15 12:19:52,安装服务师傅上门安装准时耐心讲解操作步骤
11083,100006961267,5,2020-06-18 23:53:06,外形外观漂亮恒温效果还没有试安装服务还不错
11084,100006961267,5,2020-06-13 11:34:15,还没有装刚刚收到用后好评
11085,100006961267,5,2020-06-24 19:30:49,外形外观好看恒温效果不错吧没用呢噪音大小没听到安装服务安装师傅不错
11086,100006961267,5,2020-06-21 07:40:45,外形外观大小适中噪音大小挺好的
11087,100006961267,5,2020-06-26 18:48:07,目前看起来不错安装人员服务好
11088,100006961267,5,2020-06-19 13:51:09,外形外观安装完好感谢师傅安装服务好
11089,100006961267,5,2020-06-20 10:25:15,安装送货均到位好还没通气用
11090,100006961267,5,2020-06-17 07:30:43,还没安装呢一直信赖的美的
11091,100006961267,5,2020-06-06 16:05:22,机器外观漂亮安装师傅服务好
11092,100006961267,5,2020-07-06 21:20:52,东西还可以颜色也喜欢
11093,100006961267,5,2020-06-29 13:34:10,安装服务上门及时服务规范好评
11094,100006961267,5,2020-05-26 10:39:33,安装上门及时服务态度不错
11095,100006961267,5,2020-05-21 20:36:56,触摸屏时尚安装的到位
11096,100006961267,5,2020-07-09 23:58:26,还是不错的美的值得拥有
11097,100006961267,5,2020-06-03 10:37:12,安装速度比较快服务态度好
11098,100006961267,5,2020-06-20 18:42:58,安装服务服务好态度好收费合理
11099,100006961267,5,2020-06-16 09:36:56,安装师傅细心安装耐心讲解
11100,100006961267,5,2020-06-24 19:03:51,美的热水器质量好品质好
11101,100006961267,5,2020-06-20 12:11:14,安装服务马志刚师傅安装满意
11102,100006961267,5,2020-06-06 19:06:20,安装服务服务周到细心好评
11103,100006961267,5,2020-07-07 11:22:19,售后服务好安装服务好
11104,100006961267,5,2020-05-17 15:46:48,安装服务好安装及时物流快
11105,100006961267,5,2020-06-20 12:54:39,师傅安装及时安装满意
11106,100006961267,5,2020-06-22 11:33:23,服务好态度好收费合理
11107,100006961267,5,2020-06-21 12:43:25,安装挺快的服务也好
11108,100006961267,5,2020-07-07 12:49:05,安装完毕售后服务好
11109,100006961267,5,2020-05-28 14:29:52,东西不错服务好好评
11110,100006961267,5,2020-06-22 15:16:25,安装满意技术一流
11111,100006961267,5,2020-06-05 16:49:37,产品质量不错安装师傅服务专业到位
11112,100006961267,5,2020-06-11 17:39:26,安装服务满意外形外观漂亮出水速度快耗能情况低
11113,100006961267,5,2020-06-25 15:07:23,大品牌值得信赖还没安装后期再来追加评价
11114,100006961267,5,2020-06-24 16:41:39,师傅已安装完成服务态度好
11115,100006961267,5,2020-06-16 11:21:22,安装服务态度好服务满意
11116,100006961267,5,2020-05-17 18:25:07,安装师傅上门及时态度好
11117,100006961267,5,2020-05-14 12:59:40,安装满意安装服务安装满意
11118,100006961267,5,2020-05-26 12:02:08,安装服务安装师傅认真负责
11120,100006961267,5,2020-06-20 19:47:21,安装服务满意服务态度好
11121,100006961267,5,2020-05-02 14:52:26,安装到位服务满意
11122,100006961267,5,2020-07-09 11:56:56,安装服务安装完成满意
11123,100006961267,5,2020-06-07 17:29:34,售后服务好安装师傅技术好
11124,100006961267,5,2020-06-07 13:08:53,安装服务安装到位速度快
11125,100006961267,5,2020-06-06 14:12:55,外形外观漂亮恒温效果不错噪音大小小出水速度快耗能情况少
11127,100006961267,5,2020-05-17 17:53:00,安装售后服务好满意
11128,100006961267,5,2020-06-19 15:43:33,安装冉师傅服务态度好及时安装
11129,100006961267,5,2020-06-12 17:02:58,安装服务上门及时服务态度好
11130,100006961267,5,2020-06-22 09:48:23,安装师傅服务态度好
11131,100006961267,5,2020-06-06 16:23:03,安装服务快速满意
11132,100006961267,5,2020-06-22 14:31:05,安装服务师傅服务态度好安装迅速
11133,100006961267,5,2020-07-07 11:39:15,安装满意师傅服务好
11134,100006961267,5,2020-07-04 13:46:47,安装服务安装及时服务到位
11135,100006961267,5,2020-06-21 18:48:18,安装服务安装规范服务满意
11136,100006961267,5,2020-07-02 13:03:18,安装服务安装师傅上门及时服务态度好
11138,100006961267,5,2020-07-10 17:44:26,师傅安装好服务满意
11139,100006961267,5,2020-06-20 09:37:41,安装服务安装快服务满意
11140,100006961267,5,2020-07-09 09:55:55,安装服务上门及时服务到位
11141,100006961267,5,2020-06-25 19:24:55,安装服务安装及时服务满意
11143,100006961267,5,2020-07-08 12:31:08,安装服务安装满意服务到位
11144,100006961267,5,2020-07-09 12:29:12,安装服务安装满意服务好
11145,100006961267,5,2020-07-01 20:50:25,因为是新家天然气还没开通因为有优惠提前买回来安装师傅专业不坑带你上分啊买了配件自己买的烟管师傅说不符合天然气标准只能用他带来的还有ppr管及弯头等配件还在最远端装H阀不知道效果怎么样期待冬天到来可以有个好效果
11146,100006961267,5,2020-06-16 14:57:47,还没安装不知道效果安装完后在评价期待安装完的效果
11147,100006961267,5,2020-06-08 14:15:49,送货安装都很快由于燃气还没有开通水管和燃气管还没有接上呢不知道使用效果等以后用了再来补评论
11148,100006961267,5,2020-06-23 14:24:20,已经装好了要等到开通燃气才知道效果装修还要收200零冷水材料费搞不懂
11149,100006961267,5,2020-06-18 19:25:40,活动买的等到下个月再安装期待效果不错相信京东自营
11150,100006961267,5,2020-07-02 18:30:52,现在搞活动先买好房子还没装修好等安装过后再来追评
11151,100006961267,5,2020-06-21 20:29:39,货收到了还没预约安装期待效果用过后来追评
11152,100006961267,5,2020-05-02 15:43:12,已收货漂亮等安装后看使用效果
11153,100006961267,5,2020-06-11 21:41:18,暂时还没有使用不知道怎么样安装费用挺贵的
11154,100006961267,5,2020-06-25 14:09:29,东西收到还没了安装使用使用后追加评论
11156,100006961267,5,2020-05-01 16:59:27,货物已经收到包装完好送货服务到家等待安装先来抢个沙发
11157,100006961267,5,2020-06-14 12:05:46,上门安装好机器美观
11158,100006961267,5,2020-06-01 08:39:52,送货速度超快凌晨十二点下单八点多就到货了京东物流赞
11159,100006961267,5,2020-05-02 10:28:52,物流速度非常快1号下单2号收到服务态度也非常好因为还在装修所以无法安装上等使用后再追加京东服务必须五星
11160,100006961267,5,2020-06-12 08:37:01,还没有使用要看看使用之后有没有问题
11162,100006961267,5,2020-06-20 10:09:53,出水速度好外形外观好安装服务好
11163,100006961267,5,2020-06-18 19:29:07,外形外观包裹很严实期待后面安装使用
11164,100006961267,5,2020-07-06 16:04:31,今天装好了等侍天燃气开通就能用了
11165,100006961267,5,2020-06-17 00:42:42,刚装上还没有点火用后追加评论
11166,100006961267,5,2020-06-09 16:01:11,暂时还没安装安装好来评论
11168,100006961267,5,2020-05-17 10:10:14,安装服务安装师傅到位
11169,100006961267,5,2020-06-13 11:48:39,师傅安装专业及时
11170,100006961267,5,2020-06-16 11:44:43,机器安装好非常满意
11171,100006961267,5,2020-05-15 16:59:17,外形外观美观暂时安上
11172,100006961267,5,2020-06-05 09:29:09,很好看档次狠高
11174,100006961267,5,2020-06-19 06:34:25,收到货了还没有安装评价后追
11175,100006961267,5,2020-05-13 12:21:07,安装及时服务满意
11176,100006961267,5,2020-06-25 19:04:07,安装服务满意
11177,100006961267,5,2020-07-04 13:05:15,师傅服务非常好
11178,100006961267,5,2020-06-25 14:28:38,售后服务很好
11179,100006961267,5,2020-06-28 08:53:46,还没装呢装了使用后再来评价
11180,100006961267,5,2020-07-06 16:05:23,不错性价比高
11181,100006961267,5,2020-06-02 10:57:16,安装师傅服务好满意
11183,100006961267,5,2020-05-27 19:41:49,安装服务好评
11184,100006961267,5,2020-06-14 17:33:33,安装完成非常满意
11185,100006961267,5,2020-06-09 10:39:08,安装快服务快
11187,100006961267,5,2020-06-14 17:50:16,师傅安装满意
11195,100006961267,5,2020-06-01 13:49:36,未用了等装了在评
11196,100006961267,5,2020-06-19 12:21:43,安装及时正规好评
11199,100006961267,5,2020-06-20 22:11:37,家里的不好用活动买客服但是师傅说不能用零冷水功能就放当普通的用吧有送豆豆的活动便宜希望其他功能好希望好用
11200,100006961267,5,2020-07-04 11:50:10,外形外观第一眼下单就是因为他的外观恒温效果还没试噪音大小还没有试
11201,100006961267,4,2020-07-06 12:19:49,还没有开始用不知好不好但安裝师傅服务不错看起来很漂亮给一个好评
11202,100006961267,5,2020-06-07 22:06:56,机器看着不错性价比高售后安装也很及时服务态度好还自带脚套不错
11203,100006961267,5,2020-07-07 10:16:32,已经收到货并安装调试好感觉还可以希望效果理想具体用了再评
11204,100006961267,5,2020-06-23 15:16:57,送货安装都很快效果也不错一次愉快的购物体验
11206,100006961267,5,2020-06-23 10:04:31,京东物流很快送货人员态度很好客服服务周到
11207,100006961267,5,2020-06-21 21:53:05,618买的价格不知道是否优惠看起来不错还没使用
11208,100006961267,5,2020-06-02 18:52:35,昨天晚上下单今天一早就收到货物流非常给力
11209,100006961267,5,2020-06-20 15:46:20,师傅态度非常好进门穿鞋套戴口罩十分满意
11210,100006961267,5,2020-05-10 11:19:57,外形外观大气恒温效果好出水速度快
11211,100006961267,5,2020-06-30 11:13:08,帮哥哥家买的应该还不错信赖京东
11212,100006961267,5,2020-06-20 06:14:21,热水器不错温控比之前的好太多了
11213,100006961267,5,2020-06-21 22:39:40,送货速度快服务态度好非常满意
11218,100006961267,5,2020-06-20 06:06:29,不错很好用我推荐给朋友购买
11219,100006961267,5,2020-06-18 18:32:21,安装服务非常满意辛苦小哥啦acute-omega-
11220,100006961267,5,2020-06-08 19:31:40,物流非常好送货到家谢谢小哥
11221,100006961267,5,2020-07-09 18:32:49,外形外观快递很好很早送到
11222,100006961267,5,2020-06-29 12:35:50,安装服务安装师傅态度好
11223,100006961267,5,2020-06-11 21:10:22,安装服务安装师傅很专业
11224,100006961267,5,2020-05-20 11:10:02,没有安装等用了之后再评
11225,100006961267,5,2020-05-19 22:45:26,快递包装好快递员态度好
11226,100006961267,5,2020-05-16 20:37:00,物流速度挺快的不错
11227,100006961267,5,2020-07-10 14:57:54,安装服务服务非常满意
11228,100006961267,5,2020-07-06 13:26:05,安装服务安装很好满意
11229,100006961267,5,2020-06-29 15:32:01,外形外观还没用先好评
11230,100006961267,5,2020-06-27 12:56:29,安装服务师傅态度很好
11231,100006961267,5,2020-06-21 16:54:45,安装服务安装好服务好
11232,100006961267,5,2020-06-20 20:31:29,满意非常满意师傅热情
11233,100006961267,5,2020-06-20 12:08:16,618大促好便宜希望质量好
11234,100006961267,5,2020-06-14 16:34:45,师傅服务态度好很专业
11235,100006961267,5,2020-06-13 11:50:57,安装服务安装好服务好
11236,100006961267,5,2020-06-07 16:18:27,安装服务安装的很满意
11237,100006961267,5,2020-06-06 11:20:16,喜欢就好哈
11238,100006961267,5,2020-05-24 09:22:05,安装服务售后服务挺好
11239,100006961267,5,2020-07-09 11:28:00,安装服务服务很满意
11240,100006961267,5,2020-07-06 11:29:11,售后服务很好很满意
11241,100006961267,5,2020-07-03 10:57:12,安装小哥服务态度好
11242,100006961267,5,2020-06-29 10:39:01,对安装师傅非常满意
11243,100006961267,5,2020-06-28 11:34:01,小哥很热心非常满意
11244,100006961267,5,2020-06-21 10:47:09,安装收费服务态度好
11246,100006961267,5,2020-06-18 22:22:22,外形外观漂亮的好用
11247,100006961267,5,2020-06-18 14:28:59,好评送货快性价比高
11248,100006961267,5,2020-06-11 11:10:35,安装师傅服务非常好
11249,100006961267,5,2020-06-09 10:57:22,售后师傅服务非常好
11250,100006961267,5,2020-06-07 22:14:17,从配送到安装都很好
11251,100006961267,5,2020-06-07 18:31:58,安装服务态度好迅速
11252,100006961267,5,2020-06-03 14:28:30,好非常非常好
11253,100006961267,5,2020-06-02 16:55:48,师傅服务态度好满意
11254,100006961267,5,2020-05-19 15:03:24,安装师傅很认真负责
11255,100006961267,5,2020-05-12 12:44:58,安装服务师傅挺好的
11256,100006961267,5,2020-07-10 15:44:56,商品很好安装满意
11257,100006961267,5,2020-07-10 15:10:54,安装服务非常满意
11259,100006961267,5,2020-07-07 12:20:46,安装服务安装迅速
11260,100006961267,5,2020-07-07 09:31:27,安装满意非常满意
11261,100006961267,5,2020-07-04 13:03:32,安装服务服务满意
11263,100006961267,5,2020-07-02 17:10:32,安装专业服务满意
11264,100006961267,5,2020-06-30 13:01:28,安装服务满意好评
11266,100006961267,5,2020-06-26 09:11:58,服务满意很快安装
11267,100006961267,5,2020-06-25 21:01:24,刚装好还没开始试
11268,100006961267,5,2020-06-24 16:10:24,安装师傅服务很好
11270,100006961267,5,2020-06-23 16:22:46,安装服务装的不错
11271,100006961267,5,2020-06-23 15:20:33,安装及时服务满意
11272,100006961267,5,2020-06-23 14:29:10,安装服务特别耐心
11273,100006961267,5,2020-06-23 13:41:54,安装服务安装及时
11275,100006961267,5,2020-06-22 18:03:25,安装服务态度很好
11276,100006961267,5,2020-06-21 10:38:20,安装快服务好满意
11277,100006961267,5,2020-06-20 22:09:51,售后安装非常满意
11278,100006961267,5,2020-06-20 16:33:15,安装服务十分满意
11281,100006961267,5,2020-06-13 12:52:46,师傅安装非常专业
11285,100006961267,5,2020-06-07 18:38:01,安装服务态度很好
11286,100006961267,5,2020-06-07 12:31:46,安装及时服务很好
11288,100006961267,5,2020-06-06 14:10:09,师傅安装专业满意
11289,100006961267,5,2020-06-03 18:30:47,过一段时间再安装
11290,100006961267,5,2020-06-02 16:27:56,售后服务很好满意
11292,100006961267,5,2020-06-01 12:56:44,安装服务服务很好
11293,100006961267,5,2020-05-28 18:26:50,安装完成非常满意
11295,100006961267,5,2020-05-24 14:42:29,安装及时服务完美
11296,100006961267,5,2020-05-23 12:16:47,安装服务态度良好
11298,100006961267,5,2020-05-17 08:46:07,货收到还没有安装
11299,100006961267,5,2020-05-14 12:12:10,安装服务非常满意
11301,100006961267,5,2020-07-09 14:25:31,对安装十分满意
11302,100006961267,5,2020-07-08 14:37:17,安装服务非常好
11304,100006961267,5,2020-07-08 11:06:54,刚买回来还没装
11305,100006961267,5,2020-07-05 18:00:48,热水器已安装好
11306,100006961267,5,2020-07-05 10:39:46,师傅安装很专业
11307,100006961267,5,2020-07-04 12:40:39,对售后服务满意
11308,100006961267,5,2020-07-02 12:26:23,安装师傅服务好
11309,100006961267,5,2020-06-28 16:25:38,安装服务非常好
11310,100006961267,5,2020-06-27 16:18:00,师傅很给力点赞
11311,100006961267,5,2020-06-25 11:49:27,真好用着真方便
