id,product_id,score,comment_time,comment,sentiment
41972,25745835099.0,5.0,2019-11-26 11:29:33,外形外观外形看起来简单大方显得很高档一分一分货客服很有耐心很周到售后服务态度很好,0.9999997756900286
41973,25745835099.0,5.0,2019-09-20 14:46:25,不错挺好用的安装也很简单方便,0.9555852767642294
41974,25745835099.0,5.0,2019-05-07 13:21:33,下单不久后就有工作人员联系之后师傅如期上门态度很好热水器很好用服务全程也周到不愧是大品牌,0.9763974274957435
41976,25745835099.0,5.0,2020-03-19 22:56:20,非常不错美的值得信赖,0.9995999594098618
41981,25745835099.0,5.0,2019-10-22 18:57:54,外形外观很耐看恒温效果还没有使用安装服务很好,0.9985605411411993
41983,25745835099.0,5.0,2020-05-16 15:33:21,安装服务这是让我最满意的一次购物客服态度专业热情发货速度安装师傅都很专业细心讲解如何使用很满意的一次购物,0.9989397896615614
41984,25745835099.0,5.0,2019-12-13 01:20:32,很好安装及时好用,0.7850732685261829
41985,25745835099.0,5.0,2019-09-18 11:57:35,美的安装收费合理客服态度不错哈我们家很多电器都是美的牌的,0.9061342268623601
41986,25745835099.0,5.0,2019-11-25 12:27:46,外形外观漂亮出水速度水压可调很大,0.9995528594701181
41988,25745835099.0,5.0,2019-07-18 15:13:59,机器做工很好看起来也很漂亮很喜欢,0.9991945230320297
41989,25745835099.0,5.0,2019-09-14 08:45:59,热水器声音小很扎实,0.7335092345080328
41990,25745835099.0,5.0,2020-03-02 09:30:44,很喜欢这款热水器好用没噪音服务好安装好,0.7976307162032752
41991,25745835099.0,5.0,2019-09-15 17:23:20,第一次在网上买热水器意想不到的惊喜客服态度很好耐心解答疑问发货速度超快买这款完全不用担心水压问题出水量超大性价比很高的一款,0.9999891070119665
41995,25745835099.0,5.0,2019-07-29 16:18:39,很好恒温而且可以调升数,0.7923376452279121
41996,25745835099.0,5.0,2019-08-28 22:04:01,感觉很好包装完整物流很快装好看起来很不错,0.9988252298907281
41997,25745835099.0,5.0,2019-11-17 11:02:12,安装服务整天安装还不错很快可以使用了,0.9805005454531617
42000,25745835099.0,5.0,2019-05-28 14:00:42,热水器高端大气还不错京东送货超快,0.9988374595603056
42003,25745835099.0,5.0,2019-10-17 13:35:31,送货快安装及时师傅态度很好机器很好用,0.715832873046667
42004,25745835099.0,5.0,2020-02-18 15:39:51,外形外观很好看恒温效果很好出水速度几秒就热了,0.9998477462457023
42009,25745835099.0,5.0,2020-02-06 14:19:25,外形外观好噪音大小小恒温效果好安装服务好物美价廉,0.9989858462839016
42012,25745835099.0,5.0,2019-07-27 00:10:49,名牌产品很好很大方很漂亮,0.9999654232964675
42013,25745835099.0,5.0,2019-09-12 15:26:47,很便宜每次买东西首选京东物流快速十分方便以后还会来买,0.9986278316394902
42014,25745835099.0,5.0,2019-10-31 16:03:15,热水器很好水温稳定安装师傅手艺也很不错,0.7975396318137513
42016,25745835099.0,5.0,2019-11-11 23:07:49,相当不错安全可靠热水出得快赞安装迅速服务满分,0.9933808140846857
42017,25745835099.0,5.0,2020-04-25 09:33:08,恒温效果非常好调温方便外形外观漂亮出水速度快,0.9998891452499126
42018,25745835099.0,5.0,2019-10-31 23:22:52,外形外观好恒温效果好噪音大小小出水速度快安装服务非常好耗能情况节能,0.9963673099589998
42019,25745835099.0,5.0,2019-07-17 14:32:42,送货快产品物美价廉满意,0.9584684424810362
42020,25745835099.0,5.0,2019-12-05 16:58:38,很不错恒温热水快,0.9769953607235928
42023,25745835099.0,5.0,2020-02-29 01:46:11,恒温效果非常快外形外观漂亮出水速度快确实很快点赞,0.9999992409572723
42025,25745835099.0,5.0,2019-07-08 16:38:34,物流速度还是一如既往的快热水器的静音效果爷很好,0.9941113105870589
42026,25745835099.0,5.0,2019-10-11 11:25:31,安装师傅不错很有耐心,0.6849158928981728
42027,25745835099.0,5.0,2019-09-17 22:52:08,收到机器很漂亮还没安装,0.7998025839416071
42029,25745835099.0,5.0,2019-11-21 17:38:09,平衡式热水器不错水温调节很方便,0.9360338481037067
42030,25745835099.0,5.0,2019-10-19 15:54:47,恒温效果不错外形外观很好噪音大小很小出水速度还不错安装服务单独管要收费,0.9999887915576793
42031,25745835099.0,5.0,2019-05-03 21:39:15,现在还没有装上因为之前的煤气还没有用完物流速度还是很快,0.964376994112658
42032,25745835099.0,5.0,2020-06-14 20:16:38,安装师傅热心服务周到五星好评,0.7101906359072834
42033,25745835099.0,5.0,2019-09-03 17:26:01,热水器不错方便安全外观漂亮安装师傅服务很好,0.9678455411148954
42034,25745835099.0,5.0,2019-05-04 08:42:34,很好小卫生间能装各方面功能符合,0.7337013432426109
42035,25745835099.0,5.0,2020-01-18 13:32:40,外形外观高大上恒温效果用过再评价,0.9940514575606926
42038,25745835099.0,5.0,2020-04-13 11:13:53,送货和安装都很快已经在使用了,0.7947422613916303
42039,25745835099.0,5.0,2019-10-28 08:39:26,不错热水很快声音不大还可以,0.8608677639464951
42040,25745835099.0,5.0,2019-10-20 15:58:04,发货很快第二天早上就收到了美的客服更快货到前已经联系安装事宜赞,0.6866424959386477
42042,25745835099.0,5.0,2020-03-25 16:58:18,声音很小用起来很不错,0.9039374269612772
42044,25745835099.0,5.0,2020-05-04 18:08:06,安装服务安转服务很好很到位,0.9628781498888612
42046,25745835099.0,5.0,2020-06-24 14:51:12,外形外观很好恒温效果很好出水速度5-8秒安装服务非常好,0.9983199190658228
42047,25745835099.0,5.0,2019-09-08 23:15:27,东西很不错晚上下单第二天就到好有速度,0.9684354000298167
42048,25745835099.0,5.0,2019-07-24 13:07:19,热水器不错性价比很高看起来美观大方,0.9997212777942958
42049,25745835099.0,5.0,2019-09-21 13:51:46,物流速度快安装师傅也很有耐心等用过后再来评价,0.7951162652329392
42050,25745835099.0,5.0,2020-01-06 13:25:09,性价比服务非常好,0.9493880292844241
42051,25745835099.0,5.0,2019-11-28 12:34:23,师傅安装很专业很用心服务又好五星好评,0.6593417150692724
42052,25745835099.0,5.0,2019-07-30 10:53:16,送货很快换上新的热水器很棒棒哦,0.9964405880118609
42054,25745835099.0,5.0,2020-05-29 12:13:35,安装服务安装师傅很细心服务态度很好完美,0.9198747096609862
42055,25745835099.0,5.0,2019-10-09 12:02:46,东西很好物流很快安装很同到,0.9278521716247022
42056,25745835099.0,5.0,2019-07-30 14:44:04,信赖美的用起来棒棒的售后师傅特别给力～,0.9998236030854387
42057,25745835099.0,5.0,2019-06-05 11:14:38,现在还没有装上因为要等装修好了才安装物流速度还是很快,0.6268540665648263
42058,25745835099.0,5.0,2019-10-28 13:44:38,安装服务配送很快安装迅速服务态度很好,0.7660532146131722
42059,25745835099.0,5.0,2019-09-16 09:34:53,非常满意的购物水温刚刚好,0.9091649888885753
42061,25745835099.0,5.0,2019-11-06 13:08:51,热水器很好用美的的质量就是好,0.8865461929632524
42066,25745835099.0,5.0,2019-12-17 22:50:10,美的大品牌一直值得信赖服务态度好得不得了必须点赞一开始下错单后台服务人员耐心解答问题一改再改都耐心跟进最终才弄明白什么叫平衡式发货也快预约上门的师傅热情周到的服务让人感动装好到现在已经使用三天静音效果真的很好水稳稳定方便果然优质优价,0.9999997120925049
42067,25745835099.0,5.0,2020-04-23 12:57:36,外形外观简洁大方恒温效果稳定舒畅噪音大小比较安静出水速度尚可接受安装服务一般满意耗能情况没啥感觉,0.9999998416415758
42068,25745835099.0,5.0,2019-12-13 18:06:32,恒温效果还可以温度基本比较稳定感觉比显示的温度低一点噪音大小一般整体比较低正常打火声音和允许的声音基本差不多比之前的好些外形外观还可以～挺百搭的颜色也比较合适做工没那么精细出水速度比较慢主要是出热水速度比预计时间久一些安装服务可以拆旧单独收费其他都还不错耗能情况一般因为前面出一段冷水才能用,0.9812732456935103
42070,25745835099.0,5.0,2019-10-11 04:15:45,外形外观外观美观大方大小合适恒温效果水温稳定不会忽高忽低噪音大小噪音比我以前的老万和小多了安装服务师傅上门安装收费合理态度好,0.9978814701558731
42071,25745835099.0,5.0,2020-05-04 17:15:07,智能热水器不错出热水速度快可以任意调温洗澡洗的舒服比旧式热水器好用多了后悔没早点换这台热水器推荐种草入手,0.6499395231746457
42072,25745835099.0,5.0,2020-05-11 15:05:45,外形外观挺好看的触屏的按钮反应挺快恒温效果水压正常的情况还可以噪音大小噪音不大出水速度挺快的安装服务师傅很专业耗能情况刚开始用耗能还不太清楚,0.9982546462429494
42073,25745835099.0,5.0,2020-03-22 11:57:01,用过才来评价玫瑰金外观时尚出水稳定水温均衡噪音小触控面板操作方便送货速度快安装师傅服务很细致,0.9994679757705431
42074,25745835099.0,5.0,2020-03-12 16:03:13,外形外观大方得体恒温效果水温恒定噪音大小几乎没有出水速度较快安装服务服务态度好耗能情况2级早就想换这款了之前的是旋转扭转温度这个是数码显示可以恒定温度而且操作简单方便家里老人和小孩都知道怎么调正值疫情期间依然第二天就到货当天安装值得点赞,0.9999861619614678
42075,25745835099.0,5.0,2020-04-10 14:56:28,外形外观小巧轻便土豪金颜色醒目好看安装服务安装小哥细心有礼安装稳当之前在上个房子住过用的是这款出水稳匀恒温效果佳重点赞下条烟管不锈钢双层排气,0.9999999780012991
42076,25745835099.0,5.0,2019-12-22 23:33:15,外形外观不占地方恒温效果热水快恒温好出水速度出水比较快安装服务小师傅热情负责,0.9996392359244368
42077,25745835099.0,5.0,2020-05-31 15:34:53,外形大气美观水温恒定老婆说买的好,0.94062949651087
42078,25745835099.0,5.0,2019-12-28 23:01:27,外形外观好恒温效果顺畅噪音大小接受出水速度平稳京东服务好物流特快美的天燃气热水器性价比高售后服务安装快服务好我的家用电器基本都是买用美的希望美的电器民族品牌越做越好,0.9999999529206318
42079,25745835099.0,5.0,2020-01-17 11:29:02,外观设计漂亮水温变升调节方便噪音不大送货安装服务快捷,0.9523162189912909
42080,25745835099.0,5.0,2019-12-22 21:39:56,美的热水器美观大方大品牌值得信但排气管独自配送有点奇葩要等5天才到还有排气管无配螺丝与锡纸望改进,0.9990631876937659
42081,25745835099.0,5.0,2019-12-12 22:14:05,挺好看的外观设计不错噪音也小用了几晚感觉不错,0.9993394319230832
42083,25745835099.0,5.0,2020-02-16 16:24:46,外形外观外观漂亮美观大方恒温效果我家水压小有时候不稳定但是这热水器的出水温度稳定恒温控制很好,0.9999999552792569
42084,25745835099.0,5.0,2019-07-08 22:24:54,发货快服务好安装也方便机器时尚百搭出水快我家高层水压低水温水量都很稳定比之前的煤气热水器好用的多,0.9902092185516419
42088,25745835099.0,4.0,2020-04-29 17:11:29,经过综合筛选比较选定了这一款性能和安装各方面情况都好只是发生了水箱漏水的情况这种情况发生的几率比较小但是我中彩了客服很热情处理速度也很快我重新购置了一台安装服务也很及时热情接下来再看一看使用的情况相信美的的品牌和品质希望能够做得更完美,0.8854568067424707
42089,25745835099.0,5.0,2019-11-27 13:46:53,外形外观没什么特别的感觉不丑就是恒温效果保温效果还不错不会忽高忽低噪音大小噪音低毕竟刚刚使用出水速度出水量还是可以的安装服务这个够好耗能情况能耗在哪里自己看吧,0.9642792318378547
42090,25745835099.0,5.0,2020-06-29 19:19:24,外形外观时尚大气恒温效果效果良好噪音大小声音小出水速度快安装服务周到便捷耗能情况低,0.9998153626664641
42091,25745835099.0,5.0,2019-11-12 19:09:48,外形外观外观时尚恒温效果恒温效果好洗澡不会忽冷忽热了安装服务当天到货当天安装好评马上就可以用了效率刚刚的,0.9593778851471146
42092,25745835099.0,5.0,2019-11-27 07:21:52,噪音大小声音很小比较安静恒温效果感受不到有温度变化外形外观简洁看着很有质感,0.9999922531624865
42093,25745835099.0,5.0,2019-09-04 21:55:50,大品牌值得信赖触控式方便灵活升温快噪音小值得拥有,0.9999017461257834
42094,25745835099.0,5.0,2020-05-16 12:18:14,外形外观外面大气停好看噪音大小声音不大出水速度点火速度快,0.9980765389959667
42096,25745835099.0,5.0,2020-01-10 19:01:01,水温合适可以装室内效果不错运输速度快服务不错,0.9913879307207881
42097,25745835099.0,5.0,2020-03-02 17:20:01,外观时尚大方噪音小出水比原来8升的大产品不错安装服务一般安装人员配件工具没带齐没能按最佳的方式安装上,0.9979779140119807
42098,25745835099.0,5.0,2019-11-16 12:17:31,开始的时候买错了买了强排式的京东立即免费的退货了本热水器制热快音静恒温无冷感大品牌中最便宜的一款给京东点赞给美的点赞,0.9999732951516949
42099,25745835099.0,5.0,2019-12-01 00:31:45,安装服务师傅人挺好的因为浴室没插头还帮接电外形外观比以前的热水器大恒温效果挺好噪音大小没什么噪音,0.8614567297986757
42100,25745835099.0,5.0,2020-06-15 01:10:34,静音舒适美观helliphellip希望耐用,0.9337040138746983
42101,25745835099.0,5.0,2020-03-08 12:44:47,外形外观好恒温效果很好噪音大小一般出水速度要等10多秒才有热水出热水速度一般稳定温度洗澡舒服,0.9942215795868472
42102,25745835099.0,5.0,2020-05-14 21:13:58,外形外观大气好看噪音大小安静安装服务效率高出水速度出水量高,0.999959474776446
42103,25745835099.0,5.0,2020-04-25 20:57:37,平衡式热水器水量可变升声音有点大送货安装挺快,0.8897342994442279
42104,25745835099.0,5.0,2020-03-03 19:45:35,发货速度快安装服务好恒温效果出色噪音小,0.9627832233413255
42105,25745835099.0,5.0,2019-12-17 13:46:37,热水器安装后看上去美观大方功能齐全大牌子值得信赖,0.9998743274902498
42108,25745835099.0,5.0,2020-02-06 15:15:30,外形外观美观恒温效果水温恒定噪音大小较小出水速度够快安装服务较快耗能情况小,0.9992265958428432
42110,25745835099.0,5.0,2019-05-27 21:20:31,买了好一些时间了装上好用水温可调稳定美的值得拥有,0.99437954745798
42111,25745835099.0,5.0,2019-12-29 23:33:09,外形外观简约噪音大小比我以前的声音小安装服务免费安装就是辅料要钱速度挺快性价比高功能简单方便能够装在室内,0.9998470483593637
42113,25745835099.0,5.0,2020-01-06 16:46:09,刚装好试了下好用希望长时间使用没有问题原来的万家乐牌子就好一般使用感觉不好,0.8612185373791861
42114,25745835099.0,5.0,2019-11-28 15:44:15,恒温效果不错比之前的稳定多了噪音大小很小几乎听不到声音,0.979952217951618
42115,25745835099.0,5.0,2019-11-25 19:56:06,外形外观高大上恒温效果不错哦噪音大小噪音一般出水速度挺快的安装服务还不错耗能情况还可以,0.999968214605007
42116,25745835099.0,5.0,2020-03-22 17:24:32,大小刚刚好恒温方便安装的速度还可以,0.834901731060211
42117,25745835099.0,5.0,2020-07-10 16:21:51,前几天巳经安装好使用后觉得不错出水稳定流量大噪声小外形美观安装在浴室简洁实用,0.9891709555460871
42119,25745835099.0,5.0,2019-07-22 06:39:00,推荐下八年质保上门安装平衡式的热水器进出风在外边不错,0.9029567436442768
42120,25745835099.0,5.0,2020-05-26 09:42:16,用了多年的热水器终于换新了目前使用一周感觉还不错美的产品值得信赖安装小哥人也很好赞,0.9999543182280252
42121,25745835099.0,5.0,2020-02-24 16:45:35,噪音大小噪音小恒温效果水温稳定外形外观外观时尚大气,0.9999855075395174
42123,25745835099.0,5.0,2019-08-21 09:32:12,已使用了一段时间调好温度后恒温效果特好水温不会自动增减用的放心,0.6314474230142072
42125,25745835099.0,5.0,2020-02-18 15:35:58,给老人家用使用简单方便十分安静满意,0.9023576528979381
42126,25745835099.0,5.0,2020-05-25 22:32:06,正常使用质量可以按装快,0.6706273475073442
42128,25745835099.0,5.0,2020-01-15 23:49:26,外形外观外形和做功很好噪音大小声音有点大恒温效果不错,0.999981988028024
42129,25745835099.0,5.0,2019-11-13 17:42:14,美的师傅安装很用心好评美的平衡式10升热水器价格公道质量不错,0.9937967048593586
42131,25745835099.0,5.0,2019-06-26 15:06:13,给新家装修买的安装好了颜值挺高的期待耐用,0.9255205116533877
42132,25745835099.0,5.0,2019-06-08 08:06:37,颜值较高大小合适操作简便不用设冬夏模式平衡燃烧安全有保障,0.9996971225257415
42133,25745835099.0,5.0,2020-05-03 16:48:57,外形外观简洁大方恒温效果好噪音大小接受范围内出水速度快安装服务好,0.9999985145709009
42134,25745835099.0,5.0,2019-11-24 20:00:00,热气感觉还不错温度比较恒定可以变升,0.794213621070404
42135,25745835099.0,5.0,2019-10-04 12:14:37,安装服务师傅服务态度挺好第一次来孔不合适没有装后面还给推荐了打孔师傅外形外观颜色也好看,0.9350206828621038
42136,25745835099.0,5.0,2020-01-04 17:17:55,热水器装好美的一直最信奈的品牌我家电器基本都是美的,0.9874901542009373
42138,25745835099.0,5.0,2020-03-31 11:40:38,外形外观外观好看恒温效果效果好安装服务安装快态度好,0.9999430037568294
42139,25745835099.0,5.0,2019-12-22 15:42:16,外观感觉不错晚上点火后再看看,0.8756310292176914
42140,25745835099.0,5.0,2019-10-12 22:30:42,外观时尚好看热水来得快及稳定相信美的产品,0.9984332371160259
42141,25745835099.0,5.0,2020-03-18 16:32:23,送货快安装快服务好产品不错且使用方便,0.9756552142616338
42142,25745835099.0,5.0,2019-11-10 18:06:22,外形外观好看恒温效果还没有用应该可以第二次购买噪音大小没什么声音出水速度快速安装服务快速耗能情况这个用下去才知道吧,0.9950967228139205
42146,25745835099.0,5.0,2019-09-06 17:59:12,京东物流真的又快又好美的热水器看起来棒棒的配件又完善下次电器我还会选美的,0.9998883868250513
42148,25745835099.0,5.0,2020-03-19 18:01:08,外形外观操作简单恒温效果水温恒定安装服务疫情期间到货当天就安排安装,0.9147295106861029
42152,25745835099.0,5.0,2020-05-14 16:06:26,外形外观好出水速度好安装服务好满意,0.9983808521501107
42154,25745835099.0,5.0,2019-11-15 21:31:59,送货快产品质量不错好看美丽又大方,0.9999055051251314
42155,25745835099.0,5.0,2020-05-25 19:14:14,外形外观美观恒温效果出水稳定恒温效果好,0.9999131150489526
42156,25745835099.0,5.0,2020-04-20 15:51:09,应为只有浴室可以安装就找了一下发现种类很少价格还不低但是为了百分百安全的着想选了这一款送货安装都很快比前一阶段肺炎严重时要快多了,0.9993675415243606
42158,25745835099.0,5.0,2019-12-22 16:47:12,外形外观好看恒温效果速度噪音大小安静出水速度快,0.9999397986311258
42159,25745835099.0,5.0,2020-04-15 06:46:42,外形外观好恒温效果好噪音大小小安装服务好,0.9978755840698992
42160,25745835099.0,5.0,2020-02-20 13:01:21,外形外观美观实用恒温效果挺好的安装服务挺好的,0.9999209023283306
42162,25745835099.0,5.0,2020-02-18 18:21:00,出水速度昨天收到货今天就上门安装好了服务不错美的售后部还主动给我打电话约时间安装好评,0.6593160061030372
42163,25745835099.0,5.0,2020-02-03 10:39:55,外形外观漂亮噪音大小小安装服务主动联系安装快,0.9993655591877085
42164,25745835099.0,5.0,2019-10-23 15:48:20,机器不错安装服务及时目前使用中一切正常用一段时间再看,0.9460887545002867
42165,25745835099.0,5.0,2019-09-09 13:05:51,用了好几天了还不错价格比较合理热水很稳定家里空调洗碗机led都是美的的品质还是信得过,0.991305870181337
42166,25745835099.0,5.0,2019-05-24 21:36:48,外观漂亮造型大气智能调控大品牌值得信赖,0.9999981306458094
42167,25745835099.0,5.0,2020-01-17 18:05:56,美的产品应该是最美的,0.9757737874664693
42168,25745835099.0,5.0,2019-08-13 17:25:00,物流还是比较快安装在厨房用起来也给力关键颜值挺高的性价比挺不错,0.9978462405984679
42171,25745835099.0,5.0,2020-07-01 12:42:30,安装服务安装及时满意外形外观好看,0.9912607853158321
42172,25745835099.0,5.0,2019-11-02 02:58:51,挺好的安装师傅上门也快整体满意希望耐用不要出问题就好,0.8701048862922364
42173,25745835099.0,5.0,2019-05-04 11:31:24,刚刚安装完简单易用总体还不错希望能耐用,0.9859578720403468
42174,25745835099.0,5.0,2019-11-01 21:14:20,外形外观大方大气触碰按钮操作便捷,0.9985474672148855
42175,25745835099.0,5.0,2020-03-15 20:44:04,美的一如既往的好用实在,0.9585722777486002
42177,25745835099.0,5.0,2020-06-09 15:04:31,已安装好服务好满意,0.7766854607227582
42179,25745835099.0,5.0,2019-11-29 10:28:23,外形外观还不错简单大方恒温效果不错安装服务挺有速度的,0.9999996805328978
42181,25745835099.0,5.0,2020-03-12 14:46:09,帮亲戚购买的能放在卫生间使用安装配送速度快,0.7359041265731536
42182,25745835099.0,5.0,2020-02-05 10:08:30,外形外观可以比较智能有安全感安装服务快装安师傅细心,0.995144897640976
42183,25745835099.0,5.0,2019-10-30 19:16:37,特意用了一段时间来评价的不错大品牌就是好安装人员也热情周到,0.9991029582217581
42184,25745835099.0,5.0,2020-03-01 15:51:24,外观漂亮出水较快能耗暂时不知道,0.9300838510351797
42185,25745835099.0,5.0,2019-05-06 17:43:34,挺好的现在平衡式的热水器越来越少这个可以款式也好看,0.9468106201401321
42188,25745835099.0,5.0,2019-12-07 20:05:07,安装服务赞外形外观美恒温效果好出水速度快,0.9997487374915283
42189,25745835099.0,5.0,2019-10-24 17:43:35,颜值高安装及时美的不错,0.9694272967878972
42191,25745835099.0,5.0,2019-09-26 13:54:13,外形美观送货快安装也快美的值得捅有,0.9063162695951424
42193,25745835099.0,5.0,2019-12-21 22:10:32,恒温效果好噪音大小小安装服务极速外形外观与卫生间搭配和谐,0.998530661996193
42194,25745835099.0,5.0,2019-11-24 13:00:14,送货速度快第二天下午就到了预约安装速度也还可以（自己开的玻璃孔）整体外观和性能家人喜欢装在浴室安全方便,0.9883627481866691
42195,25745835099.0,5.0,2019-12-09 16:36:36,外形外观还不错恒温效果温度控制的挺好比之前万家乐强多了出水速度挺快,0.9999979641482222
42196,25745835099.0,5.0,2019-10-22 21:39:15,安装一个礼拜使用不错没有什么噪音热水也快,0.6154095304810625
42197,25745835099.0,5.0,2019-08-21 20:09:59,美的大品牌值得信赖这款属于平衡式可安装在室内安全有保障外观简洁整体使用效果不错,0.9999999853298958
42198,25745835099.0,5.0,2020-04-29 11:32:38,出水速度快噪音大小小恒温效果好耗能情况低安装服务到位外形外观好看,0.9975045193145945
42200,25745835099.0,5.0,2020-04-06 22:21:10,外形外观好看恒温效果好噪音大小能接受出水速度快安装服务好,0.9997935485975332
42201,25745835099.0,5.0,2019-06-16 19:39:55,京东的发货速度一如既往的快安装好了还不错,0.996706356936643
42202,25745835099.0,5.0,2019-10-08 13:21:34,外形外观美观恒温效果适度噪音大小适合出水速度稳定安装服务优秀耗能情况节能,0.9999333662101579
42205,25745835099.0,5.0,2019-07-10 10:15:43,用了几天感觉不错声音也不大热的速度也快,0.7215697132466852
42207,25745835099.0,5.0,2019-06-24 09:13:40,新房装修用的平衡式适用于卫生间相信美的的质量有保证,0.9172001832209653
42208,25745835099.0,5.0,2019-06-02 07:59:26,加热稳速度快安全可靠东西不错,0.9670465710197733
42209,25745835099.0,5.0,2019-09-15 15:03:15,安装师傅很专业事前有询问情况后面因自己的问题也得到美的的妥善解决相信当初的选择hellip10年买的美的空调现在还在用不错,0.8485423654233439
42210,25745835099.0,5.0,2019-09-15 13:16:49,物流快服务态度好价格合理质量好美的一直是可以信赖的品牌,0.9993982650767471
42212,25745835099.0,5.0,2019-10-25 12:22:19,热水器装好了感觉不错,0.6031216322746674
42214,25745835099.0,5.0,2019-09-18 20:09:03,美的品牌热水器今天预约装好外观和使用功能符合预期,0.9717853560042483
42215,25745835099.0,5.0,2019-10-11 14:53:37,挺不错的恒温出水速度都可以没什么噪音,0.9789158233945826
42217,25745835099.0,5.0,2020-06-25 16:52:13,大牌厂家的产品质量有保障服务好值得信赖,0.9987118238432265
42218,25745835099.0,5.0,2019-10-28 21:59:47,外形外观时尚好看安装服务专业,0.998541530828003
42219,25745835099.0,5.0,2019-07-19 09:23:04,产品挺好静音服务也好,0.8758320354356893
