id,product_id,score,comment_time,comment,sentiment
29239,66879216254.0,5.0,2020-06-24 15:51:52,样子很好看声音确实小一直喜欢美的的产品,0.9867450484648606
29240,66879216254.0,5.0,2020-06-07 10:34:49,外形外观漂亮大气安装服务师傅很不错还给我们准备了安装资格证书还没有使用使用后追评,0.9984512654711593
29241,66879216254.0,5.0,2020-06-03 11:54:20,安装很好师傅很专业产品外观大方漂亮很喜欢,0.9998700196014126
29242,66879216254.0,5.0,2020-06-24 16:00:27,外形外观高颜值的一款零冷水京东买大牌子就是给力刚装好等装好燃气开始使用放在小阳台特别好看,0.990437605230813
29243,66879216254.0,5.0,2020-07-10 16:29:47,外形外观外观时尚大气设计感强噪音大小噪音不大安装服务安装师傅认真热情耐心安装满意出水速度出水速度比较快618的时候买的看了很久最后选了这一款零冷水的dt7美的燃气热水器等美的热水器的安装师傅安装以后试了一下确实不错没有失望,0.9983263230184664
29244,66879216254.0,5.0,2020-07-04 15:49:21,外形外观就是冲着颜值买的果然很好看5星好评安装服务可以耗能情况暂时还未投入使用希望使用后会更喜欢,0.9830891754376958
29247,66879216254.0,5.0,2020-04-23 22:05:59,外形外观时尚安装服务专业外观真的很美丽很喜欢等开通燃气后再追评,0.9998691299562792
29249,66879216254.0,5.0,2020-06-22 21:05:53,安装服务安装很及时一个电话第二天就装上了外形外观外观很大气老婆很喜欢性价比很高,0.9995907620372017
29251,66879216254.0,5.0,2020-05-05 22:07:55,还没安装外观很时尚用后再来评,0.8821492211106384
29252,66879216254.0,5.0,2020-05-28 12:16:38,非常满意安装也很快服务态度也很好值得购买,0.9884740738431861
29253,66879216254.0,5.0,2020-07-07 09:46:44,热水器很好用外观也不错安装师傅也是很给力好评,0.8273884248109127
29254,66879216254.0,5.0,2020-05-14 20:31:25,外形真是太好看了安装师傅也特别负责安装到位客服小姐姐特别温柔快速帮我解决问题等通完风就可以用上了,0.6292047952560134
29255,66879216254.0,5.0,2020-05-12 17:18:48,很不错外观好看零冷水也能用,0.9713188036821678
29256,66879216254.0,5.0,2020-06-29 11:09:11,外形简洁使用方便安装师傅服务态度非常不错,0.968310598946538
29257,66879216254.0,5.0,2020-05-29 13:17:04,外观全白颜值很高师傅安装很专业服务态度很好,0.9037140776414356
29258,66879216254.0,5.0,2020-06-06 22:50:58,东西不错很便宜很实惠,0.9961620064579486
29259,66879216254.0,5.0,2020-06-28 20:51:43,外形外观不错恒温效果不错噪音大小很小出水速度很快安装服务服务到位耗能情况良好,0.9999906647736304
29263,66879216254.0,5.0,2020-06-27 15:23:12,包装很好产品很漂亮相信美的大品牌,0.9981162195636698
29264,66879216254.0,5.0,2020-06-26 14:13:11,很漂亮一直买美的的电器,0.9959270197046488
29266,66879216254.0,5.0,2020-06-27 11:27:18,送货快安装专业这款热水器很好用美的大品牌值得信赖,0.9989948170034443
29268,66879216254.0,5.0,2020-06-20 23:34:29,外形外观外形很漂亮功能很好出水快评5星,0.9999148806693661
29269,66879216254.0,5.0,2020-06-11 21:31:21,美观大气噪声小体验完美,0.9926753369886318
29270,66879216254.0,5.0,2020-05-04 16:21:38,外形外观还算满意安装服务美的的售后服务很好也很专业,0.9997853995120546
29271,66879216254.0,5.0,2020-07-01 15:38:36,外形外观很漂亮恒温效果待使用看效果安装服务傅很专业,0.9998984459079222
29272,66879216254.0,5.0,2020-07-08 10:54:17,安装服务安装师傅非常专业细心外形外观非常好看,0.9928877134139797
29276,66879216254.0,5.0,2020-06-30 16:19:15,安装服务安装及时服务周到非常满意,0.9296650303041681
29277,66879216254.0,5.0,2020-06-20 16:44:35,安装服务安装满意很好,0.7221538617464317
29278,66879216254.0,5.0,2020-06-05 18:15:13,外形外观好看安装服务特别好非常好,0.9972060473439364
29279,66879216254.0,5.0,2020-05-18 17:31:41,安装服务服务挺好的很热情,0.9305680892047742
29282,66879216254.0,5.0,2020-05-16 15:05:11,安装服务非常满意外形外观很好看,0.9971467165402287
29283,66879216254.0,5.0,2020-07-08 15:19:32,安装服务安装很好服务很到位,0.8601100553859894
29286,66879216254.0,5.0,2020-06-23 11:46:00,态度好服务好非常满意,0.8151199840849427
29287,66879216254.0,5.0,2020-06-24 17:47:20,安装服务已按装好非常满意,0.6460092157709719
29290,66879216254.0,5.0,2020-04-05 13:27:20,安装服务安装非常满意赞,0.8914939430166109
29291,66879216254.0,5.0,2020-05-26 22:43:52,外形外观外形美观大方家人都喜欢恒温效果恒温效果专业人员试机后不错出水速度出水速度厨房卫生间都不错安装服务安装服务电话预约后很及时安装好后免费试机调试耗能情况耗能情况目前看和描述相符具体情况以后再测试噪音大小噪音总体来说不错动静不是太大,0.9999918233969176
29294,66879216254.0,5.0,2020-06-23 23:05:15,外形外观漂亮恒温效果还可以噪音大小可以接受的范围出水速度还可以安装服务安装波纹管比较用心耗能情况比有些品牌更节能,0.9996576395419785
29295,66879216254.0,5.0,2020-05-15 17:13:57,外形外观美观简洁恒温效果恒温舒适安装服务师傅安装仔细满意,0.9999245514388956
29296,66879216254.0,5.0,2020-05-30 22:38:07,外形外观液晶大屏幕漂亮安装服务工作人员服务周到,0.9998691913587301
29297,66879216254.0,5.0,2020-06-07 17:30:51,外观漂亮恒温效果好噪音小安装服务好,0.9983530541164647
29298,66879216254.0,5.0,2020-06-09 15:29:14,外形外观时尚简约安装服务师傅专业噪音大小还未使用,0.991977323184674
29299,66879216254.0,5.0,2020-05-24 13:17:52,外形外观好看恒温效果可以噪音大小小出水速度正常安装服务好耗能情况可以,0.9989328826690711
29300,66879216254.0,5.0,2020-06-06 13:06:10,今天热水器装完了尺寸合适效果也好,0.6960818378867861
29302,66879216254.0,5.0,2020-06-20 12:12:02,已安装质量不错大品牌值得信赖,0.9980003801050371
29303,66879216254.0,5.0,2020-06-06 21:28:12,外形外观外观不错安装服务安装师傅不错安装好了认真等使用后在看看,0.9986871156086966
29304,66879216254.0,4.0,2020-06-19 16:11:15,东西已经收到618期间买的价格实惠美的品牌总体服务还可以,0.9591034106810943
29305,66879216254.0,5.0,2020-06-29 18:14:55,外观大气价格实惠大牌就是好,0.9998831781797273
29306,66879216254.0,5.0,2020-07-04 22:42:16,外形外观外观干净管路安装整齐,0.9982507700276736
29307,66879216254.0,5.0,2020-06-21 14:21:09,外形外观外形比较美观恒温效果以前也是买的美的热水器相信它的品质,0.999955507428696
29308,66879216254.0,5.0,2020-06-30 18:24:24,外形外观蛮漂亮的还没装修好还没有试,0.9994902276090283
29309,66879216254.0,5.0,2020-07-06 12:06:09,外形外观漂亮安装服务快速服务好安装满意,0.9992036583647385
29310,66879216254.0,5.0,2020-06-20 10:34:52,安装服务师傅服务态度好外形外观不错,0.9743594280767994
29311,66879216254.0,5.0,2020-06-15 14:35:04,安装完了还没使用感觉挺好的,0.7717299170852683
29314,66879216254.0,5.0,2020-06-11 10:43:52,送货速度还没拆外观不错,0.984302403499937
29315,66879216254.0,5.0,2020-07-04 13:25:24,安装服务安装满意细心观察细节帮我做好了调试,0.9861894974152438
29316,66879216254.0,5.0,2020-06-20 21:35:03,京东物流速度一流不过新房还没装修好等装好了再来说明效果,0.9938024921997023
29317,66879216254.0,5.0,2020-06-07 13:34:34,货收到了还没有安装呢等安装好在来追评值得信赖,0.8931575065508012
29318,66879216254.0,5.0,2020-06-08 14:16:58,外形外观全家美的套装虽然还没安装但是还是很期待效果,0.9998770697826116
29319,66879216254.0,5.0,2020-07-05 16:48:24,送货挺快的还没有安装等安装完晒效果期待使用,0.9719091665282094
29320,66879216254.0,5.0,2020-05-06 10:44:39,数码产品都是在京东上购买有保障而且都会买保险,0.9335340207810702
29321,66879216254.0,5.0,2020-06-21 17:18:22,还没有安装使用但是看评价还不错期待惊喜,0.9872064571864694
29327,66879216254.0,5.0,2020-06-22 12:35:45,安装满意给师傅点个赞,0.6192403798144329
29328,66879216254.0,5.0,2020-06-23 21:49:31,外形外观简约美观恒温效果因未通气暂时还不知道后期通气使用会再追加评论噪音大小声音看安装环境一般情况可以接受,0.9871930724742617
29329,66879216254.0,5.0,2020-06-21 11:07:11,房子的的装修还没完成看了好多最终选择了这款趁着618活动买了安装完成后再来追加评价,0.7410362637014131
29330,66879216254.0,5.0,2020-06-20 18:32:37,装修囤货中房子没有装修好等装修好再安装,0.8585951186866422
29336,66879216254.0,5.0,2020-06-24 22:06:07,送货速度挺快的性价比高比实体店便宜很多,0.996470624303948
29341,66879216254.0,5.0,2020-06-22 22:21:05,外观还蛮好看的整体还不错,0.9989278660180391
29343,66879216254.0,5.0,2020-06-09 11:32:07,装好了满意,0.6695092181080199
29346,66879216254.0,5.0,2020-06-22 10:35:15,特别满意哟,0.7685315274283836
29352,66879216254.0,5.0,2020-06-15 10:41:54,噪音大小小恒温效果很棒,0.9055872939048987
29358,66879216254.0,5.0,2020-06-08 12:54:20,安装服务好态度很好,0.6956036196777202
29362,66879216254.0,5.0,2020-06-23 14:39:25,还不错物流蛮快的,0.874081432407868
29364,66879216254.0,5.0,2020-05-26 14:35:55,完美～安装服务完美,0.9251984085346959
29365,66879216254.0,5.0,2020-05-26 10:46:24,认真负责非常满意,0.6487873605519539
29376,66879216254.0,5.0,2020-06-06 11:12:58,服务非常完美,0.8143542522663793
29379,66879216254.0,5.0,2020-07-05 09:40:26,安装一级棒,0.9304682499651161
29380,66879216254.0,5.0,2020-06-29 16:19:51,非常好谢谢,0.7172908717489199
29381,66879216254.0,5.0,2020-06-29 12:36:47,出水速度快,0.7840854487943292
29394,66879216254.0,5.0,2020-06-07 21:55:07,东西收到了还没有联系师傅安装关于产品质量暂时无法评价唯一不顺心的就是物流配送这么大的热水器居然没有帮我送到楼上有损京东平台形象京东是以家电数码壮大的总结京东的优点就是高质量服务建议加强物流配送服务监管体系特别是这种大件家电不是卖出去就OK了从运输到配送到安装售后都是消费者极为看重的最后申明写这些东西不是单纯为了发泄情绪而是信赖京东希望他更好,0.96629474828795
29418,66879216254.0,5.0,2020-06-28 22:26:39,认准美的牌热水器外观大气质量很好会介绍朋友来买满意的一次购物,0.9875607730476776
29423,66879216254.0,5.0,2020-06-27 14:27:03,外形外观很漂亮安装服务很到位收费合理噪音大小水泵工作时的噪音尚可接受恒温效果零冷水效果真的很棒水龙头打开不到3秒就有热水流出,0.9839163272047143
29436,66879216254.0,5.0,2020-06-21 21:51:35,外形外观外观很喜欢大屏显示颜色跟厨房瓷砖很搭恒温效果一级恒温噪音大小小出水速度快,0.9997589654737538
29448,66879216254.0,2.0,2020-06-17 19:00:11,买配件不齐全安装全部费用元如果觉得划算就买上门师傅一来安装全是推销如果不买他东西安装不保修如果是坏了一次上班修复全是坑打电话联系客服说是包安装但是不包卖的费用自己想办法打电话问客服说有的买回去安装费用要元你这个600已经很少了,2.1471713296250527e-12
29458,66879216254.0,5.0,2020-06-08 17:32:57,发货挺快的包装结实外观看着不错安装师傅提前打电话预约上门安装很给力十几分钟就安好了态度很好我不懂的他都耐心教怎么使用出热水很快噪音很小,0.939035925562316
29461,66879216254.0,5.0,2020-06-07 19:34:53,外形外观我最爱的白色和极光屏幕颜值高噪音大小小出水速度快安装服务耐心速度快,0.9999863197761759
29486,66879216254.0,5.0,2020-05-04 06:56:29,外形外观好看大气恒温效果试了一下效果很好有零冷水功能很好噪音大小还好跟之前的比好太多了出水速度很快安装服务客服态度很好耗能情况还不知道但是客服说他家也用的这个能效不高,0.9056106468972249
29488,66879216254.0,5.0,2020-04-21 21:02:48,送货快外观很好看可以连接手机控制智能方便美的大品牌放心首选,0.9999766230025394
