id,product_id,score,comment_time,comment,sentiment
12894,6723160.0,5.0,2020-06-18 14:19:21,外形外观外观还不多呢还没有用送货很快快递小哥还不错说是安装在和官方预约就可以了就是等着装修好在安装我们家的家电都是在京东上买的一直很信赖它赠送的礼物也超级不错真的还挺不错吹风机都是必备用的刚好不用再买了谢谢老板,0.9999999905554752
12896,6723160.0,5.0,2020-01-15 21:28:43,安装很好包装完好安装也很快东西不错一直用京东很好,0.9970556545546412
12897,6723160.0,5.0,2019-02-27 18:11:56,很好的一次购物体验刚好元宵节减价整整一千哇厉害啦用着还行安装售后也很负责总之都还很不错样子不错颜色不错一分价钱一分货不错不错这是真的很不错哈哈,0.9999983853552078
12899,6723160.0,5.0,2019-12-22 15:20:27,京东商城值得拥有物美价廉美的大品牌外观圆润手感细腻性能强劲,0.9999998565051099
12900,6723160.0,5.0,2018-11-16 13:04:39,很好服务周到师傅安装的很好使用过了都很好外观很好看总之一切都很好,0.9998578885477114
12903,6723160.0,5.0,2018-04-28 15:28:57,价格高一点的东西东西质量确实很好做工很精致安装的师傅也很认真现在还没通水没有试过试过以后再补评,0.9392264236765876
12905,6723160.0,5.0,2019-04-03 18:06:32,美的的燃气热水器真好非常非常的好家里人都喜欢外观漂亮质量非常好水温恒定出水快噪音小非常好的选择,0.9993196826065128
12907,6723160.0,5.0,2020-05-02 07:56:14,老公在家的时候师傅来安装的他说质量很好安装师傅做工也很细很负责很满意值得购买,0.903004002372059
12908,6723160.0,5.0,2018-06-02 17:41:05,家里一直使用美的的产品冰箱洗衣机空调热水器原来有款12升用着感觉非常不错所以新房子依然选择美的热水器保修8年让人很省心不用担心出问题维修费用了安装师傅态度各方面都非常满意机器也非常漂亮设计功能合理,0.734695660656567
12909,6723160.0,5.0,2019-12-29 12:10:00,外形外观很漂亮大气上档次恒温效果嗯恒温效果很好噪音大小噪音很小基本上就没有出水速度也很快,0.9999999641516857
12910,6723160.0,5.0,2018-10-10 16:08:08,特意用了几天再评价首先外观很漂亮安装师傅很认真负责两个浴室同时洗澡完全没问题其中有一个浴室还放了一大浴缸水水很热很满意美的的产品和售后都不错,0.6559957507768864
12911,6723160.0,5.0,2019-12-16 16:03:40,因为朋友是做美的产品的所以特别喜欢美的装的新家里面电器基本上都说美的产品真的很喜欢不错,0.9999711468526377
12914,6723160.0,5.0,2019-12-06 08:37:38,外形外观好看不占地安装服务师傅态度很好安装很负责也教了使用方法恒温效果燃气还没有通使用效果还不知道但是相信美的肯定不会差,0.9307719768182509
12916,6723160.0,5.0,2019-12-11 23:40:40,外形外观漂亮易清洁看起来很喜欢出水速度出水速度快不用等太久安装服务预约上门安装服务好,0.9972317250365872
12917,6723160.0,5.0,2018-05-08 10:12:12,纠结了好久不知道要选哪个型号咨询了客服给了建议然后就直接下单了送货好快安装师傅特别棒这款产品也很方便使用热水很快美的产品棒棒哒,0.8562744978086598
12919,6723160.0,5.0,2019-08-08 00:58:40,颜色好看美观大方以前买过一个很好用现在再买一个放新房子里,0.997411746895383
12920,6723160.0,5.0,2020-05-17 10:10:08,安装服务师傅打眼一个多小时服务态度真好安装用了两个多小时敬业精神值得佩服,0.6017798448566527
12921,6723160.0,5.0,2019-11-12 15:54:45,发货速度很快凌晨一点下单当天酒店到货安装速冻很快用了效果很好,0.8773332002346675
12922,6723160.0,5.0,2019-10-16 17:23:20,安装师傅服务态度超级好热水器也很好美的大品牌就是值得信赖,0.9850199298089481
12923,6723160.0,5.0,2019-08-02 20:17:24,质量非常好与商品描述的完全一致真的很喜欢完全超出期望值发货速度非常快包装非常仔细严实物流公司服务态度很好运送速度很快,0.9994241183237921
12924,6723160.0,5.0,2020-07-04 22:11:59,美的售后服务很好热水器很漂亮是我喜欢的样子值得购买,0.9990180121182467
12926,6723160.0,5.0,2020-01-09 10:25:12,美的热水器美观安装师傅服务态度非常好感谢京东提供的好产品非常满意,0.6041912948402659
12927,6723160.0,5.0,2019-04-26 00:16:24,双变频水压大节能环保容量也够大了外观时尚大方操作建档方便led触摸屏手感也很好送货快预约安装也非常快安装师傅认真负责希望一直好用,0.9998802117722444
12928,6723160.0,5.0,2019-11-16 16:55:50,双十一购买送货速度快安装师傅服务很好外观时尚商品还未使用等使用后再追加评价,0.9933094873202338
12929,6723160.0,5.0,2019-08-07 13:30:59,热水器收到了发货很快质量不错外观也很好安装师傅也来的快都非常满意,0.9844275417638444
12932,6723160.0,5.0,2019-12-22 23:33:07,外形外观简洁大方颜色好看不占空间恒温效果新房还未装起暂未使用使用后再做评价安装服务安装师傅上门速度快服务态度很好另外收费的项目都解释的很清楚,0.9956912710842613
12933,6723160.0,5.0,2019-12-15 17:33:03,相信大品牌抽油烟机消毒柜热水器买了一套旗舰产品房子还有一个月才装修好双十二买的很好价格也实惠,0.6874564838314736
12934,6723160.0,5.0,2019-11-09 20:18:45,东西不错物流很快包装也很完好自动控水温比较方彬使用售后时间也很长值得购买,0.9983362347970014
12936,6723160.0,5.0,2019-08-30 16:26:07,京东物流就是快收到货就联系师傅上门安装外观非常漂亮特别是四季恒温这个功能太实用了非常赞,0.9917648042500274
12937,6723160.0,5.0,2018-11-04 20:41:24,师傅服务态度非常好又热情也非常专业因为还没有开通燃气所以不知道好用不好用反正外表挺高大上的很满意值得拥有,0.9520355268846781
12939,6723160.0,5.0,2019-05-30 16:11:45,快递速度非常快今天买明天就可以到价格也比较便宜16L容量比较大颜色也比较好看预约安装非常及时专业这次比较不错的货物体验,0.7156888982301923
12940,6723160.0,5.0,2018-09-28 14:45:33,发货速度很快质量也不错毕竟是大品牌值得信赖安装预约也很守时按专业过程不需要我担心客服也很给力总之是一次很好的体验,0.9999029999246108
12941,6723160.0,5.0,2018-11-15 11:31:14,非常好热水来的也快声音可以接受而且美的售后非常好师傅上门非常热情因为活动免了辅材费没有收取任何费用选择美的是正确的,0.6189525276032743
12942,6723160.0,5.0,2019-08-11 15:44:19,使用起来很好温度可以随意设置超静音值得拥有,0.9835028006132224
12943,6723160.0,5.0,2018-10-24 15:06:19,今天热水器安装师傅上门给安装了服务态度特别好安装好后试用了效果也不错至于后期使用效果再后期告知哈热水器款式很新颖功能也很多,0.9373028400067447
12944,6723160.0,5.0,2019-12-28 22:21:52,恒温效果棒安装服务及时专业耗能情况比原来的强出水速度很爽外形外观高级,0.9999832002854361
12945,6723160.0,5.0,2020-01-15 14:42:41,外形外观外观好看大小正好不会占太多地方恒温效果很好水的温度比较均衡不会一会冷一会热这一点很满意噪音大小没什么噪音用的很满意出水速度很快16升的热水器家里5个人用正好安装服务很好师傅比较专业很满意这款热水器价格优惠而且也很好用恒温效果比起之前一冷一热舒服多了非常好用而且也好用快递物流非常快东西包装也很好很满意,0.9999957207066648
12946,6723160.0,5.0,2018-11-15 15:29:11,送货很快安装也很快服务很好因为要打孔安装师傅水转打孔衣服都湿了走的时候还把卫生打扫干净总体感觉这个价位买的很值美的（Midea）16升随温感调温天然气燃气热水器大水量水气双调三档变升安全防护厨房洗JS30-G3S,0.9294507318190661
12947,6723160.0,5.0,2019-03-22 08:53:52,物流很快美的安装师傅服务态度很好颜色高贵大屏显示功能齐全操作简单非常满意,0.9981023836277192
12948,6723160.0,5.0,2019-04-21 21:30:11,热水器很不错热水来得很快声音小质量非常好值得购买,0.9758289937451365
12949,6723160.0,5.0,2020-05-02 01:02:20,外形外观高大上恒温效果很好噪音大小感觉不出有噪音耗能情况耗能少出水速度快安装服务周到,0.9998814966158668
12951,6723160.0,5.0,2018-08-14 09:24:23,颜色还是比较正的上水也很快品牌就不用说了挂在墙上还是很好看,0.9292511483887183
12952,6723160.0,5.0,2018-08-30 21:07:46,还没接上天然气但外观颜色很漂亮还买的油烟机燃气灶都很喜欢,0.9745813739748528
12953,6723160.0,5.0,2019-04-30 18:41:04,今天下午刚安装好看着很漂亮高端大气上档次颜色也挺好安装师傅很负责大品牌值得信赖,0.9999957628611962
12954,6723160.0,5.0,2019-12-07 12:42:55,物流很给力零点下单下午就送到了售后的没多久就过来安装好了没有家里燃气还没开通没法试热水效果后期再追评外形外观非常的大气金色很耐看安装服务服务很好安装很仔细非常的满意,0.9607180335404263
12956,6723160.0,5.0,2018-11-21 21:35:39,昨天买今天就到了快递很快样式非常美观个人感觉很喜欢安装师傅服务非常好技术一流的值得信赖,0.9999218504677647
12957,6723160.0,5.0,2019-12-11 19:42:10,首先发货速度快两天直接送上门售后安转师傅联系即到安装间距合理外观颜色大气价格也是非常满意最主要还送了一个超喜欢电动牙刷,0.9106557027040836
12958,6723160.0,5.0,2018-09-20 22:05:56,第一天买隔天就到了物流很快包装很好送货上门热水器外观大气时尚安装师傅第一时间联系我安装师傅安装跟仔细物有所值,0.9779605630060131
12959,6723160.0,5.0,2019-11-16 17:35:06,外形外观很漂亮哦安装服务安装师傅很棒hellip送货速度很快当晚下单第二天就送到了预约安装师傅第二天就过来安装好了,0.7856357706553191
12961,6723160.0,5.0,2019-06-10 20:38:30,高端大气上档次热水均匀噪音偏小安装师傅服务到位,0.9898908683167363
12964,6723160.0,5.0,2018-08-05 22:44:16,京东送货很快服务好安装师傅辛苦了因为装修原因师傅多花了一个小时这么热的天大汗淋漓赞一个,0.7181184964006024
12965,6723160.0,5.0,2020-06-20 15:21:14,外形外观淡金色好看出水速度不错安装服务安装师傅很负责满意,0.9933520666864539
12966,6723160.0,5.0,2019-12-16 19:13:08,外形外观很好看京东的服务态度很好服务速度特别快12点下单上午八点多就送货了安装师傅也很快联系要上门安装第一次产品被刮了点花立即点了换货客服瞬间就处理了安装师傅态度也很好,0.7559034046551566
12967,6723160.0,5.0,2020-05-28 19:12:23,外形外观外观很好看质感不错安装小哥哥服务很不错安装的也很漂亮好评,0.9999999801188411
12968,6723160.0,5.0,2019-02-27 21:50:16,性价比高漂亮大气京东自营正品售后安装师傅非常专业国货精品,0.8834597916949132
12969,6723160.0,5.0,2018-09-14 16:19:22,在网上看了好多热水器终于看到有这么一块热水器又大又实惠又方便比别人家的好看又大气上档次哦总体感觉不错还免安装费？太划算啦,0.9939540753478073
12971,6723160.0,5.0,2019-05-16 11:24:16,送货上门安装很快挺方便的装好后热水立马就有了京东服务很周到,0.9665435044885584
12972,6723160.0,5.0,2020-02-27 14:42:02,外形外观好看恒温效果非常不错噪音大小非常小出水速度非常快安装服务好耗能情况低,0.9996339206700225
12973,6723160.0,5.0,2019-12-08 16:48:35,送货快安装规范省心噪音小以前帮妈妈买了一个现在自己也买一个第二次购买很不错相信美的,0.9991357485949658
12974,6723160.0,5.0,2019-12-14 15:50:53,双十一买的价格很优惠送货也很快师傅也很专业因为新房还在装修暂未使用但是看起来很不错,0.9061737770193361
12976,6723160.0,5.0,2020-02-04 18:02:31,安装服务态度很好噪音大小没什么噪音出水速度出水速度够快,0.8702066138315661
12977,6723160.0,5.0,2018-11-10 17:26:09,外观上颜色看起来非常大气我们是装在入户花园尺寸也刚刚好安装师傅准时态度和技术都超赞不错会推荐朋友购买hellip,0.9872369728096765
12978,6723160.0,5.0,2019-11-09 12:10:13,已经安装非常合适使用了几天是我们想要的类型推荐购买外型也不占地安装服务非常满意,0.9792399171015843
12979,6723160.0,5.0,2019-01-11 16:53:37,物流很快安装不快刚用上质量不错出水加热都很快可以推荐,0.9680644279805282
12982,6723160.0,5.0,2019-08-22 10:07:27,这款热水器外观很大气智能面板好控制开水快自动恒温很方便客服态度很好有不懂的地方及时告知安装零收费服务态度好是值得信赖的买热水器选美的,0.9143347597813928
12983,6723160.0,5.0,2018-11-21 21:59:32,高端大气上档次美的值得信赖安装服务特别好技术一流的我家的家电都是美的的京东快递特别快一天就到了,0.9999999717760663
12985,6723160.0,5.0,2019-08-16 12:43:46,当天买当天安装非常好用不用再调节水温价格经济实惠还赠送电动牙刷美的生活信赖品牌,0.9989910901647643
12987,6723160.0,5.0,2019-06-22 11:39:50,美的的燃气热水器热水速度非常快全家人洗澡都非常的方便外表美观很大气热水来得非常快水温可以自动调节新房子里面又多了一道亮丽的风景线,0.9978058716009931
12988,6723160.0,5.0,2019-03-23 22:31:15,送货上门的人员服务态度很好送货上楼并讲述注意事项主动通知上门安装人员告诉地址及安装形式安装人员也服务周到,0.8077565719307317
12989,6723160.0,5.0,2018-11-08 13:28:24,不错我很喜欢很方便一键厨房洗很方便nice,0.9839920464100718
12991,6723160.0,5.0,2019-03-10 20:21:58,真品实在服务也很到位东西没到服务就电话来了货一到就马上安排人员上门安装一条龙服务很到位速度又快值得购买,0.601676210672891
12992,6723160.0,5.0,2018-11-19 10:53:50,超级好非常满意家里的电器都是美的的质量都很好服务态度也超级好还是相信大品牌安装师傅很专业服务态度热情美的还有电话回访会一直信赖这个品牌,0.9999677904195872
12993,6723160.0,5.0,2018-10-15 14:57:48,电热水器收到了物流很快师傅安装很好售后服务都很好电热水器外装也很满意家里人都说挺好的朋友,0.8240343437021729
12994,6723160.0,5.0,2019-10-04 17:35:46,外形外观这款热水器的颜值那是没的说超薄机身更节省空间高大上恒温效果零冷水简直就是完美数码恒温自由设置出水温度恒定如一噪音大小无噪音出水速度水量调节系统完美出水温度稳定洗澡更舒服呀安装服务随叫随到服务周到送过来第二天就安装了耗能情况高品质电机更节能空气自动比例线性调节意外熄火保护防干烧保护风机故障保护等等一大些总之就是完美值了,0.9999476599829653
12995,6723160.0,5.0,2019-06-22 12:49:46,服务及时到位安装操作规范态度热情诚恳试用了一下美的热水器非常满意,0.9190109590097751
12997,6723160.0,5.0,2020-04-02 18:18:38,外形外观外观比我想象中好看安装服务安装师傅态度很好安装也很仔细,0.998176520719433
12998,6723160.0,5.0,2019-02-24 12:29:54,十分美观方便物有所价支持美的给五星支持美的,0.9876542625778684
12999,6723160.0,5.0,2019-06-25 20:32:24,618买的热水器选了很久买的这款样式非常好看大气家人都说好,0.977047535361618
13000,6723160.0,5.0,2019-04-28 20:31:21,这款天然气省煤器非常好用非常实用声音非常小价格便宜客服服务态度热情售后服务好好快来买你值得拥有,0.9823801387261158
13002,6723160.0,5.0,2018-08-10 14:50:17,很美观安装师傅安装的很给力价格收的也很合理大品牌值得信赖,0.9608713792476081
13003,6723160.0,5.0,2020-06-06 13:20:03,家里的电器都是在京东买的这次果然也没有让我失望已经收到货了快递员也很好直接送到楼下但是还没开始用款式和图片一样感觉质量很好颜色也很漂亮是我喜欢的样子期待使用后的效果喜欢的亲们不用犹豫了抓紧下单了,0.9999658397182993
13004,6723160.0,5.0,2019-11-24 18:41:56,经过两天的努力总于顺利出水非常不错美的的质量永远值得信赖,0.9997198153387185
13005,6723160.0,5.0,2020-01-03 13:12:29,家人非常喜欢热度很快,0.9603689355362405
13006,6723160.0,5.0,2019-12-21 15:22:14,当天就来安装了速度很快样子也很好看效果也不错服务很好下次还从京东购买,0.9942904823913088
13007,6723160.0,5.0,2020-02-18 16:32:48,外形外观观非常大气美观噪音很小打开热水马上就来了不需要等恒温效果也非常好,0.9931276390048503
13011,6723160.0,5.0,2018-10-28 10:38:11,装好了高端大气上档次试了一下出水很快等搬新家了就可以洗热水澡了,0.9942770880983417
13013,6723160.0,5.0,2020-06-02 10:40:48,外形外观外观大气安装服务师傅很细心解释的比较清楚安装免费额外材料费是单独付的可以自己在外面采购总体来说不错还是值得购买的,0.9999730155586486
13014,6723160.0,5.0,2019-09-13 17:02:29,很快送货第二天就能安装还是很方便的出水量和温度都不错,0.9741743642427511
13017,6723160.0,5.0,2020-06-12 11:28:51,美的无论服务还是售后都很好值得购买第一天拍的第二天都到货了发过速度超级快预约安装师傅也很快大热的天走管打孔服务很好最主要的还是智能的手机也能操作温度超级方便最近电器都是网购的也都很满意,0.9993101097319921
13018,6723160.0,5.0,2019-12-15 19:25:54,双12购买的第二天就到了外观设计很好看支持美的很棒,0.9992756936990009
13019,6723160.0,5.0,2019-12-07 15:54:35,外形外观外观颜色上档次操作简单显示简洁恒温效果水温恒定不会忽冷忽热噪音大小噪音控制挺好基本听不到安装服务安装服务师傅态度很好手工也好安装的很细致,0.9971968750381928
13020,6723160.0,5.0,2018-10-10 20:41:24,美的售后服务态度好热水器功能齐全恒温效果很好不会忽冷忽热,0.8121874536526448
13021,6723160.0,5.0,2020-01-03 13:17:03,外形外观亮恒温效果稳定出水速度快噪音大小很小,0.9997503286636561
13023,6723160.0,5.0,2019-02-27 11:12:20,一直信任美的产品安全先进质量有保证家里除了百分之九十的大小家电都是美的品牌安装师傅很快就上门安装服务很好还把垃圾打扫走,0.9291230299830613
13025,6723160.0,5.0,2019-06-20 21:02:24,外观大气颜色漂亮物流超快第二次购买了物美价廉感谢京东618需要的亲赶快下手,0.9999758444624738
13026,6723160.0,5.0,2019-03-08 17:22:26,首先该热水器高端大气上档次看着喜欢具体功能还没体验期待效果其次安装师傅服务周到最后还是得夸赞京东物流整点下单当天到货,0.9998022096968238
13027,6723160.0,5.0,2018-12-18 16:58:17,家里很多美的的产品信任美的产品京东物流一直都是那么快速热水器安装很快速而且是免费安装的工人服务态度很好赞一个hellip,0.9993605289164093
13028,6723160.0,5.0,2019-12-20 18:08:49,外观高端大气上档次真的很不错燃气没开通没法使用等开通了燃气在来评价,0.9272123075061458
13029,6723160.0,5.0,2019-11-20 18:19:07,外形外观时尚大方恒温效果不错出水速度快安装服务师傅很专业噪音大小可以接受,0.9999970581543133
13030,6723160.0,5.0,2019-03-12 17:19:05,热水器很好用热水随叫随到外观很大气物流贼快,0.9848360201242642
13031,6723160.0,5.0,2019-11-10 22:32:17,大品牌就是大品牌海尔不愧是出口品牌品质超级好物流速度超级快第二天就到了师傅上门安装的速度也是超级快非常满意热水器很好实物比照片好多了这是新款直驱变频的机器就是好以前皮带驱动的机器用时间长了抖动很大直驱的几乎听不到什么生意有时候衣服洗好了都不知道价格双十一买的也是超级划算打算再打给父母也买一台海尔的售后服务真的很好师傅上门就穿鞋套安装完成还帮你把垃圾清扫干净,0.9988823647568482
13032,6723160.0,5.0,2019-12-17 11:56:16,外形外观大小正合适颜色也漂亮恒温效果很稳定并且可以享受到水气双调的效果还有三档变升功能安装服务安装师傅很好有讲解怎么用非常好噪音大小噪音一般声音不会太大出水速度出水比较平稳大小下正好并且不会忽冷忽热,0.9999388237258713
13034,6723160.0,5.0,2019-09-20 11:03:36,外观很好看物美价廉一下买了2个送亲戚一个出水速度也挺快的安装师傅的态度也很好值得购买下次买还是选择美的,0.9991871486741443
13035,6723160.0,5.0,2019-11-09 12:42:08,京东物流真的是没的说早上七点不到就送货了再加上美的得售后简直逆天都很不错非常迅速和便捷再说这款热水器外观够靓升温快调节方便各方面都很好非常不错值得购买,0.9999941470664706
13036,6723160.0,5.0,2018-10-11 15:03:27,产品非常美观高大上朋友也说不错会介绍朋友购买物流也很快还没有通气,0.9715789646936429
13037,6723160.0,5.0,2020-03-29 00:25:08,外形外观外观设计很棒恒温效果不错噪音大小噪音超小安装服务非常不错耗能情况用用看吧出水速度出水快,0.9999994426875332
13041,6723160.0,5.0,2019-09-26 16:06:26,美的这个大牌子的确让人信赖热水很快到位人性化的设计,0.9998749719993857
13043,6723160.0,5.0,2019-03-13 20:14:13,美观大气水温恒定安装速度快送货速度快水量很大满足要求,0.999382378587905
13045,6723160.0,5.0,2019-11-12 16:46:59,速度很快第二天就收到了第三天就有师傅过来安装这效率可以美的一直就很信赖,0.9625895866233751
13046,6723160.0,5.0,2019-03-22 20:26:44,京东送货很快下单了一会就有送货的联系之后就是安装公司预约安装日期后面还有安装师傅预约具体上门安装时间安装很细心卫生也处理的非常好美的各方面服务挺不错的,0.6413367019044581
13048,6723160.0,5.0,2019-11-10 11:55:06,安装师傅很专业安装的很好细节做的很到位值得信奈人也很好哦,0.9932890864857633
13049,6723160.0,5.0,2019-10-10 10:15:33,速度超快前一天下午订的第二天一早就到了选了这款机器非常满意经济实用还漂亮安装师傅服务也非常到位临走把家里面打扫的很干净还耐心教了我们使用方法,0.9977539819050392
13050,6723160.0,5.0,2019-12-28 09:47:48,安装服务非常到位师傅很专业外形外观外观好看简洁大发恒温效果稳定稳定效果好噪音大小噪音不大出水速度出水速度快非常满意总的来说这个购买非常愉快从物流速度和安装使用个方面绝对到位性价比炒鸡高,0.9999999831101184
13051,6723160.0,5.0,2019-12-09 12:03:37,外观高大上香槟色很喜欢安装师傅热情讲解服务态度好,0.9922835807254976
13053,6723160.0,5.0,2019-12-22 19:08:15,外形外观高端大气上档次安装师傅服务态度好,0.9989268233389909
13054,6723160.0,5.0,2019-07-28 16:50:42,每美的的小家电还是很值得信赖的人产品质量很不错哦很喜欢用这个品牌,0.9999340516314763
13055,6723160.0,5.0,2019-03-04 21:17:41,16升两个淋浴一起开着还是可以的外观也特别好看高档服务没得说,0.9588605295781163
13056,6723160.0,5.0,2020-03-17 16:52:57,外形外观好看美观安装服务安装速度快解决能力强很满意恒温效果不错,0.9999939538709894
13057,6723160.0,5.0,2020-05-27 16:14:39,安装服务当天送到后就安装好了小哥很认真外形外观美观大方,0.9989993805056633
13058,6723160.0,5.0,2019-12-08 17:36:42,外形外观简洁大方安装服务很好跑了两次态度超级好的,0.9968497802918267
13059,6723160.0,5.0,2019-07-07 14:51:12,安装很快大概400左右速度很快服务好出热水很快,0.9964717504594931
13062,6723160.0,5.0,2019-05-07 16:38:02,外观造型设计简洁大气热水来的非常快目前的使用体验非常好,0.9999784121319719
13063,6723160.0,5.0,2020-03-27 09:41:37,外形外观外观很漂亮很档次的哦恒温效果挺好噪音大小噪音也很小在外面装着出水速度也可以哦安装服务师傅很耐心哦耗能情况这个还不太清楚呢美的大品牌了有保障买来寄回老家用的应该还不错京东速度很快的哦一直在京东自营买东西省心很多不用担心不合适之类的,0.9999992017181081
13064,6723160.0,5.0,2018-10-11 21:57:07,非常满意外观很漂亮供水量足够大我家有三个出水口热水依然很足大品牌服务就是不一样凑着我下班的时间晚上九点上门安装的安装费全免一分钱也没花配送很及时安装小哥态度特别好全五星,0.9473279299170597
13066,6723160.0,5.0,2019-09-02 12:54:21,外观大气上档次不过现在燃气还没通暂时还没使用,0.9648116770233747
13067,6723160.0,5.0,2020-04-29 11:01:48,东西不错哦安装师傅也不错安装后打扫的很安静,0.7144885558055815
13068,6723160.0,5.0,2019-11-09 22:22:37,这款热水器很实用一下就买了两台热水很快使用方便外观出众颜色也很好看物流也很快安装师傅安装的很到位值的拥有的热水器,0.9998810278768541
