id,product_id,score,comment_time,comment,sentiment
41587,39974630844.0,5.0,2019-11-23 21:50:31,噪音大小有点大出水速度很快,0.8027826609627078
41588,39974630844.0,5.0,2019-10-18 09:28:37,一直都是用这个牌子挺好用的,0.8160737936943873
41589,39974630844.0,4.0,2019-12-13 09:13:52,物超所值东西还是不错的,0.9965781633811823
41591,39974630844.0,5.0,2019-11-21 07:25:29,外观很漂亮恒温效果很好,0.9996146947602821
41593,39974630844.0,5.0,2019-11-02 17:10:19,安装服务安装很快很好,0.8869863245067019
41599,39974630844.0,5.0,2019-05-21 19:48:40,物流速度还可以现在正在正常使用中,0.9284799336371944
41600,39974630844.0,5.0,2018-12-30 18:20:27,大品牌值得信赖卖家也非常讲诚信,0.956833301614695
41601,39974630844.0,5.0,2019-02-21 13:42:24,还没有用一直放家里自己安装的,0.6168161112561024
41603,39974630844.0,5.0,2019-04-10 08:32:06,价格优惠使用正常挺好的,0.8581693039670991
41605,39974630844.0,5.0,2019-05-04 17:46:51,京东服务一流继续加油,0.9979747663803702
41607,39974630844.0,5.0,2019-01-22 18:55:22,不错的已经开始用了,0.8612132352941176
41608,39974630844.0,5.0,2019-05-11 09:46:16,水压温度够晒,0.772392747834429
41635,39974630844.0,5.0,2020-03-20 13:05:19,好用但声音不像传说中的那样,0.6713144285511774
41638,39974630844.0,4.0,2020-03-04 20:24:10,外形外观有点厚恒温效果还是很准的噪音大小正常范围出水速度出水很快安装服务没叫师傅在外面装过完全没配件价格也不便宜配件都买了不是很划算耗能情况用了十天左右送人了,0.9627383872669255
41648,39974630844.0,5.0,2019-07-13 19:30:14,和我想象的差不多好用,0.676288581347162
41649,39974630844.0,1.0,2020-05-19 15:03:22,买回来半个月都没有得用一直有故障码维修师傅上门几次修理还是有故障现在又说换主板我在想我是买回来修还是买回来用的为什么修几次还不给换机三包政策到底是什么？,3.1597498728608286e-08
41661,39974630844.0,1.0,2020-03-31 13:36:41,装上用都没用就漏气寄过来的包装里面连螺丝和说明书都没有把别人退的货又寄给我？？,6.533417992993229e-05
41663,39974630844.0,5.0,2020-03-19 22:03:06,宝贝不错物超所值已经自行安装好了正常使用中各方面都满意,0.9987108305486266
41667,39974630844.0,5.0,2020-02-25 12:30:43,不错出热水很大很快热水器很有份量价格又实惠,0.9828013099532623
41669,39974630844.0,5.0,2020-02-10 13:37:32,货已经收到了商品与图片一样颜色也很喜欢大小刚好合适京东物流发货很快第二天就到了送货师傅也很有耐心送到教我们注意事项家里大大小小的东西都是在京东商城买的质量和售后都非常有保障总之非常满意,0.9935871815186467
41670,39974630844.0,1.0,2020-01-29 20:32:46,过年回来才装上才用几天就报故障代码了30秒就自动关机故障代码e4不晓得是我运气不好还是其他原因我已经保修了hellip但质量还真有待观察,0.0005509856386580747
41683,39974630844.0,5.0,2019-12-27 14:46:13,外形外观美观大方恒温效果真心不错噪音大小声音不是很大出水速度挺快的安装服务还行不算完美耗能情况还在用具体不清楚,0.9999990397195515
41693,39974630844.0,5.0,2019-12-06 20:10:02,热水器收到了物流很快热水出的也快自己安装的这款热水器不错价格实惠物流小哥送到家门口了棒棒哒包装里面没有说明书客服小姐姐也耐心解答总体来说还是不错,0.9801462936241782
41701,39974630844.0,5.0,2019-11-04 17:59:39,外形外观简介大方易懂出水速度出水预热快安装服务昨天下午到货今天安装师傅上门就装好了,0.9974977418832726
41737,39974630844.0,5.0,2019-03-02 09:31:42,美的东西就是好大品牌效果很好我很喜欢下次还来这个店买,0.9963646065973267
41740,39974630844.0,1.0,2019-01-26 11:44:57,收到货的时候居然里面还有水保护膜没有了而且还脏得很就是一个坑,0.0004526130442392695
41741,39974630844.0,5.0,2019-01-16 17:11:06,早上送到下午已经安排完毕可以使用了速度很OK这点服务很到位其他用了以后再追评,0.7030026409063227
41742,39974630844.0,5.0,2019-01-11 22:03:43,用得还可以挺好的就是物流有点慢,0.747535201114692
41748,39974630844.0,5.0,2018-11-20 22:01:59,已安装出水很大感觉不错,0.7785153184965644
41753,39974630844.0,5.0,2018-10-11 20:20:04,用了一个礼拜来评价免费安装材料费花了元东西不错放心产品冲凉很舒服啦值得拥有,0.9870355137878402
41754,39974630844.0,5.0,2018-10-08 20:56:37,东西挺好的用起来也挺方便,0.9250760029503604
41757,39974630844.0,5.0,2018-09-30 16:53:55,美的还是不错的哦值得拥有嘻嘻,0.9999071833648341
41759,39974630844.0,5.0,2018-09-28 01:42:43,非常好大品牌值得信赖hellip,0.9966099625962374
41760,39974630844.0,5.0,2018-09-27 10:26:13,不错产品很给力温度调节可控直观明了是大品牌有技术含量,0.9955767377895256
41761,39974630844.0,5.0,2018-09-25 19:34:44,热水器收到了大牌就是大牌大家都赞不绝口真心超值美的值得信赖推荐大家购买真的特别满意特别好用特别喜欢赞,0.9999999955852517
41762,39974630844.0,5.0,2018-09-24 19:39:01,宝贝收到包装很好客服很周到多次打电话确认安装时间安装师傅技术很棒帮忙拆旧机安装新机自己提供了零件所以这次完全免费老妈还不停夸师傅好总之美的不错以后会继续关注,0.8755765873038993
41763,39974630844.0,5.0,2018-09-24 11:44:00,温度很舒适给爸妈买的用的很放心,0.7750960961644491
41764,39974630844.0,5.0,2018-09-23 19:55:19,挺好看还没有安装,0.8193288077185389
41765,39974630844.0,5.0,2018-09-18 22:56:14,质量很好使用方便服务态度也很好很好的卖家值得购买,0.988081103991659
41766,39974630844.0,5.0,2018-09-17 16:14:50,物流很快用了几天再来评产品也行热水很快店家服务也挺周到,0.9952512550755782
41768,39974630844.0,5.0,2018-09-16 16:28:08,亲热水器我也收到了很高兴质量很好也好用物流也很快店家服务态度很好安装师傅服务很好,0.8647085206480137
41769,39974630844.0,5.0,2018-09-16 10:00:42,质量很好安装的师傅也棒棒的很愉快的一次购物,0.9543996464868981
41770,39974630844.0,5.0,2018-09-15 14:48:19,已收到货包装完好性价比也很高等装修好在安装,0.6797908695128049
41775,39974630844.0,5.0,2018-09-06 18:10:55,大品牌很不错美的这个品牌我家里已经有好几样东西了下次还会买它推荐亲友也买很快就安装好了出水温度很稳定,0.9998479779356728
41776,39974630844.0,5.0,2018-09-06 14:50:55,不错很好用,0.9518123289584978
41777,39974630844.0,5.0,2018-09-05 10:34:46,热水器不错大品牌对水压要求高一个些家里水压低的会不点火最高用品牌的燃气,0.7849565026372515
41785,39974630844.0,5.0,2018-08-15 12:55:56,安装师傅很辛苦非常满意,0.6380942102637481
41786,39974630844.0,5.0,2018-08-11 17:16:32,服务很多产品质量也好价廉物美,0.8386136952109986
41788,39974630844.0,5.0,2018-07-22 18:46:31,刚收到货外观和网上一样还没安装总体不错,0.9010669476685598
41825,39974630844.0,5.0,2018-11-01 20:17:22,比之前的热水器好用多了不担心冷不担心烫美的大品牌值得信赖客服服务也特别好哈下次有需要还来你家购买哟一样享受美的服务比实体划算太多啦,0.9778888358435743
41828,39974630844.0,5.0,2018-09-22 13:50:02,物流很快安装师傅很好,0.6946781096290413
