id,product_id,score,comment_time,comment,sentiment
18879,6863137.0,1.0,2019-07-26 14:36:35,明明元安装活动日期6月20日至9月30日辅材用料也远不到3米安装师傅上门就说安装免费辅材收费说美的活动日期是4月30日至6月30日那京东这个日期怎么算目前安装师傅已经撤了,1.3224377148901567e-10
18880,6863137.0,1.0,2018-10-27 15:56:38,有一说一安排的售后安装还可以但是售后专门预约12点到2点就怕他打不通电话给他预留了两个电话结果当天给我打了一次电话没打通另一个电话直接不打自己就去接别的活去了还理直气壮的说电话没打通,2.986701330698338e-09
18881,6863137.0,1.0,2019-06-28 21:18:42,用了不到一周就坏了洗澡时突然就没热水出来了楼上楼下放了一个小时都没热水联系客服总是自动回复没人理,1.487009112510762e-07
18882,6863137.0,1.0,2018-11-26 11:41:46,房子还未入住热水器性能暂时不好评价但是安装差评图一是第一次安装的很明显热水器没有对齐两根进出水管偏了另外进出水管管线歪歪曲曲安装师傅太随意图二是在我不满意提出重装意见后安装出来的效果图进出水管还是歪的而且左右两边水管装的拐角也不一样最后收了我元问题是把我洗衣机搞得脏兮兮不做任何清理（图三）而且洗衣机边角上出现了一道划痕（图三）当然师傅说不是他弄得只是我的厨房和阳台都没人进来过师傅前后服务态度还可以也想着不评价了但每次看到那些管线和划痕都闹心,0.0
18883,6863137.0,1.0,2018-08-25 13:27:34,京东第一个差评因为家里正好在装修装修师傅特意关照安装的人会兜售相应的配件而且高于市场价所以安装师傅来了之后多次实图推销都被我拒绝了最终安装师傅安装完使了个坏帮我热水器连接煤气的阀门偷偷拧松了还好家里有人从事相关行业用专门测量煤气泄露的仪器测量了一下试问要是没有测量结果是如何？这么大的品牌安装人员的素质如此底下？我会保留最终投诉的意见并向相关管理部门投诉,6.650310591105324e-08
18884,6863137.0,1.0,2020-01-22 20:54:44,热水器屏幕上有划痕保护膜也没有要不是因为要过年了就退掉了热水器质量怎么样还不清楚售后安装服务真的是不行安装完成以后漏水见下图那条湿的布两个角阀品牌不一样怀疑是不是售后在偷工减料安装花了三百多没弄好要过年了安装的师傅不愿意过来看只能明天自己去市场买角阀三通检测下哪里有问题,1.5731860258938468e-12
18885,6863137.0,1.0,2018-12-01 22:04:10,这是最的公司套路太多安装费元,0.02926953673633159
18886,6863137.0,1.0,2019-04-18 13:41:18,热水器安装了还没有用安装费太贵了非常贵,0.02780849043842548
18887,6863137.0,1.0,2018-09-17 21:31:32,差评大家都不要买了别给自己找麻烦,0.003094781254145751
18888,6863137.0,1.0,2018-11-25 18:34:31,垃圾售后预约来安装让我等两天都不来安装真浪费时间,0.004852661356082644
18889,6863137.0,1.0,2018-11-15 16:12:20,美的的东西真不如买格力或者其他牌子的一个客服的态度也让人够了,0.21306958133747045
18890,6863137.0,1.0,2018-06-18 21:55:00,不满意坑人装热水器需要的材料都没有等到安装的人员安装的时候什么都给高价强烈建议不要买套路太深,9.851722384379702e-05
18891,6863137.0,1.0,2019-02-04 00:46:40,首先安装的时候上门的师傅已经让我非常不满意后面经过协调总算安装好了但是因为我在外地工作等回来一看买的14L你给我送过来安装的是10L几个意思？好玩是么我回持续投诉你们到最后包括各个相关部门,1.3347670940411227e-05
18892,6863137.0,1.0,2018-08-05 16:00:35,大家不要买忽悠的说是免费元安装上门给你安装的人会收费被收了440多大大小小的器材垃圾玩意不要上当,1.1298469837606184e-05
18893,6863137.0,1.0,2019-06-18 21:57:25,差评是给元安装活动的里面好多陷阱好多东西还是收费的京东上面显示活动到6月30日截止打美的客服电话却说活动5月30日截止活动做不起就不做玩什么鬼心思必须差评千万不要相信图片里的活动美的玩不起,2.6628100942005517e-06
18894,6863137.0,1.0,2020-05-01 09:32:29,上门安装服务态度差安装服务再也不想买这个牌子的东西上门安装师傅什么个鬼技术不好服务态度不能好一点吗,8.010450211592968e-06
18895,6863137.0,1.0,2018-11-29 22:57:38,不得不差评了说是说这款热水器活动期间一定的辅材免费进出水管明显符合条件但是收费了美的系统的费用还不认非要看售后根本就没提供的纸质收据售后售前以及报装两次电话都说法各不同美的咋这么混乱,5.157237351027799e-05
18896,6863137.0,1.0,2019-10-19 00:15:54,商品就不说了附加收费太多售后也不怎么好早知不在京东买了对这次美的售后也差,0.01697363041701594
18897,6863137.0,1.0,2018-07-17 10:58:43,说的是免费安装打孔收费我就不说了安装辅料说的也是免费但是用了一截管也要收费这就是所谓的免费安装？全是忽悠人的一直问客服客服也一句话都不回复真扯淡,1.3406424815842755e-06
18898,6863137.0,1.0,2019-06-22 13:37:17,东西还没有使用安装花了六百孔我都是现成的收了六百燃气到安装的位置就这个距离,0.0015191407942611868
18899,6863137.0,1.0,2019-04-03 16:39:10,不愉快的购物水压没问题水温不稳定所谓的300封顶都是忽悠人的安装费花了750贵也就算啦但是安装的非常丑太差啦,2.0071133263521723e-05
18900,6863137.0,1.0,2019-04-04 10:48:03,买的元安装价安装人员拿个单子说店里开的只免我说我买的元安装辅材店里打个电话直接把安装人员叫走了下午又打电话报安装然后才说辅材免费了元安装店家实施不到位啊这我本来也就算了的下午安装师傅一过来直接说评价5星再安装我本来就受了一肚子气浪费了一天时间还要逼着给5星我肯定不会同意不装就算了我再投诉安装人员这才打电话给店里店里还死活不承认上午只免这也就算了安装人员把管子接到下面本来是接上面接头的他专业安装人员这也不知道吗那我燃气灶气管就只能装上面那矮点的人关燃气管都关不了本来就孔都留好了的,0.0
18902,6863137.0,1.0,2019-02-12 12:19:48,商品评分1分声音太大了本来家里的是樱花时间久了想换个本来想买史密斯无奈尺寸太大换了这个结果声音比七年前的产品还大而且以前的是超薄性这个要厚,0.1262014665540635
18903,6863137.0,1.0,2018-09-01 19:15:06,忘了评货一般般可是美的的安装售后不得不说垃圾说是免安装实际还有一大部分辅材不免还死贵可是收了我350还把孔打歪了现在热水器都歪了些那人还说没有歪你来量眼睛瞎吗还有下面螺丝都松的呵呵还得我自己动手紧死,5.752057151586776e-06
18904,6863137.0,1.0,2020-04-23 14:00:45,面板全是划痕插头上还有水珠嗓门大快递给我打电话说你有一个很小重音的热水器到了我一瞬间以为自己买了什么了不起的超薄超小热水器一秒钟后才反应过来他只是不想给我送上来不是家里2天没热水了我不至于受这个鸟气一星给能用,0.0005704227228150449
18905,6863137.0,1.0,2018-12-31 23:30:23,今天刚装上试了一下温度设置50度已经够高了吧只有厨房一个龙头出水的情况下忽冷忽热一会开火一会熄火？没有开厨房洗和自动调温功能傻瓜式设置50度还都忽冷忽热怎么洗澡请问？另外开火延迟严重开水后8秒左右才开火视频为证视频快结束才开火不是自动确认收货的话就直接就退货了太差了还是不能图便宜希望引以为戒不要轻易下单另外安装22米的烟管收我204两个排污阀师傅装上了才跟我说要收96安装师傅也是能忽悠说是不装容易坏冬天冻坏了那意思也就是冬天就不能用咯？当摆设？那我还买热水器干嘛？夏天用么？上海室内温度能有多低？能结冰？后来我查了一下两个排污阀一般只要20左右还包邮你收我96？？安装一共300后来我仔细查看是免安装费打了两天400电话售后才给我退了200排污阀因为太远就没有拆没有退现在有点问题客服只会说你打400吧服了我打算走售后退货或者添点钱买个好点的各位千万不能图便宜希望对你们有用温度没办法证明下面是视频为证10秒的视频最后一瞬间才点火,0.0
18906,6863137.0,1.0,2019-03-30 17:53:59,买个热水器元安装购买前咨询客服多次结果安装好按标准收费元实际收取元一个热水器元光安装花了元这是什么元安装,3.748168521666706e-06
18907,6863137.0,1.0,2018-07-14 19:26:25,售后服务太差有问题反映商家不处理,0.0037328305967864184
18908,6863137.0,1.0,2018-06-25 19:12:24,安装费收了元还说免费安装京东坑坑,0.01578698960531033
18909,6863137.0,1.0,2018-10-01 05:51:52,安装师傅安装收费太高安装下来收了我元免费安装怎么还收费不理解,0.00048597561600260963
18910,6863137.0,1.0,2019-11-11 01:23:37,买来的时候送了一个布谷的电热水壶然后双11就不给保价了当时价格元一台双11就元真坑,0.00010822405911681265
18911,6863137.0,1.0,2019-09-11 16:07:50,物流和产品没啥问题但是安装时候就要敲竹杠了一开始安装费要收我快这都是燃气热水器的三分之一价钱了然后再看优惠列表里面说的有部分是免材料费的再一算还是要块我想说如果我不知道或者忘了仔细看优惠列表那么真的就要收了我块了这算谁的责任？？我的钱还能不能要的回来？？,3.438072049277707e-11
18912,6863137.0,1.0,2019-08-26 12:18:43,差评说好的免费安装额外收了四百多安装费这就是所谓的额外服务,0.014318287062279667
18913,6863137.0,1.0,2019-08-11 19:31:02,安装真是套路满满恶心的很明明元安装辅材费不超过我们安装下来师傅竟要将近真的是服了都快赶上热水器的价格了巨坑建议大家不要买,6.085052239868105e-09
18914,6863137.0,1.0,2019-12-28 20:37:33,外形外观出了块钱的安装费管子短那么多师傅就这这样给我丢那里就走人了太不负责任了嘛,0.0008308317267077259
18915,6863137.0,1.0,2019-11-09 18:54:33,看到元安装才选的然后问了客服给了个表说表里的材料都不收费然后安装完收了近元原因是免费表里的材料用不了得用另一个表里收费的材料真是被忽悠的没方向了不免费就不要写啥元安装,8.338075490055274e-07
18916,6863137.0,1.0,2018-09-19 21:35:33,快递送的蛮快的安装还好就是京东商城上说包修8年安装师傅说包修6年到底是几年啊？,0.00034618482390313954
18917,6863137.0,1.0,2018-06-10 23:00:55,一次让人闹心的购物检测费花了安装费花了helliphellip自己还去办理检测手续什么备案资料helliphellip太闹心,0.0011215701627086405
18918,6863137.0,1.0,2019-01-01 09:51:17,叫安装师傅安装说是要交备案费150（也就是跑腿费）说好听的说是要给你重新装接口接口费说是京东买都是这问问客服是吗？把安装师傅叫来了人家说天冷房子不住人的话就冻破了好的这可以理解我说让他装安装师傅说辅材费啥下来你这最少在500左右这还是免安装吗？这是抢钱到现在也没敢装,1.5420553722833574e-11
18919,6863137.0,1.0,2019-01-12 13:26:52,热水效果不好刚开始说气压不足后面售后又说水压大了什么意思吗？7天无理由退货要师傅开质量鉴定单师傅又说不要开直接退货美的比万和售后服务要差多啦一颗星都不想给14升根本就没有12升效果好,9.660006128342502e-11
18921,6863137.0,1.0,2020-01-27 19:58:44,售后不来安装自己花钱请人安装结果出了个E5风压故障美的400一个推一个美的售后超级差垃圾,0.0009248437631920181
18922,6863137.0,1.0,2020-05-11 18:12:16,安装说是免费实际乱收费刚换的新管子说坏了换了两个很短的收费元客服也不给解决千万不要买,1.1383676992160474e-06
18923,6863137.0,1.0,2020-05-08 14:55:02,说好7号到货在家等了一天打了电话给客服也说7号送到结果8号下午才送到且过程中没有接到你们任何一个电话打过来不能到货的原因就算送不到是不是应该给我打个电话,6.582925166087605e-07
18924,6863137.0,1.0,2020-05-06 17:06:21,ldquo查看物流rdquo里边更新不及时无法联系物流公司很不愉快的一次购物,0.11376888936814922
18925,6863137.0,1.0,2018-05-31 21:33:20,京东物流没问题一如既往的好这个美的号称0费用安装我特地选的0费用结果还是收了我130不是我出不起这个钱感觉被骗了来京东买东西就是图的个实在你忽悠人起作用吗？,1.7681271891056838e-07
18926,6863137.0,1.0,2018-06-07 07:05:06,商品本身没有问题但是为什么给我用的角阀是那种质量很水的不是辅材说明里的那种材质的？零元安装就是这么偷工减料吗？,0.05918926896245669
18927,6863137.0,1.0,2018-10-09 14:56:43,差评四个按键中功能按键失灵无法使用按几十次偶尔有一次能按到如果不是嫌麻烦就申请退货了已经申请美的售后维修更换按键了这么严重的问题出厂竟然没有测试好真的很怀疑美的的品控,6.054599840155106e-06
18928,6863137.0,1.0,2018-04-29 21:45:28,安装工上门安装不知道元安装把燃气热水器挂上打完玻璃双层孔收费元给签单了我问他这是元安装费辅材免费你回去问问在给我打电话第二天哈密客服打电话问安装的事跟她说了辅材免费之后给安装工打电话说明天安装第二天打电话不接又找客服安装工才给打电话说今天去不了明天安装我没同意又给客服打电话安装工来了我说先不用安把辅材给全了就行还让我下楼去取我没去他就给送上楼两个角阀两根波纹管我一看安不上他说客服就给这些我说那就给装上吧他又下楼取了两个波纹管两个短丝安装工素质太差第一次给差评给的是安装工人的热水器还没试不知道怎么样一直相信大品牌美的没想到这次是这样好好管理管理员工吧非常生气,0.0
18929,6863137.0,1.0,2020-04-21 08:03:39,外形外观新机器有很深的划痕安装后不可以换机热水器拿出就有水明显就是人家退回的真心差现在的京东都是卖返修货的谁买谁上当安装费都给了接近块钱真心黑,0.00043526829793505417
18930,6863137.0,1.0,2020-04-20 18:42:03,三月15号买的今天4月20号点火失败就这质量？可快恶心死我了一个多月就这样了,0.0006364092155379808
18931,6863137.0,1.0,2020-04-19 10:26:28,安装服务官网提示200的安装费安装师傅说要600真的是笑掉大牙了,0.00110429970714776
18932,6863137.0,1.0,2020-04-18 14:36:25,买来才安装好结果一用就坏感受极差,0.0041138504475835
18933,6863137.0,1.0,2020-04-17 20:09:08,安装还收费117美的穷疯了？零星差评,0.03991489356396993
18934,6863137.0,1.0,2020-04-17 10:10:38,安装服务这属于误导宣传明明就是收安装费还非强调写不收安装费非说不收人工费但收材料费但请问买热水器不带那些辅助材料怎么使用反正安装完多花200多给其他人提个醒买这个实际成本要高200多至少不是不能接受收费但痛恨这种有明显误导性的行为,2.142502397717294e-09
18936,6863137.0,1.0,2020-04-13 16:10:33,安装的时候没通天然气试不了机现在通气了发现热水器打不着火只能等人来维修了,0.00013254936413109597
18937,6863137.0,1.0,2020-04-12 21:59:11,很少给差评这是第一次一买新的来就漏水新机器师傅拆开机才修好实在是质量不敢恭维美的质量不应该这样的正式让人心寒啊一个机子不到四年就坏了没想到刚买的就漏水出厂不检查那,3.219143274169056e-08
18939,6863137.0,1.0,2020-04-11 10:59:44,居然是坏的师傅说只能退货处理不满意,0.0010635319319379777
18940,6863137.0,1.0,2020-04-09 14:44:37,安装服务安装人员态度差乱收费乱搭水管投诉无果一周都没给解决这么多年这么相信的美的以后再也不会买了,3.81534986459986e-06
18941,6863137.0,1.0,2020-04-08 04:44:29,垃圾一星期后打不着火,0.006937161617357024
18942,6863137.0,1.0,2020-04-07 09:14:40,京东物流送货时间准时服务五颗心美的售后服务的安装部门提前3天都确定不了安装时间因为我只有上午有时间但给你们三天选一个上午也不行那你们直接在购买时公示上午不能安装得了,0.008918830476623119
18943,6863137.0,1.0,2020-04-03 08:13:18,外形外观昨天装好的老式机超难看售后配的耗材超贵是市场价的2倍以上还没用就被坑了不知道以后会出什么问题,0.050017979131200985
18945,6863137.0,1.0,2020-03-30 10:53:23,送货还好就是安装师傅态度特别不好下次再也不到美的买东西了安装师傅态度太不好了各种说缺这个那个的要钱,0.00012395226043415697
18946,6863137.0,1.0,2020-03-28 18:39:44,脚印是什么鬼？赠品嘛？配送员态度不好明明能送上门的非说不能进入小区不配送让我自己搬回家非常不愉快的一次体验,8.02930617835873e-05
18947,6863137.0,1.0,2020-03-26 12:38:33,出了问题就是找不到人工客服,0.020514013312997625
18948,6863137.0,1.0,2020-03-26 10:44:01,两个月左右电路板就坏了,0.026880981457524267
18949,6863137.0,1.0,2020-03-23 17:17:36,安装师傅态度一般现在机器还没完全安装好,0.03580370735101113
18950,6863137.0,1.0,2020-03-22 14:32:08,安装太贵了机子才1088安装就要560见鬼了,0.045110560836944424
18951,6863137.0,1.0,2020-03-19 09:50:14,页面说的挺好告别忽冷忽热这是实现忽冷忽热的啊放到热水时候一关再开不到十秒的时间又是凉水洗个头涂一下洗发水再开就又是一冷一热一热一冷现在天气还好暖和点这要是冬天不得冻感冒提交退货申请售后客服小美019贼厉害只有她说的话都是对的我说的都是错的我农村的没见过热水器长啥样啊想用热水要一直开着不能停哪怕不到十秒真是不用不知道一用吓一跳啊美的这么大牌子现在怎么这样了,2.220446049250313e-16
18953,6863137.0,1.0,2020-03-10 23:04:06,热水器送来时水管里面有水表面度膜己被撕掉只剩下角落上有一点表面有轻划痕问客服客服说水管有水是出厂试机这个我能理解但是又说出仓库时要撕掉膜这个解释不通啊我问她膜是不是起防灰尘搬运途中防划伤和安装时防脏手印等她说不知道反正撕掉的今天下午送来的晚上就看了发现了问题她说还不给退货现在的京东自营店都这么差一星是给快递的,0.0
18956,6863137.0,1.0,2020-03-08 19:56:50,20年2月22日使用今天是2020年3月8号热水器已经牺牲了显示E1美的美的想说爱你不容易,0.09325463284585656
18957,6863137.0,1.0,2020-03-08 16:14:38,安装服务排烟管不够长进出水管没接这也叫安装吗？,0.006923727358129961
18958,6863137.0,1.0,2020-02-25 16:18:57,京东和商家不按照约定支付延时补贴电话客服说是没有参加活动但网页界面（现已更换）及在线客服均表示有延时补贴请给个说法,2.7376214628560547e-09
18959,6863137.0,1.0,2020-02-25 14:34:13,啥商家明明写的免费安装机器好不好用先别人就凭乱收费就不合理还块钱希望大家购买是看清楚,0.00045127831613056557
18960,6863137.0,1.0,2020-02-18 12:54:03,这个热水器是坏的赶紧换货,0.008280762447704704
18962,6863137.0,1.0,2020-02-12 15:53:37,漏好大的煤气,0.47950107515719254
18963,6863137.0,1.0,2020-02-10 09:20:51,价格变得太快刚过价格保护就大降价也是无语,0.21039121094557356
18964,6863137.0,1.0,2020-02-06 12:52:19,安装服务美的的东西还可以但是你们的安装时配件费用太高了配件费用比市场价贵一倍都不止你们不要当买家都是傻子上当一次就不会有第二次,0.00037845318016704876
18966,6863137.0,1.0,2020-01-28 18:16:43,安装服务网购的需要走管道服务网点不给提供免费安装以外的服务（走管道）只愿意负责安装需要从厨房走外接管道到卫生间安装方要求自己找水电工把管道安装好以后他们才来安装热水器那我还要你来干什么？单安个热水器谁不会？钻孔还要求我们事先自己钻好？现在热水器拆开放在这里也没法用,5.972822236799402e-11
18968,6863137.0,1.0,2020-01-25 12:46:38,水温不稳定突然一下水温为冰冷的水一下水温烫皮肤洗澡一次至少四五次,0.014435810616276967
18969,6863137.0,1.0,2020-01-24 17:34:19,安装师傅太不负责任了烟管没全弄出去燃气管接头还有点漏气,0.00019868489790708654
18971,6863137.0,1.0,2020-01-22 18:08:08,恒温效果一会热一会冷咋洗澡气死了了安装服务1200的机子收了600的费用坑不是胡乱要价就是太贵了,4.400659386227801e-06
18972,6863137.0,1.0,2020-01-21 22:50:38,安装服务安装费用极高管路都是现成的就这下来很过分建议不要入手,0.12697559492077382
18974,6863137.0,1.0,2020-01-21 11:12:51,安装服务安装快速并免费但是拆非美的旧机需要收费,0.4860649740962497
18976,6863137.0,1.0,2020-01-20 15:10:28,噪音大小噪音太大了打开水龙头后火车就来了出水速度慢,0.011570998791833764
18978,6863137.0,1.0,2020-01-18 15:56:46,差评买了洗衣机空调热水器用没多久就有问题别的是洗衣机一肚子火气美的产品现在一心我都不想给想想就火气大,0.00013149633728071208
18979,6863137.0,1.0,2020-01-18 13:38:22,之前买的降价没来得及时间看,0.46759262035731275
18981,6863137.0,1.0,2020-01-16 15:03:44,第一在线客服态度极其差一问三不答答非所问第二没有人来安装,1.1750306240454478e-05
18982,6863137.0,1.0,2020-01-15 15:38:24,这个热水器写了7天包退因为突然不想要了既然退不了我都还没安装使用预约师傅安装也没过来客服打电话过来说让我等结果哈哈哈哈哈真搞笑的美的美的售后不怎么样哦,0.0021530033745769117
18985,6863137.0,1.0,2020-01-14 14:15:45,安装服务安装简直瞎要钱卖为啥不标注好自己买的材料还不给装简直垃圾装个热水器收费小400,6.436066638526583e-07
18986,6863137.0,1.0,2020-01-14 08:47:39,安装服务安装人员编钱这样那样的配件坏了说要换乱收费差评出水速度还可以噪音大小小,5.649060321344379e-05
18987,6863137.0,1.0,2020-01-13 16:31:55,同样链接同样价格同样型号居然不一样功能叫换成一样的客户来一句随机发货然后就玩失踪了这是处理事情的态度吗随机发货为什么不备注清楚真是气人,0.0003636256985944941
18989,6863137.0,1.0,2020-01-13 09:18:04,没几天降价,0.11915768464024712
18990,6863137.0,1.0,2020-01-11 11:50:57,东西送来问什么时候安装说不知道问电话也不知道做什么生意第一次遇到这种,0.004017727805256555
18991,6863137.0,1.0,2020-01-10 14:40:38,买了十天你降价？什么破商家,0.008656704847526564
18992,6863137.0,1.0,2020-01-10 11:24:01,差评是给安装师傅的打电话的时候说不需要什么钱过来安装的时候什么都要钱管子11米给按照15米收钱用一点胶带也要收钱服务简直差的不能再差了安装之前不说清楚装了之后各种收费最后说了一下还是收了五百多买个热水器一千多安装费500多呵呵了安装服务差很差非常差差的不得了,0.0
18993,6863137.0,1.0,2020-01-10 09:56:35,安装服务安装太粗糙图一右侧贴墙无间隙图二与三只用了一个原来墙上就有的小螺丝吊着完全没规范操作更离谱的是拆掉我硬管连接的好的球阀更换新阀加软管收了元明显属于乱收费煤气的软管弯曲这么严重肯定影响煤气的流畅上排口粘纸只包在外套上根本没与内套一起粘住见图六这么多安装问题6臼打电话4008899315投诉接听很不耐烦现在都没反应不理不睬的美的品牌形象难道除了售量大其它服务想向三流货靠齐？这个是美的悲哀,1.554312234475219e-14
18996,6863137.0,1.0,2020-01-07 21:22:42,客户售后是什么鬼一点态度也没直接差评在京东自营买那么多电器都是,0.03163903677607183
18997,6863137.0,1.0,2020-01-07 17:26:58,垃圾谁买谁后悔便宜没好货买来就是用不了的水不热师傅来维护发现掉了一个线头结果还不知道插哪里的,1.3084952689257356e-05
18999,6863137.0,1.0,2020-01-07 08:52:24,安装师傅还可以就是你们公司收费有点乱来出水速度出热水慢大约1种出热水三样东西花了我块钱你们要买要慎重了一根煤气管两根冷热水管两个三通阀170我觉得不值这个价反馈给客服客服回答我们这个是统一收费的所以说大家慎重购买,8.287332953216264e-08
19000,6863137.0,1.0,2020-01-06 13:27:24,黑店坑人的产品千万不要买一个热水器安装人员收费要600多都可以买一个热水器了黑店,5.1877987017334704e-08
19001,6863137.0,1.0,2020-01-06 13:22:49,总之感觉不咋的虽然说是免费安装但是所用的配件都得自己掏钱比市场价钱贵了好多打个小孔一分钟搞定块钱安装花了元都赶上热水器的价钱了更气愤的是洗澡偶尔断热水早知道这样在实体店里购买包材料安装真心感觉不咋样有点坑,7.159001844669888e-07
