id,product_id,score,comment_time,comment,sentiment
42221,25745835099.0,5.0,2019-11-05 02:50:14,操作简单喜欢美的,0.9244503319664042
42224,25745835099.0,5.0,2020-03-22 02:50:15,外形外观好看恒温效果好出水速度快安装服务到位贴心,0.9999971186438312
42225,25745835099.0,5.0,2020-03-26 17:57:59,外观漂亮发货快安装师傅动作麻利挺好的,0.9842035062188088
42226,25745835099.0,5.0,2020-03-05 12:03:39,安装在浴室里安全美观相信美的品牌,0.8535654246753835
42227,25745835099.0,5.0,2019-10-22 12:48:09,安装服务安装速度快给力,0.681779791247394
42228,25745835099.0,5.0,2019-06-13 14:54:31,物流速度快安装师傅也比较细心而且噪音比较小家人比较满意,0.943235072034656
42230,25745835099.0,5.0,2019-12-13 23:24:03,外形外观包装外观完好颜色有点像香槟金送货速度快,0.9999254461691774
42233,25745835099.0,5.0,2020-05-19 18:34:55,恒温效果好噪音大小小安装服务专业细心,0.9960531162096883
42236,25745835099.0,5.0,2019-11-29 08:09:31,恒温效果是买过最好的热水器了性价比高外观也好看整体满分美的老牌子值得信任,0.9999701952276421
42239,25745835099.0,5.0,2019-12-26 00:48:05,外形外观美观大方出水速度爽歪歪,0.9998844484736497
42240,25745835099.0,5.0,2019-09-30 17:22:31,外形外观简洁恒温效果舒适安装服务有效专业,0.999910815239832
42241,25745835099.0,5.0,2019-09-17 16:44:24,送货快安装快mdashmdash主动就有信息过来了不用自己操心打电话商品美观待用后评价质量,0.6106183136350124
42242,25745835099.0,5.0,2020-05-29 19:26:40,配送服务优安装服务好赞,0.984350246232734
42247,25745835099.0,5.0,2020-05-10 18:21:59,不错服务好售后服务好,0.9355116030937755
42248,25745835099.0,5.0,2019-12-14 10:00:52,外形外观较好恒温效果未使用噪音大小一般出水速度未使用安装服务良好耗能情况未使用,0.9731887508468232
42249,25745835099.0,5.0,2020-01-11 11:30:04,产品做的不错安装也到位,0.9412149176349903
42250,25745835099.0,5.0,2020-03-18 21:03:07,物流速度快师傅安装快,0.6108316421123385
42252,25745835099.0,5.0,2019-11-17 20:10:02,恒温效果好外形外观美观安装服务优良出水速度正常耗能情况少,0.9999031008129008
42253,25745835099.0,5.0,2020-03-15 16:13:33,包装完整就等安装了,0.6630981359481177
42260,25745835099.0,5.0,2019-09-29 11:42:14,恒温效果水温恒定安装服务安装快速,0.844142582383051
42261,25745835099.0,5.0,2019-09-24 20:09:43,外形外观不错恒温效果好安装服务快速,0.9997754259311082
42262,25745835099.0,5.0,2019-09-02 15:24:53,大品牌质量好用的安心,0.7454364366653794
42263,25745835099.0,5.0,2019-10-16 23:09:52,美观大气性价比高,0.8837349540322658
42265,25745835099.0,5.0,2019-05-29 16:58:45,美的大品牌保修6年有保障,0.9509437791259757
42268,25745835099.0,5.0,2019-05-29 22:57:43,不错物流快服务好下次再购买,0.9670000135194328
42271,25745835099.0,5.0,2020-04-21 15:25:31,美的热水器收到了目前家里还没装修好等装修好安装完成了再来追加评论期待使用效果,0.871521810520687
42273,25745835099.0,5.0,2019-07-22 20:52:04,很好用装上效果不错安全性提高了用起来更放心,0.9360857896914172
42274,25745835099.0,5.0,2020-02-27 23:18:37,出水速度快外形外观精致,0.9991072156352084
42275,25745835099.0,5.0,2019-11-20 21:34:37,真的很不错价格也不贵很好用,0.9645462518580531
42276,25745835099.0,5.0,2020-01-16 17:03:07,非常好很满意的一次购物工作人员服务态度非常棒好评,0.9906735054536832
42277,25745835099.0,5.0,2019-12-14 13:43:18,物流快尚未使用,0.8681589106568183
42278,25745835099.0,5.0,2020-03-04 13:41:24,配送一如既往地快还没用不过看着很好,0.8854810860221276
42279,25745835099.0,5.0,2020-04-20 21:19:43,外观漂亮使用体验好物流也挺快,0.9991569177884767
42282,25745835099.0,5.0,2020-05-21 16:03:00,总体服务还算满意,0.9179851986483365
42286,25745835099.0,5.0,2020-01-14 12:11:10,外形外观大方漂亮,0.9999492972273125
42290,25745835099.0,5.0,2019-08-30 11:03:43,给家里买的浴室必须装平衡式的选了美的很放心家人说好用,0.9963946668517069
42293,25745835099.0,5.0,2019-12-25 07:39:51,非常好满意,0.804203288518066
42297,25745835099.0,5.0,2019-10-05 14:48:59,噪音大小小出水速度快恒温效果佳,0.9252575552754502
42298,25745835099.0,5.0,2019-09-27 18:55:10,按装服务态度很好,0.6657067428077863
42299,25745835099.0,5.0,2019-11-27 22:32:39,高端大气上档次,0.9930556682288317
42300,25745835099.0,5.0,2019-11-30 11:18:14,外形外观好恒温效果好噪音大小小出水速度好,0.999161428052027
42302,25745835099.0,5.0,2019-07-04 13:23:01,物流还是一如既往的快产品已经安装好试试看,0.9635020286669133
42303,25745835099.0,5.0,2019-08-03 22:21:47,超级好刚好碰上折扣开开心心的拍下,0.9590177275044273
42304,25745835099.0,5.0,2019-10-24 17:33:15,完美安装一流服务,0.9920535210560326
42305,25745835099.0,5.0,2019-07-31 08:57:43,送货速度快热水器很好用,0.8794333599159017
42306,25745835099.0,5.0,2019-11-23 13:01:14,装好了试用效果不错师傅人很好,0.8153288471344055
42308,25745835099.0,5.0,2019-11-03 11:59:21,物流很快使用还可以吧hellip,0.8899446761931282
42309,25745835099.0,5.0,2019-10-17 22:30:40,热水器已使用二十几天物超所值,0.8302519230262764
42311,25745835099.0,4.0,2020-05-16 23:34:11,产品应该还可以但安装排气管的效果不考虑美观,0.6375511081713463
42314,25745835099.0,5.0,2020-05-19 07:59:29,还不错现在燃气平衡机的选择不多就选大牌吧,0.9858753157369613
42318,25745835099.0,5.0,2019-08-31 17:21:23,东西很赞强力推荐,0.9434681742002342
42319,25745835099.0,5.0,2019-09-14 07:46:10,挺棒的啦用着还不错,0.8595122051028389
42322,25745835099.0,5.0,2020-05-01 11:38:33,还可以平衡式里面性价比高的产品,0.993131652267818
42324,25745835099.0,5.0,2019-10-27 19:03:06,效果还不错,0.9201911358926044
42325,25745835099.0,5.0,2019-11-23 22:35:07,好用不错的,0.9141416881265491
42327,25745835099.0,5.0,2020-01-15 21:18:29,恒温效果效果很好不用总调开关了,0.61897671358784
42328,25745835099.0,4.0,2020-03-08 17:52:38,发生了一点小插曲总体是满意的,0.921575034184938
42330,25745835099.0,5.0,2019-12-12 21:15:35,很不错比原来那个好用多了,0.9518123289584978
42333,25745835099.0,5.0,2019-05-20 21:34:10,非常完美使用中满意,0.9578044752280861
42335,25745835099.0,5.0,2019-01-07 12:19:11,货品收到外形漂亮非常好用,0.9835593084566755
42336,25745835099.0,5.0,2020-06-30 12:41:00,物流特别快很好用,0.9193359684777951
42337,25745835099.0,5.0,2020-05-10 01:19:45,很好用外观也漂亮,0.9955439738324225
42338,25745835099.0,5.0,2020-05-02 09:26:45,很满意全五星好评,0.727650159802664
42341,25745835099.0,5.0,2020-06-02 12:30:13,出热水快还不错,0.8850935661108214
42343,25745835099.0,5.0,2020-05-15 15:46:16,很好优秀非常好,0.9734542823574198
42344,25745835099.0,5.0,2020-02-12 22:38:48,恒温效果很好满意,0.979464131085467
42346,25745835099.0,5.0,2019-12-21 15:47:03,非常好用安装很快,0.8819089090293091
42351,25745835099.0,5.0,2020-01-07 17:47:00,外形外观好看,0.9935607005327863
42356,25745835099.0,5.0,2020-01-20 07:15:50,大品牌不错,0.9348624843441088
42362,25745835099.0,5.0,2019-08-23 22:43:31,物流很给力售后安装服务跟进很及时没理由不点赞,0.6102064062385415
42364,25745835099.0,5.0,2019-11-04 18:03:19,物流很快每次急需还是要选京东物廉价美满意,0.9815646291732819
42368,25745835099.0,5.0,2019-07-24 07:25:23,外观还不错还没使用看实际效果再评价,0.9673043254053114
42370,25745835099.0,5.0,2019-09-24 15:10:38,目前一起状态还好待后期再评价,0.9326692876763009
42371,25745835099.0,5.0,2019-12-09 20:36:33,外形外观外观漂亮等待安装,0.999492713848616
42372,25745835099.0,5.0,2019-10-14 15:29:43,外形外观不错噪音大小小,0.9988646886977708
42373,25745835099.0,5.0,2019-10-08 19:20:20,安装服务很快噪音大小小,0.857374320371838
42374,25745835099.0,5.0,2019-06-09 19:22:14,商品非常不错物流快捷妥当客服人员热情耐心有问必答,0.896543266557512
42375,25745835099.0,5.0,2019-12-02 11:47:09,安装服务服务好很专业,0.7189451676956049
42376,25745835099.0,5.0,2019-06-12 14:01:15,很快就到货了趁着618做活动买的第二套房子第二次买了,0.7975468687760426
42380,25745835099.0,5.0,2019-12-08 08:50:36,安装服务快速完美,0.8325535438883435
42381,25745835099.0,5.0,2019-11-14 13:00:27,外形外观美观大方,0.9997159195282832
42382,25745835099.0,5.0,2019-06-14 17:00:40,已经安装好了物流速度很快快递小哥辛苦啦,0.9334884062552117
42384,25745835099.0,5.0,2019-11-27 14:21:24,试了一下还可以,0.6400049700809546
42385,25745835099.0,5.0,2019-11-15 10:31:49,好用好看质量好,0.8655700783936312
42386,25745835099.0,5.0,2019-07-03 13:19:19,服务很好安装满意,0.8119091549240537
42388,25745835099.0,5.0,2019-11-01 21:23:21,外形外观挺好吧,0.99670462449567
42389,25745835099.0,5.0,2019-10-20 15:11:31,热水很快还不错,0.9590644039564207
42394,25745835099.0,5.0,2019-11-13 23:07:23,速度快服务好,0.9184491460022429
42395,25745835099.0,5.0,2019-08-03 09:38:38,非常好用不错,0.9141416881265491
42397,25745835099.0,5.0,2019-07-17 17:37:57,美的的就是好,0.9119686661707733
42403,25745835099.0,5.0,2019-06-02 18:27:18,发货速度快快递小哥热情负责,0.7799346363833468
42408,25745835099.0,5.0,2019-06-13 11:33:22,已经安装好开始用了挺好的,0.8330075664066208
42412,25745835099.0,5.0,2019-06-14 13:56:20,送货安装都很快很好用,0.9249519105821408
42414,25745835099.0,5.0,2019-05-05 00:09:51,刚用都还好满意,0.7490130248921288
42415,25745835099.0,5.0,2019-06-16 08:40:47,性价比高满意,0.9774920015955396
42427,25745835099.0,5.0,2019-09-08 13:57:11,这么一节烟管都这么贵,0.7184735438076946
42435,25745835099.0,5.0,2019-12-08 15:00:50,上午下单傍晚到货翌日安装挺快捷的刚装好试用了一下很不错,0.9711382733265419
42450,25745835099.0,5.0,2020-05-25 22:57:32,外形外观非常漂亮触摸按键非常灵敏恒温效果超级好洗澡也能这么享受噪音大小几乎感觉不到超静音出水速度3秒出热水非常稳定安装服务态度很好服务到位耗能情况2级能耗相当省气煤气表感觉都慢下来了,0.9332724669385829
42478,25745835099.0,5.0,2020-04-24 10:17:52,美的大品牌质量有保证节能安全外观大气时尚加热快出水快无噪音售后安装快捷热心确实好用,0.9997098100805116
42547,25745835099.0,5.0,2020-01-19 09:02:09,外观质量超出预期了机体很漂亮很有质感智能触控方便之前需要增压器装这款可以不用增压器此次安装人员服务态度也很好耐心细心认真负责唯一缺点就是这个热水器打火到出热水比较迟钝总体来说还是很满意的,0.9999685740254483
42566,25745835099.0,5.0,2020-01-04 15:35:05,外形外观时尚美观机体颜色与浴室搭配恒温效果出水稳定水温均衡噪音大小声音比我以前的的热水器小很多安装服务安装小师傅认真耐心服务良好,0.9926395570625053
42570,25745835099.0,5.0,2019-12-31 13:00:29,外形外观外观很漂亮恒温效果好噪音大小一点点声音耗能情况很小安装服务一流的服务出水速度大,0.9999993768304103
42573,25745835099.0,5.0,2019-12-28 11:51:53,热水器已装好送货和安装的速度很快前晚下单今早已装好热水器外观简洁高档触控板比以前那台老式机用来扭的好用多了操作和控温都方便,0.6800098819483733
42575,25745835099.0,5.0,2019-12-26 01:32:46,噪音大小真的很静音安装服务师傅很好安装快外形外观玫瑰金很高大上恒温效果很好出水速度我家水压较低但出水还可以,0.9999489322418131
42618,25745835099.0,5.0,2019-12-04 19:14:23,上午买下午就送到了非常满意外观设计漂亮噪声小水温变升随便调很方便安装师傅态度好美的品牌值得信赖,0.9998272575605538
42641,25745835099.0,1.0,2020-03-29 23:08:11,差防烫恒温功能根本就不管用,0.13921033612867917
42643,25745835099.0,3.0,2020-03-18 16:21:19,安装太坑加管收费太贵比黑你家第一,0.00514652111554037
42655,25745835099.0,1.0,2020-02-07 15:47:12,这一个星是给快递的确实不错可是售后安装却极差拖了5天不给安装挂了10个电话也不接很没礼貌就是这个电话很差劲,5.222972109253377e-07
42676,25745835099.0,3.0,2019-12-13 15:39:40,热水器12月9日买的第二天就到了非常的快但没想到会把热水器和烟管分开发货而且收到热水器后才发烟管过来10号约了师傅过来装机才知道热水器里面没烟管装不了客服又没有说是分开发货的真心的无语12号烟管到了就再约师傅过来装热水器师傅来到了说管不够长要订了才可以装怎么售后没有通知我要订加长的管怎么美的售后会这样非常的无语非常的非常的后悔买了这台热水器现在又不知道要拖到多久才装了安装服务真心的无语12号烟管到了就再约师傅过来装热水器师傅来到了说管不够长要订了才可以装怎么售后没有通知我要订加长的管之类的事情怎么美的售后会这样非常的无语非常的非常的后悔买了这台热水器现在又不知道要拖到多久才装,0.0
42726,25745835099.0,3.0,2019-06-13 20:59:39,美的的燃气热水器平衡式的安装师傅很认真但安装后的进气管很碍手每次使用热水器都担心会碰到到气管而漏气不知道美的的售后和安装师傅有没有注意到这个问题,0.0019131758375040553
42738,25745835099.0,1.0,2019-11-07 22:42:29,昨天才装好今天用居然用不了现在连热水洗澡都没有恼火,0.0040880531107243545
