id,product_id,score,comment_time,comment,sentiment
41340,39974630844.0,1.0,2020-03-04 09:12:53,垃圾产品谁买谁后悔坏了半个多月还没修好说是没配件叫我耐心等待谁他的妈有半个月的耐心啊扔了重新买吧,2.145991277535675e-05
41341,39974630844.0,1.0,2019-12-19 10:42:31,安装服务双十二抢购到今天才有人打来预约安装收到货还需要自己去打预约登记安装星期一已经登记今天星期四才预约到明天下午来请问还需要多少步骤才能用上热水器页面广告全部是配在浴室里的热水器误导欺骗客户以为可以安装在浴室里做虚假广告,8.681144691990994e-11
41342,39974630844.0,1.0,2019-03-12 08:56:31,太差买了用了一个月期间坏了好几次经常打不着火商家到现在没给任何回应只会让售后来修修完重装第二天或者过两天还会打不着火商家态度恶劣千万不要买液化气用的这款真是买来窝火耽误多大事现在已经拆下来装箱里等着商家处理,5.526690216584029e-13
41343,39974630844.0,1.0,2019-02-01 15:08:52,他们家的东西质量很差服务态度也不好一点信誉都没有第一次付款了东西还没有发货就要我加钱换一款我就听了店家的加钱换一款换了收到了等我回老家了安装居然线路板是坏的店里不换也不退都不要相信他们家的东西质量极差,7.519053168980605e-08
41344,39974630844.0,1.0,2020-04-28 11:27:50,很糟糕的一次体验无话可说页面写着低水压到了师傅说是高水压要加装增压泵想退货又说螺丝包拆开退不了开始打开包装里面还有水迹说是出厂调试客服也是问她这热水器是高压低压就是不正面回答希望大家看清楚考虑清楚在买,2.404438870229342e-10
41345,39974630844.0,1.0,2020-05-14 01:18:06,除了一个裸机外连安装的螺丝都不给一个买过这么多的商品这是头一回碰到致使我拿到货到现在还无法使用联系安装人员回答我说我买的就是裸机其他的东西哪怕是一个安装螺丝都要另外问他买,1.3409226884419922e-07
41346,39974630844.0,1.0,2020-01-02 18:44:38,安装服务安装太差我所在区域的这个网点安装服务太差技术不好以前让他们装空调把我房间打了两个洞太丑了本来这次没想给差评安装师傅一开始说给装后面我说只要给我打洞就好其他材料我不买没钱赚了之后态度感觉瞬间转变爱来不来以及热水器进气孔那个很容易坏我的刚装就滑牙了其他的地方热水器还可以本身我也是在做美的这一块的但是对于之前空调和热水器一家安装公司真是受够他们了,5.329070518200751e-15
41347,39974630844.0,1.0,2019-02-14 17:00:01,顺丰物流很快但设备设计真不够科学对于农村电压不稳的地方千万不能买电压不稳的情况下点火都点不着好烦躁每当节假日尤其像春节是用电高峰时间此时农村的电压一般都会偏低这个季节恰恰是最需要用热水器的时候却不能正常使用而且我详细看了这款产品的详情介绍都没有写电压在什么范围内才能正常点火使用helliphellip元买来挂在墙壁上当装饰好烦hellip,0.059263075421081
41348,39974630844.0,1.0,2019-11-22 09:34:59,谢谢的商家我这辈子第一次遇见回来的货自己试机漏水了说我自己安装导致的不退货叫师傅出了鉴定书说是质量问题师傅都说了质量跟安装是两码事都不退不是我催它们处理它们都不处理难怪这店如此多差评无奈啊垃圾商家第一次碰见死都不买双11到今天22号了都没有人给我处理块吃了我的你会安乐吗？美的总公司也是说我自己安装师傅也说难道我安装不会出现这样的问题吗？一样会出现的管漏水厉害无奈千万不要买真的,7.993605777301127e-15
41349,39974630844.0,5.0,2019-10-29 16:31:46,外形外观很好看恒温效果很好噪音大小可以接受出水速度我原来是7升的这个是12升的出水比原来大多了安装服务安装师傅服务态度很好安装及时安装师傅和客服都能做到耐心细致售后服务这一块做的很好值得表扬,0.9993487618199817
41350,39974630844.0,5.0,2020-05-13 18:12:38,很好很快一条龙服务大品牌可信赖安装服务师傅很专业安装好过后收拾的干干净净恒温效果稳定噪音大小一般般出水速度出水很好跟本地水压有关,0.999945945181575
41351,39974630844.0,5.0,2019-10-20 12:14:37,原来用的也是美的热水器所以这次还是换用美的热水器出水量由7升换成12升的发货速度快第二天就到货安装及时试用出水量比原来大多了恒温效果很好特别是客服态度很好回答及时值得表扬一次愉快的购物这是一家值得推荐的店,0.9835298313450974
41352,39974630844.0,5.0,2019-10-24 11:35:03,包装很好安装师傅很专业很耐心热水器外观很好看质量很好而且价格实惠真正的物美价廉京东值得信赖,0.9999924641857446
41354,39974630844.0,5.0,2019-11-20 12:57:41,满意的的一次购物比实体店便宜佷多水量非常大温度稳定值得推荐的一款产品五星好评,0.9891496939904694
41355,39974630844.0,5.0,2019-10-15 13:47:56,外形外观很大气恒温效果表现很好噪音大小不大出水速度很快安装服务师傅跟热情,0.9993767822517048
41356,39974630844.0,5.0,2020-03-23 13:30:04,外形外观大小合适外观漂亮恒温效果自己设置温度水温很舒服噪音大小噪音小很满意出水速度出水速度非常快超赞安装服务师傅态度非常好技术也熟练总之很满意耗能情况这个还待用过再评,0.9999986554754473
41357,39974630844.0,5.0,2020-05-31 15:12:20,外形外观非常好看恒温效果超级棒噪音大小一般般出水速度verygood安装服务一级棒耗能情况不清楚,0.9999085143639256
41358,39974630844.0,5.0,2020-05-23 14:01:07,宝贝收到包装很好很干净物流也超级给力东西热水器还没有到安装的电话就打来了不错安装的超级好安全好用,0.8295005084786716
41359,39974630844.0,5.0,2019-12-13 11:08:14,产品质量非常好大气热水很快温度没有变化洗澡很舒适一直信仰美的产品大品牌服务及时到位,0.9999931735909021
41360,39974630844.0,5.0,2019-10-31 19:32:18,外观设计很好看出水够大非常满意的一次购物明天预约师傅过来安装,0.7607811279972235
41361,39974630844.0,5.0,2019-12-14 11:41:48,大品牌值得信赖质量很好外形美观大方安装师傅打电话第二天早上就来安装了非常满意,0.994317013723879
41362,39974630844.0,5.0,2019-12-28 07:51:13,外形漂亮恒温可调声音也不是很大出水速度也行特别是安装师傅特别好还帮忙找切玻璃师傅给我,0.7704605432540992
41363,39974630844.0,5.0,2019-10-04 15:10:08,恒温效果舒服安装服务非常好外形外观大气出水速度很快,0.9999833359854627
41364,39974630844.0,5.0,2020-05-30 11:49:26,外形外观简洁大方恒温效果一级棒噪音大小很小出水速度很快安装服务服务到位耗能情况还可以,0.9999999664444768
41365,39974630844.0,5.0,2020-04-15 11:10:27,出水速度出水蛮快的噪音大小声音小耗能情况用气很正常外形外观很大气恒温效果蛮好的,0.9967190693087965
41366,39974630844.0,5.0,2020-01-16 18:59:06,恒温效果外观高大上水流稳定恒温效果佳,0.9985433718993957
41368,39974630844.0,5.0,2019-12-22 20:00:48,出水速度出水快出水量大恒温效果很好安装服务安装师傅真的很专业态度很好,0.9013514513577824
41369,39974630844.0,5.0,2019-01-21 12:19:52,热水器很好外观时尚洗的很舒服卖家态度好,0.9771809742727775
41370,39974630844.0,5.0,2019-12-17 17:15:56,热水器质量很好外观漂亮出热水快没有燥音安装师傅态度热情细心很满意,0.9955617890239111
41371,39974630844.0,5.0,2020-01-15 17:36:24,外形外观符合描述安装服务非常好速度快服务很热情恒温效果好噪音大小可以接受出水速度可以,0.9999828188221046
41373,39974630844.0,5.0,2020-06-17 16:57:55,由于拍前没问清楚商品的安装要求结果快递到家才知道不能安装在卫生间但经过和卖家沟通卖家很快就叫我退贷值得信赖的卖家指导我如何按程序退贷店铺和美的品牌值的信赖,0.9975065648356715
41375,39974630844.0,5.0,2019-11-25 22:23:59,外形外观很好恒温效果很好噪音大小很小出水速度快安装服务快耗能情况还可以,0.9996819825497726
41376,39974630844.0,5.0,2020-04-15 17:37:20,超级好用水量大水温度好下次还买,0.6421560882330003
41377,39974630844.0,5.0,2019-09-01 14:56:49,因物流原因迟一天到货预约的安装师傅很专业美的大品牌值得信赖,0.9191289257354472
41379,39974630844.0,5.0,2020-05-28 12:37:51,安装好服务好安装态度很好很细心,0.981561068072356
41380,39974630844.0,5.0,2019-12-22 18:38:46,噪音大小很小的声音耗能情况还可以出水速度热水速度很快安装服务安装很好,0.8687915740394495
41381,39974630844.0,5.0,2019-01-05 18:00:55,货物收到了买的第二台美的热水器质量不错很喜欢,0.6927837652284755
41382,39974630844.0,5.0,2019-10-07 11:30:09,噪音大小不大恒温效果很好外形外观时尚出水速度很快耗能情况第一次实用还好,0.9997999803862673
41383,39974630844.0,5.0,2019-08-12 13:05:53,非常满意低压启动恒温热水声音也很小用了华帝和万和都不行还是美的的不错,0.9430635952707668
41384,39974630844.0,5.0,2019-10-18 12:41:18,安装服务很好外形外观耐看恒温效果挺好噪音大小能接受出水速度不错耗能情况挺不错,0.9999863856665947
41385,39974630844.0,5.0,2019-11-25 09:10:34,家里原来的那个出水量太小而且水不热果断换的这一个收到货安装师傅就过来安装了大牌用起来舒心多了出水速度很快水很大恒温效果也很不错之前也去实体店看了都要两三千一台买的这个相对于特别划算了而且效果特别好满意,0.9946094781783614
41386,39974630844.0,5.0,2020-06-21 00:02:04,质量很好很满意快递也很快,0.9581760753612499
41387,39974630844.0,5.0,2020-04-13 17:47:27,购买之前反复比较了几个品牌的热水器最后在美的美地店家客服人员的祥细介绍下决定购买这款热水器从下单开始就亲身体验了（美的）的优质服务下单一天后就送到家并且安装好速度之快令人称赞通过试用热水器不但外观设计美观时尚颜色靓丽功能齐全操控简便全电脑控制数码显示而且出热水非常快流量大无噪音非常棒更让人觉得满意的是终身保修和优质的售后服务真是不买贵的只买对的美的生活从此开始,0.9999999951638345
41388,39974630844.0,5.0,2019-01-08 22:05:15,东西和描述的一样美的大品牌值得信赖老公自己安装的比较简单水压低的时候也启动的量很好,0.9995678838868458
41389,39974630844.0,5.0,2020-03-05 14:12:56,外形外观很好恒温效果很好安装服务非常好给老爸老妈买的他们说非常不错,0.9997914551895147
41390,39974630844.0,5.0,2020-04-09 14:33:15,外形外观很精致噪音大小一般出水速度大安装服务很好,0.9992989231398334
41391,39974630844.0,5.0,2019-07-09 12:02:44,包装完好美的热水器很有分量有些重配件齐全,0.9564610917519846
41392,39974630844.0,5.0,2019-09-27 22:15:09,已收到自安装很好用大品牌就是不一样送货很快服务很好放心买吧,0.9862181068313259
41393,39974630844.0,5.0,2019-06-21 20:45:24,给乡下亲人买的回去装上就用了很好用也很划算好品牌值得信赖,0.9994757244569823
41394,39974630844.0,5.0,2020-04-23 15:07:27,发货速度快东西也很好安装服务也非常好赞,0.9951500753223023
41395,39974630844.0,5.0,2020-03-02 21:11:11,加热效果很好售后服务周到及时值得信赖,0.9984729399279981
41396,39974630844.0,5.0,2019-12-12 23:01:40,出水速度很快安装服务一般外形外观满意噪音大小安静耗能情况不清楚恒温效果非常好,0.9996582406262068
41397,39974630844.0,5.0,2020-06-22 13:26:32,安装及时服务好非常满意安装服务安装及时服务好非常满意,0.7341253726786913
41399,39974630844.0,5.0,2020-05-01 16:26:20,外形外观好看恒温效果不错噪音大小很小出水速度快安装服务好,0.9999632413680384
41401,39974630844.0,5.0,2020-03-21 16:33:31,恒温效果效果不错噪音大小很好出水速度不错安装服务服务很好,0.9995409695624184
41402,39974630844.0,5.0,2019-01-31 14:03:41,非常满意尤其是美的售后服务安装人员态度和技术专业都非常满意,0.8748376644122718
41404,39974630844.0,5.0,2020-05-05 09:53:59,安装服务满意很迅速,0.7155674371888064
41405,39974630844.0,5.0,2020-01-01 19:41:15,恒温效果很好的热水器恒温恒湿可以的,0.9170987571826626
41407,39974630844.0,5.0,2020-03-26 11:29:26,不错物流很速度疫情期间自己装的,0.8422351649895718
41408,39974630844.0,5.0,2019-09-21 11:53:07,物流快昨晚用了很好用值得购买,0.9663739874420337
41409,39974630844.0,5.0,2020-06-18 20:02:09,美观大方用着效果真心好用,0.9966584433991891
41410,39974630844.0,5.0,2020-05-15 17:13:01,送货很快安装师傅也很好综合来看服务挺好的,0.9371412057988378
41413,39974630844.0,5.0,2020-01-22 10:59:53,发货速度很快安装师傅态度也很好用了感觉不错,0.9380974498698837
41416,39974630844.0,5.0,2019-08-22 08:49:55,美的的电器真心不错家里的电器基本上都是这个牌子的值得信赖,0.9999932988036753
41417,39974630844.0,5.0,2019-05-16 23:16:12,今天刚装好用了体验感挺好的而且功率很大很舒服可以多用很实用,0.9990055233370262
41420,39974630844.0,5.0,2020-04-27 13:40:18,恒温效果非常棒安装服务动作速度熟练,0.9957979260894965
41421,39974630844.0,5.0,2019-12-24 06:43:40,产品质量好使用效果很好,0.8956333305228396
41424,39974630844.0,5.0,2020-06-17 09:41:18,师傅帅气安装专业很满意,0.8860745004015584
41425,39974630844.0,5.0,2020-03-31 09:50:00,恒温效果很好非常不错的一款,0.9939539033087192
41426,39974630844.0,5.0,2019-02-22 19:43:05,还可以安装速度很快没有多花钱安装值得推荐美的品牌值得信耐,0.9947466618238824
41428,39974630844.0,5.0,2020-05-01 09:57:29,外观漂亮服务超级好,0.987984987999759
41429,39974630844.0,5.0,2020-02-26 12:31:03,服务很好非常满意,0.8775849094310667
41431,39974630844.0,5.0,2019-07-21 21:17:40,质量挺好的物流特别快,0.9330141919778477
41433,39974630844.0,5.0,2019-05-14 15:15:16,安装上门快服务很满意很专业好评,0.8826041007475444
41434,39974630844.0,5.0,2019-04-26 17:50:43,东西用了一段时间非常不错,0.932640991460951
41435,39974630844.0,5.0,2019-01-29 11:24:26,很好不错水压很大,0.9838091739892806
41436,39974630844.0,5.0,2019-12-23 09:56:46,外形美观大方经济又实惠好看也很耐用刚装上就试了一下挺好的美的一直是我家信任的品牌继续支持,0.9999983702134726
41437,39974630844.0,5.0,2020-01-27 21:02:00,外观漂亮恒温效果好噪音小出水速度快耗能比以前7升的略大,0.9993789004707079
41438,39974630844.0,5.0,2019-11-16 22:11:38,出水速度出水迅速水流畅外形外观外观大气形象好恒温效果水温恒定且不会突变,0.9999882318766848
41439,39974630844.0,5.0,2020-02-26 12:00:51,外形外观简洁大气上档次恒温效果温度变化不大噪音大小较小出水速度较快耗能情况较好,0.9999964964657793
41440,39974630844.0,5.0,2019-12-18 10:28:06,安装上了外形好看质量好出水速度快客服态度好满意,0.9425492187533326
41441,39974630844.0,5.0,2020-02-26 11:50:57,外形外观好看智能化热水器安装服务服务周到有专门的售后安装师傅,0.944319816478771
41443,39974630844.0,5.0,2020-03-04 13:42:00,使用方便出水恒温效果好疫情期间老公自己动手安装完成棒棒哒,0.668639611467408
41444,39974630844.0,5.0,2020-02-01 23:52:44,外形外观外形可以图片显示按键简单恒温效果调到适合自己的温度噪音大小没什么声音出水速度快洗起舒服安装服务自己动手安装少个煤气进口接头,0.9941032100250966
41445,39974630844.0,5.0,2019-10-22 13:45:46,外形外观不错美观恒温效果可调可控噪音大小适合,0.9997157953038444
41446,39974630844.0,5.0,2020-04-10 14:24:54,出水速度迅速出量大热水外形外观造型美观大方恒温效果100噪音大小可以忽略,0.9999959121048866
41447,39974630844.0,5.0,2020-05-26 22:13:05,外形外观挺好恒温效果还行貌似是用完了里面一点热水就要重新烧热还好水热的快产品还不错,0.9965976569384369
41448,39974630844.0,5.0,2020-04-06 16:43:26,外形外观一般恒温效果良好噪音大小小出水速度快安装服务我是自己安装耗能情况待观察,0.999535521807399
41450,39974630844.0,5.0,2020-02-10 09:22:42,外形外观外观时尚简约恒温效果比以前万和的效果好多了出水速度立马就能出水终于不用在等待了,0.9999835919938036
41451,39974630844.0,5.0,2019-10-31 18:45:29,外形外观外形还不错颜色挺好的尺寸也不错恒温效果温度目前用下来还是挺稳定的噪音大小烧水声有一点但还是能接受范围出水速度出水挺快的,0.9999986378639909
41452,39974630844.0,5.0,2020-06-29 11:35:52,服务周到安装到位产品性能好安装师傅服务耐心周到,0.9832380743590635
41453,39974630844.0,5.0,2019-12-13 12:49:05,外形外观小巧精致出水速度出水速度可以也就几秒钟的事,0.9995598841672876
41455,39974630844.0,5.0,2019-03-10 09:27:08,外观漂亮使用灵巧质量过硬心情愉悦,0.9985155004141102
41456,39974630844.0,5.0,2020-02-02 17:25:14,噪音大小有点大出水速度快安装服务自己动手恒温效果一般外形外观可以耗能情况可以接受,0.9978774069058152
41457,39974630844.0,5.0,2019-06-06 06:29:19,物流好收到货打开看到品质可以服务卡齐全服务比较好货收到就有客服联系安装服务比较信赖没有后顾之忧,0.7797519104256073
41459,39974630844.0,5.0,2020-04-14 17:23:22,恒温效果挺不错噪音大小噪音不大出水速度出水挺快安装服务服务周到,0.9995111972251375
41461,39974630844.0,5.0,2020-01-19 20:03:27,外形外观漂亮美观大方恒温效果温度可调噪音大小小出水速度快,0.9999983742020528
41466,39974630844.0,5.0,2020-01-30 12:08:29,安装服务不错出水速度还行外形外观帅气恒温效果比以前的好,0.9999904368243401
41467,39974630844.0,5.0,2019-12-12 17:15:12,出水速度可以安装服务可以外形外观挺好看,0.9968427621664258
41469,39974630844.0,5.0,2019-07-06 10:04:00,店家服务热情细心耐心让人感受更象跟家人交流的感觉老水器还还没看就不忙晒图等安装好再追评吧因为烟管问题热水器要换地方过多几天才能安装好再晒图追评,0.9126932449742502
41470,39974630844.0,5.0,2020-01-15 03:57:38,家里老的热水器有故障了不修了直接换个新的省事赶上京东年货节活动新的外观好看到货自己安装一小时完成试用不错值得购买,0.9588692881195718
41472,39974630844.0,5.0,2020-01-17 20:33:54,出水速度大外形外观小巧美恒温效果持久噪音大小小安装服务快速耗能情况不高,0.9996794752522045
41474,39974630844.0,5.0,2019-12-12 21:05:04,外形外观好恒温效果好噪音大小有点大出水速度快,0.9976345812675997
41475,39974630844.0,5.0,2020-04-25 18:08:28,一如既往的支持美的品牌的产品每个房子配的都是这款,0.9985115803517762
41480,39974630844.0,5.0,2019-10-17 20:23:46,买回来自己安装的挺好操作的简单易懂就是物流很慢,0.6694349703382454
41481,39974630844.0,5.0,2020-05-05 14:54:27,外形外观简洁美观噪音大小不算大可接受,0.998388461344769
41482,39974630844.0,5.0,2019-12-27 19:13:13,目前状态完美希多用几年安装服务挺快挺好,0.9991942870103492
41483,39974630844.0,5.0,2020-01-30 17:08:43,恒温效果水温恒定冲洗舒服棒棒的,0.9997850104052745
41484,39974630844.0,5.0,2020-06-06 15:33:20,好用不错下次新房子再买一套,0.9751565498726551
41485,39974630844.0,5.0,2020-02-26 15:28:29,外观很美但噪音大了点,0.9808608361264708
41486,39974630844.0,5.0,2020-02-12 18:32:09,质量好还包安装不错,0.8498041911133442
41489,39974630844.0,5.0,2020-05-29 12:51:48,安装服务安装速度快服务满意,0.8283328902540935
41490,39974630844.0,5.0,2020-04-18 18:12:09,值得信耐的品牌与服务,0.8536452835880084
41492,39974630844.0,5.0,2020-01-28 20:44:44,价格实惠质量放心,0.9537872699323742
41493,39974630844.0,5.0,2019-10-28 12:42:32,外形外观外观不错挺重的质感好,0.9998227907302812
41494,39974630844.0,5.0,2020-06-06 16:06:41,己安装好服务好,0.6494234239575081
41495,39974630844.0,5.0,2019-03-19 12:22:01,看着还不错名牌的就是不一样有待使用,0.9544336004670069
41496,39974630844.0,5.0,2019-12-10 10:22:28,帮朋友购买物流一般服务还可以,0.8083612959954766
41498,39974630844.0,5.0,2019-03-05 09:50:23,家里用的总体还可以吧美的值得信赖,0.9987538540669932
41499,39974630844.0,5.0,2019-05-27 14:38:15,服务安排都挺好下次还会购买,0.9970121236833107
41500,39974630844.0,5.0,2019-06-09 18:00:51,自己安装了跟旧的打孔位置差不多好用最怕低水压熄火希望这款不要发生,0.7893253764826975
41504,39974630844.0,5.0,2020-02-06 19:40:00,噪音大小大外形外观还可以恒温效果不好耗能情况一般,0.9839889252777045
41505,39974630844.0,5.0,2020-05-20 00:31:05,非常实用挺好的京东买东西就是放心,0.9628863294462889
41507,39974630844.0,5.0,2019-12-25 09:14:43,还没有按装按装以后在来平价,0.6396765548090153
41508,39974630844.0,5.0,2020-01-09 10:53:46,还没安装用完之后追评mm,0.7835014072771693
41509,39974630844.0,5.0,2019-12-03 09:32:22,噪音大小小恒温效果好出水速度快外形外观美,0.999685609955468
41510,39974630844.0,5.0,2020-01-17 00:12:09,售后服务特别好一级棒,0.978090058817506
41511,39974630844.0,5.0,2019-12-14 16:18:01,这款热水器确实不错大家可以放心购买,0.9731847231415965
41512,39974630844.0,5.0,2019-10-07 19:19:28,这款燃气热水器今天刚装上去感觉的蛮好的,0.696251760441345
41513,39974630844.0,5.0,2019-09-28 14:46:06,给老人买的很不错父母非常满意,0.9936848079756231
41514,39974630844.0,5.0,2020-05-09 17:19:50,物美价廉送货和安装都很及时把老热水器拆走新的安装上去一气呵成必须点赞,0.8626517853925819
41515,39974630844.0,5.0,2020-01-20 10:37:31,热水器挺好的装好就直接用快递小哥真的蛮好帮家里老人把热水器搬到七楼很感谢他,0.929310000103655
41518,39974630844.0,5.0,2020-03-05 11:41:39,外形外观很好看噪音大小还可以恒温效果不错买了几个这个最好,0.9999488564355538
41520,39974630844.0,5.0,2020-03-02 12:27:40,外形外观我觉得挺满意的用起来还可以我还推荐给别人用用,0.9996940455586201
41521,39974630844.0,5.0,2019-10-04 18:47:53,刚装好一些还有一些管待买,0.7706378429933127
41522,39974630844.0,5.0,2020-04-23 14:47:15,物流很有速度很满意售后服务服务非常到位,0.9817819090726213
41524,39974630844.0,5.0,2019-01-11 11:46:26,产品还未安装使用但信赖品牌售后也挺好的好评,0.9796560004880417
41526,39974630844.0,5.0,2019-10-30 18:43:49,蛮好自己安装的,0.7171833371197819
41527,39974630844.0,5.0,2020-01-14 20:21:42,包装很好配送也非常及时我很满意,0.8787986933297962
41528,39974630844.0,5.0,2020-06-12 17:47:56,买给家里人的据说反馈还行,0.7616712409236505
41529,39974630844.0,5.0,2020-05-06 18:51:15,性价比高还带wifi虽然没什么用,0.9398128460350965
41531,39974630844.0,5.0,2020-01-23 09:30:43,物流很快就到了外观很漂亮,0.9988460711915532
41533,39974630844.0,5.0,2020-03-23 14:43:48,发货速度快服务态度也好,0.8033483038633564
41537,39974630844.0,5.0,2020-06-20 11:23:17,安装人员服务太度好,0.7167100007656821
41540,39974630844.0,5.0,2020-03-11 18:38:35,还没有用外观非常不错,0.9833565696688422
41541,39974630844.0,5.0,2020-05-17 12:48:47,售后非常棒认真负责,0.8258260441863883
41543,39974630844.0,5.0,2020-01-16 12:54:31,出水速度好噪音大小小,0.8610860068526542
41545,39974630844.0,5.0,2020-06-21 20:26:33,外形外观外观简洁,0.999819324194088
41546,39974630844.0,5.0,2020-06-04 23:03:02,安装及时产品合适,0.674583531523612
41547,39974630844.0,5.0,2019-06-14 13:45:46,已经安装好了等待试用外观很漂亮,0.989027504285506
41548,39974630844.0,5.0,2020-05-18 21:52:33,外形外观还可以吧,0.9883226118390909
41549,39974630844.0,5.0,2020-05-04 21:10:46,品牌商品值得信赖,0.9936785805387137
41550,39974630844.0,5.0,2020-01-20 15:39:27,好一如既往的好支持,0.9924861937050545
41552,39974630844.0,5.0,2020-06-21 13:52:22,安装很好很顺利,0.913676619318442
41556,39974630844.0,5.0,2020-04-29 10:54:02,很好用值得拥有,0.9837805836115642
41559,39974630844.0,5.0,2020-01-13 15:59:25,安装很快服务很好,0.9287479237896833
41562,39974630844.0,5.0,2020-07-06 23:28:37,相信大品牌,0.7198107177248954
41564,39974630844.0,5.0,2020-05-23 21:18:11,质量好满意,0.7861279387154354
41567,39974630844.0,5.0,2020-04-17 23:15:55,整体都不错,0.9481728186931022
41568,39974630844.0,5.0,2020-04-07 19:21:41,好服务周到,0.9686034428431703
41572,39974630844.0,5.0,2020-02-28 19:02:08,货很好正品,0.9024622334159808
41586,39974630844.0,5.0,2019-09-15 12:09:17,这是第二台美的热水器售后服务很好,0.71882150561607
