id,product_id,score,comment_time,comment,sentiment
27887,100003168551.0,5.0,2019-06-22 15:37:04,装上颜值特别高体积也很小正好合适我家这块地方售后不错安装师傅特别好细心调试还耐心教我们怎么使用不错,0.999121840022783
27888,100003168551.0,5.0,2019-11-08 16:26:41,东西很好热水打开就来非常方便外观也很漂亮,0.9300860508419073
27889,100003168551.0,5.0,2019-10-05 16:37:27,京东送货真不是一般的快而且服务态度也好机器拆开包装后也很高大上师傅也很快联系我上门安装了装好后感觉零冷水的就是不一样出热水就是秒秒钟而且也没什么噪音出水速度也很快压力也不小赞,0.8014216357688304
27890,100003168551.0,5.0,2019-09-25 15:19:51,外观非常漂亮师傅安装的非常认真服务到位价格优美好评好评好评噪音大小声音可以接受安装服务非常好外形外观漂亮,0.9998701692810953
27891,100003168551.0,5.0,2019-06-28 18:42:51,热水器外观漂亮大方水压大双变频触摸屏节能环保质量好物美价廉售后服务很满意安装师傅安装细质服务态度好物流也很快,0.9998096835429561
27893,100003168551.0,5.0,2019-08-18 22:00:45,今天安装上去了2999买的然后第二天就2899申请保价退回100京东真良心阿热水气不错果然是一分钱一分货美的售后安装也很赞商品满意快递满意售后安装满意,0.7154679948992323
27895,100003168551.0,5.0,2019-12-18 15:57:50,外形外观体积小外观精致恒温效果很好噪音大小很小出水速度很快安装服务安装师傅很专业很认真,0.9999960218289795
27896,100003168551.0,5.0,2019-11-17 22:08:35,样子非常小巧功能实用价格实惠安装也很快希望用起来更好,0.9999250534351134
27897,100003168551.0,5.0,2019-11-14 22:07:06,很满意这个热水器比实体店卖的同系列功能多还便宜双十一更划算送货速度相当快送货员直接送到了楼上美的售后直接安装无忧等房子装修好按了再来说机器体验满意的购物,0.9999920125426961
27898,100003168551.0,5.0,2019-09-26 13:15:54,燃气热水器外观很时尚带热水循环wifi控制功能很多还没有通燃气期待使用的效果零冷水功能值得期待,0.7320664663121721
27899,100003168551.0,5.0,2019-08-05 13:36:31,外观漂亮安装师傅也很敬业燃气还没通使用效果以后再评论满意,0.9129702603953235
27900,100003168551.0,5.0,2019-09-06 13:50:19,配送很快当天下的单第二天就送到了这配送速度一个字赞送货师傅很热情好评产品包装很好说到安装安装速度快安装师傅专业安装完后耐心讲解如何使用对于这次的购物经历很满意,0.998739390849894
27901,100003168551.0,5.0,2019-08-31 10:06:16,这款非常漂亮比想象的小非常喜欢安装师傅也很专业安装效率高大品牌确实不一样,0.975320079803443
27902,100003168551.0,5.0,2019-10-09 13:18:19,外形外观时尚简约好看和我家厨房很配哟安装服务发货很快头天晚上下单第二天早上就送到了安装售后师傅的服务态度也很专业呢出水速度因为是新家天然气还未开通机子还未使用但有8年的整机保修服务还是很安心的哟,0.9997991853338303
27903,100003168551.0,5.0,2019-07-31 10:28:17,618买的超值美的东西太爱了颜色款式太漂亮了昨天约的今天就安排人来这么热的天气安装小哥哥大早上就来了很专业,0.9989154871634566
27905,100003168551.0,5.0,2019-06-15 22:12:27,挺不错的看起来很好高端大气上档次不过要注意安装材料是有限价的,0.9998614254909556
27906,100003168551.0,5.0,2020-06-26 10:38:12,安装服务安装师傅非常认真负责技术非常好外形外观简约大气,0.9912391301080344
27907,100003168551.0,5.0,2019-07-14 10:40:56,美的这款零冷水还带增压燃气热水器真的很实用价格也不贵大品牌值得信赖安装师傅更是好跑几次都不嫌麻烦终于安装成功,0.766574540353854
27908,100003168551.0,5.0,2019-10-26 15:23:49,外形外观体积小不占地方很好看恒温效果很稳定噪音大小基本不算噪音出水速度出水速度很快热的也快安装服务一直给我打电话上门安装到是我们没时间服务很好耗能情况还好不浪费电和气,0.9987743069307767
27911,100003168551.0,5.0,2020-01-18 10:11:11,外形外观亮噪音大小不大出水速度很快安装服务到位,0.9958235616123101
27912,100003168551.0,5.0,2019-06-17 10:54:11,使用方便安装服务也很好整体看起来不错现在感觉很好用希望一直使用顺利售后超级棒,0.9979060004740011
27913,100003168551.0,5.0,2019-10-06 10:39:20,京东发货速度很快美的服务也很好这款热水器体积小外形简约大方到货后第二天就来安装师傅技术一流态度不错值得好评,0.9999337551374265
27914,100003168551.0,5.0,2019-05-07 12:59:58,美的天然气热水器JSQ30-GTS样式是喜欢的样式师傅装的也很负责宝宝好奇心也重兴奋的不行哈哈剩下的就等通气看下实际效果了外包装完好应该没事选了好久同事让我选个2500左右的但是零冷水功能我认为很有必要正好又有送扫地机器的活动自然不能放过了哈哈因为我也想买个扫地机器这次省了相信美的的品控,0.8590838268702862
27915,100003168551.0,5.0,2020-01-04 20:17:11,出水速度很快效果很棒安装师傅也很贴心很满意,0.9993936429783432
27916,100003168551.0,5.0,2020-02-05 15:22:28,外形外观漂亮恒温效果非常棒噪音大小很轻出水速度很快安装服务不错,0.999999812097544
27917,100003168551.0,5.0,2019-07-20 09:20:43,热水器外观简约大气零冷水功能非常实用有三种模式可以调节还能用手机app远程遥控操作十分方便安装师傅技术专业物流也比较快性价比高,0.9277772183576398
27919,100003168551.0,5.0,2019-09-17 23:03:17,美的的产品这几年一直买好用创新能力强相信国货很快就能把洋品牌打的满地找牙热水器不错外形尺寸小巧美观大方能自动根据天气调温零冷水不要等这都是我想要的京东感觉越做越好我发觉已经离不开它了自从上了京东很少去超市卖场了难怪洋卖场很多都了京东物流超好,0.9999999642109045
27920,100003168551.0,5.0,2019-11-26 11:04:23,双十一购买的真的超级满意外观简约大方款式很好看16升适合我们家出水很快零冷水这个设计很给力师傅上门安装很方便安装的也很细致总体来说很很满意的一次购物,0.9999976615813176
27921,100003168551.0,5.0,2019-12-22 21:22:59,外观小巧颜色很漂亮送货及时安装师傅不错安装人工免费配件费收了100多暂时还没用后面再追评,0.888580773743609
27922,100003168551.0,5.0,2019-12-01 21:08:02,外形外观很符合小户型使用小巧不占地方外观很精致恒温效果保证持久恒温用水噪音大小几乎听不到安装在了设备间对休息没任何影响出水速度即开即来保证生活用水冬天再也不怕水凉了安装服务相信品牌的力量支持国货振兴民族经济耗能情况目前测试能好可以接受用出问题来也不怕关键咱们有长期的质量保证,0.9999999612521924
27923,100003168551.0,5.0,2019-10-22 14:29:37,完美一切都刚刚好位置刚好大小刚好安装师傅到位形象完美必须好评,0.9943755266156821
27926,100003168551.0,5.0,2020-02-01 18:06:51,特殊时期因家里热水器坏了只有美的的按时送货非常棒为服务点赞自已装的也很简单非常好用,0.9919126827844097
27927,100003168551.0,5.0,2019-11-18 13:05:42,外形外观漂亮大方安装师傅人很客气帮忙解决了很多麻烦很满意的一次网购赞,0.9785675431409597
27928,100003168551.0,5.0,2019-11-30 15:12:28,外形外观洁大方恒温效果非常棒噪音大小声音非常小可以忽略不计出水速度零冷水功能非常好热水不需等待安装服务安装小哥非常专业耗能情况低能耗,0.9997131672134485
27930,100003168551.0,5.0,2019-11-17 17:04:53,热水器还没开始正式使用不过安装师傅工作认真负责安装很完美安装师傅服务也很周到细心,0.8820745488423363
27935,100003168551.0,5.0,2019-12-13 23:49:02,外形外观真心好看颜色也是我最喜欢的等明天我再去新房子那里拍图片上传恒温效果没有冷水的水压很够可以双十一2699时候没有买到噪音大小没有噪音出水速度很给力非常棒安装服务服务范围耗能情况节能,0.9988625791186052
27937,100003168551.0,5.0,2019-08-30 20:09:49,热水器外观金属质感身形精致大气智能化操作方便省心更放心安装师傅认真负责很细心安装很规范超赞,0.999998080645413
27938,100003168551.0,5.0,2019-11-07 21:22:58,外形外观外观简单大气挺喜欢的安装服务货没到安装师傅就联系安装了很积极耗能情况目前还没使用恒温效果目前还没使用,0.998715815748268
27940,100003168551.0,5.0,2019-10-30 09:19:48,很满意的一次购物机器很大气高大上啊,0.9867679523368806
27941,100003168551.0,5.0,2019-11-17 18:50:56,外形外观简洁好看恒温效果还没使用待使用后评价安装服务非常满意,0.9997385215870729
27942,100003168551.0,5.0,2019-12-10 11:28:25,一直都用美的产品很好赞一个安装师傅也很客气赞,0.997985905368853
27947,100003168551.0,5.0,2019-09-16 14:04:03,服务OK安装的很认真整体效果也满意燃气暂未开通后续效果好好体验下,0.6259152916846604
27949,100003168551.0,5.0,2020-03-26 07:25:20,安装师傅很好产品质量也超棒,0.7197455670431262
27951,100003168551.0,5.0,2019-09-06 10:59:37,质量真的没得说太好了安装师傅也很热情送货速度也挺快的,0.9639968053903838
27953,100003168551.0,5.0,2019-12-04 14:34:25,外形外观好看高档安装服务服务很好师傅赞,0.9988770921006481
27954,100003168551.0,5.0,2019-08-01 23:46:05,热水器小巧颜色耐看非常满意品牌值得信赖,0.9996541962312614
27955,100003168551.0,5.0,2019-09-08 13:12:20,东西还是很不错的安装也很到位就等开气试用了不知道H阀效果怎么样,0.9930403949075415
27956,100003168551.0,5.0,2019-07-31 17:14:07,样式不错是我喜欢的类型送货师傅和安装师傅都很热情赞赞,0.9949746472211163
27957,100003168551.0,5.0,2019-11-28 14:09:51,双十一时候购买的看重的是16L体积小因为小阳台墙面面积不太大很厚实已经到货包装完好师傅贴心送上楼京东物流给力而且客服回答很耐心京东美的大品牌指的信赖,0.9740530026839209
27958,100003168551.0,5.0,2019-11-18 17:58:06,外观非常漂亮大小始终配送安装安排合理值得大家购买,0.9961745002350006
27960,100003168551.0,5.0,2019-11-13 14:12:10,外形外观产品的外观非常的时尚颜色也觉得挺高档的双十一买的价格也觉得合适只是家里的装修才刚刚开始估计要用就明年了用完我再把体验评论一下,0.9999929501852938
27961,100003168551.0,5.0,2019-07-01 18:35:19,非常小巧外型美观安装人员也不错家里没通气还没开始使用,0.9943297719375356
27962,100003168551.0,5.0,2019-10-11 15:49:11,外形外观漂亮恒温效果很好噪音大小比较小出水速度快安装服务好耗能情况比较小,0.9998938525779768
27964,100003168551.0,5.0,2020-05-01 11:39:50,送货很快闪耀的外壳不显脏材质好·外观大方LED触控显示屏特有质感触摸时手感很舒服调节时很灵敏操作简单·字体清晰·看得非常清楚节能环保是一款燃气热水器主要的首选值得推荐京东购物就是棒五星好评,0.9999999976997429
27965,100003168551.0,5.0,2019-10-28 19:48:07,第二天就收到货了家里电器都买的美的热水器也选择了它还没有安装看着很漂亮,0.9844101397857418
27968,100003168551.0,5.0,2019-11-04 17:34:27,物流很快安装工人也挺细心等这个热水器很久了终于买到了想要的东西,0.9858517684980413
27969,100003168551.0,5.0,2019-11-04 15:17:37,外形小巧美观大方节能环保安装师傅服务很好国产大牌值得信赖,0.9999970144888715
27970,100003168551.0,5.0,2019-12-08 15:59:40,质量非常好外观设计风格好看,0.9907442750813493
27971,100003168551.0,5.0,2019-06-04 18:15:22,快递小哥服务很周到感谢东西简单检查了一下因为房子装修还没开始做防水暂时放在那了用的时候再追加评论先给个好评了,0.6616714967518237
27974,100003168551.0,5.0,2020-01-31 13:50:16,外形外观美观大方高端上档次安装服务很热情很专业,0.9999878609435972
27977,100003168551.0,5.0,2020-06-29 17:21:04,外形外观外观符合家里装修风格安装服务安装师傅的态度非常好认真负责噪音大小噪音大小刚好,0.9936659372030963
27978,100003168551.0,5.0,2019-10-08 16:09:18,因为是小居室选了好久才选了这款体积小的快递配送很快上门安装也很细心值得购买,0.9997210684721697
27979,100003168551.0,5.0,2019-06-23 12:56:55,师傅安装很耐心人很好等后期开气后在追评,0.8294818982560068
27981,100003168551.0,5.0,2019-10-27 10:35:51,两个卫生间一个较远的十秒内也就出热水了非常不错解决了大问题安装也很棒,0.7004565730482394
27982,100003168551.0,5.0,2019-06-09 09:43:03,1宝贝非常完美因受安装地方的限制宝贝小巧的身材配合安装位置刚刚好2超值的价格还能够享受到零冷水的功能真的非常开心3现宝贝已安装完成因燃气未通待使用后再追加功能评论4安装方面安装师傅非常专业对热水器的功能讲解也非常详细5总之一切都好非常满意的一次购物,0.9999984740613416
27983,100003168551.0,5.0,2020-04-22 07:53:46,外观很漂亮噪音都有但是个人觉得比我之前在实体店买的2300一款美的的小的多安装师傅服务很好,0.9839472731376775
27984,100003168551.0,5.0,2019-11-01 15:26:19,外形外观高大上恒温效果良好安装服务安装服务很好没有收到货就主动有人联系安装噪音大小能接受出水速度正常耗能情况可以接受,0.9883884223400746
27986,100003168551.0,5.0,2019-10-23 10:47:24,热水器颜值很高而且温度控制很好主要是小体积适合我家位置不够的地方真的挺不错的,0.9866165745019345
27987,100003168551.0,5.0,2019-10-10 21:39:57,机器很时尚小巧安装师傅耐心热情效果好,0.9969960137954972
27988,100003168551.0,5.0,2019-12-12 22:54:22,物流真的超级快感觉质量很不错,0.9507855181326006
27990,100003168551.0,5.0,2019-08-20 15:14:02,服务非常好机器质量也不错外观漂亮送货速度非常快非常满意的一次购物天气非常热谢谢送货师傅,0.9992389122133207
27991,100003168551.0,5.0,2020-01-03 14:18:18,安装及时售后服务态度很好安装很好,0.6960513337015983
27992,100003168551.0,5.0,2019-10-12 15:35:41,宝贝上午十点多订的下午3点多就收到了太快了点个赞东西过段吋间在用再来评价比想向的大一些外观颜色漂亮,0.9846041369827423
27993,100003168551.0,5.0,2020-04-30 22:51:07,产品很好就是声音特别的大特别感谢安装师傅服务特别特别好,0.6810328746940972
27994,100003168551.0,5.0,2019-07-02 22:48:33,618的价格比实体店便宜了一倍颜值很高颜色很现代,0.7238704182864861
27995,100003168551.0,5.0,2019-08-18 05:53:47,配送很快约定时间送到外包装完好燃气通了再安装期待机器性能如介绍完美,0.9951977188414493
27996,100003168551.0,5.0,2019-06-11 20:20:38,看着很不错非常喜欢安装师傅也很尽责不知道用起来怎么样？期待,0.8947933668839501
27997,100003168551.0,5.0,2020-04-30 17:37:08,非常时期一如既往的又快又好又方便又实惠信赖京东支持京东,0.9999733172282825
27998,100003168551.0,5.0,2019-12-17 18:23:15,噪音大小小出水速度快外形外观好看恒温效果一流好安装服务好耗能情况好,0.9999966257602462
27999,100003168551.0,5.0,2019-05-15 10:54:36,机器高端大气上档次安装师傅非常给力售后服务非常满意,0.9654370163455039
28000,100003168551.0,5.0,2019-12-19 10:03:38,家用电器首选京东服务好质量有保障每次实物非常满意送货师傅服务好,0.9983344853984978
28001,100003168551.0,5.0,2019-07-13 22:47:55,热水器安装的很好哦安装师傅做的也很仔细服务很到位点赞,0.8699869042093801
28002,100003168551.0,5.0,2020-01-02 20:39:48,热水器非常不错哦和家里风格非常搭配,0.8919369648815659
28003,100003168551.0,5.0,2019-08-17 16:41:22,物流很快配送员的服务态度也很好包装完好无损坏房子没装好未安装期待安装好的使用效果,0.6271292235146357
28004,100003168551.0,5.0,2019-10-22 17:03:30,外形外观机器颜值很高跟家里装修风格搭配一致简约黑白灰点赞而且不显笨重家里是没有预先铺设管道不过使用单向阀可以实现零冷水这个功能非常实用洗澡的那一瞬间不用再被冷水惊蛰了吧机器正在使用中期待它表现优秀以后再分享使用体会,0.9999993146556764
28005,100003168551.0,5.0,2019-10-14 10:57:18,外观简洁大方性价比高非常超值操作简单使用方便,0.9998471548994963
28006,100003168551.0,5.0,2020-05-19 10:11:00,安装服务很好美观,0.742609434328488
28007,100003168551.0,5.0,2019-10-14 14:23:54,外形外观美观出水速度快安装服务好恒温效果好噪音大小很小,0.9988946875217365
28009,100003168551.0,5.0,2019-11-05 12:53:36,外形外观外形小巧不占地方安装服务安装师傅耐心装完很好,0.9986870862306326
28011,100003168551.0,5.0,2019-08-08 18:06:21,安转好了外观大气上档次还没有通气不能试用,0.9928049952772137
28013,100003168551.0,5.0,2020-02-15 16:28:35,很好很不錯質量很好疫情期間能買到就很開心,0.7262575314717866
28014,100003168551.0,5.0,2019-11-18 16:58:12,外形外观体积小不占位置噪音大小噪音略大出水速度很快恒温效果很好,0.9994408210611556
28015,100003168551.0,5.0,2019-12-30 19:05:36,京东家电的产品质量很好值得放心购买,0.9919468098826532
28018,100003168551.0,5.0,2020-01-20 18:08:25,安装很及时服务态度很好,0.7118821995536392
28019,100003168551.0,5.0,2020-02-12 17:35:26,安装服务安装师傅很专业服务态度特别好外形外观好看比较时尚,0.994566906283963
28020,100003168551.0,5.0,2019-12-02 09:40:34,外形外观高端大气低调奢华安装服务售后客服很好都有打电话确认跟她说房子在装修还没办法安装也很热心说等安装了电话联系即可美的的售后值得信赖,0.9997077182001064
28023,100003168551.0,5.0,2019-11-07 11:36:09,蒋师傅上门安装服务很好赞,0.8344995920370727
28024,100003168551.0,5.0,2019-11-17 18:54:59,美的大品牌京东自营值得信赖家中很多电器都是美的,0.9999410402104323
28025,100003168551.0,5.0,2020-01-18 10:34:57,外形好看大气没什么噪音真的是零冷水,0.9607019239776413
28027,100003168551.0,5.0,2020-01-03 18:12:46,恒温效果很好一分价钱一分货,0.8750219658420976
28028,100003168551.0,5.0,2019-12-02 20:58:01,外形外观小巧精致恒温效果很好噪音大小很小出水速度不错安装服务安装很及时,0.9999988842614572
28029,100003168551.0,5.0,2019-05-14 14:58:06,很不错高端大气上档次售后服务也很好今天预约明天就来安装使用效果也很不错真正的零冷水很满意家里的房子装修选用这一款以后再有需要还会购买赞赞,0.9999999514564105
28030,100003168551.0,5.0,2019-10-20 10:12:58,外形外观刚刚安装好还没有开始使用师傅安装很认真努力让管子看起来不那么乱感谢,0.6672000147058955
28031,100003168551.0,5.0,2019-09-18 20:31:01,发货速度很快第二天就收到了下单第三天就安装上了服务很好美的安装师傅服务态度很好安装完了还给试好嘱咐开热水的温度总之很好谢谢美的,0.8145466074798582
28033,100003168551.0,5.0,2019-11-12 11:26:28,安装完成零冷水特别棒非常满意,0.8541572933071196
28034,100003168551.0,5.0,2019-10-14 11:02:56,安装服务很好师傅很认真讲解的很明白,0.9553011088217457
28036,100003168551.0,5.0,2019-11-14 10:08:03,售后服务非常棒安装非常快非常完美,0.9893830853532866
28037,100003168551.0,5.0,2019-11-21 15:55:09,安装服务服务态度非常好安装速度很快外形外观外观新颖,0.9998872766727419
28038,100003168551.0,5.0,2019-11-18 18:45:17,货到了感觉外观很不错占用空间较小,0.992569343949424
28040,100003168551.0,5.0,2019-11-03 00:50:07,出水速度出水很大恒温效果温度稳定耗能情况一级能效外形外观外观小巧,0.9999514189055733
28041,100003168551.0,5.0,2019-09-21 19:43:10,外形外观非标好看是我想要的类型恒温效果很好噪音大小几乎没有安装服务很快,0.9998292364659067
28042,100003168551.0,5.0,2019-08-15 10:08:45,安装及时师傅服务很好那个昨天联系今天就装速度很快机器完全没有问题,0.9713192436678548
28044,100003168551.0,5.0,2019-09-17 15:45:08,真的很不错的这个是帮哥哥买的自己好用才帮家人又买一打开就是热水比之前的好太多了京东服务和安装服务都超级好,0.9945432399195505
28045,100003168551.0,5.0,2019-06-05 14:12:58,货已收到品牌就是不一样高档上档次物美价廉样饰美观又大方看外观觉得很实用现在无法分享笑果等通来评价,0.9999934194623774
28047,100003168551.0,5.0,2019-06-30 12:01:21,很满意安装师傅非常用心产品使用方便水流很大,0.614011428845134
28048,100003168551.0,5.0,2019-11-02 15:29:38,好评送货安装速度都很快师傅给个赞,0.8184912255263944
28049,100003168551.0,5.0,2019-06-23 05:32:45,宝贝收到质量很好颜值高非常喜欢安装师傅服务周到态度非常好物流也很快非常给力第二天就收到了噪音小出热水快真心不错大牌产品质量一流值得信赖,0.9999998146960513
28051,100003168551.0,5.0,2019-10-05 16:16:05,在京东上买东西就是快这点不用说而且送货师傅态度也特别好拆开箱子后发现外观也特别高端大气上档次超乎我的想象师傅主动联系我安装安装速度特别快态度也很好每一步都在征求我的意见装好后试了机也很满意赞,0.9999626297455612
28052,100003168551.0,5.0,2019-12-20 13:43:57,美的的产品都不错的安装很满意美的的售后服务都很好,0.9993340031230528
28053,100003168551.0,5.0,2019-07-18 17:25:08,还没有开始用看起来就不错安装师傅人特别好,0.7270671229995909
28054,100003168551.0,5.0,2019-07-15 19:22:32,东西简约颜色非常好看安装服务好等待使用效果,0.8716902804511004
28055,100003168551.0,5.0,2019-11-25 20:06:03,外形外观高大上恒温效果不错噪音大小完美出水速度好安装服务一流耗能情况节能,0.9999936501301745
28056,100003168551.0,5.0,2019-06-19 22:22:49,新款产品活动价很低安装师傅特别负责,0.7373512519566642
28058,100003168551.0,5.0,2019-10-08 20:09:34,东西很好和网上说的一样物流为快今天下单明天就到了值得购买的一款产品视频图片后续会补上,0.9709973428297973
28059,100003168551.0,5.0,2020-06-28 17:34:34,外形外观好看恒温效果还没有用感觉会灰常不错安装服务安装师傅很赞热情周到,0.9999971984118871
28060,100003168551.0,5.0,2019-10-13 10:49:45,安装很快服务也很到位等入住后看看效果,0.9406575125103946
28061,100003168551.0,5.0,2019-12-13 09:14:17,外形外观很喜欢效果待后续使用美的还是不错,0.9999514802179343
28063,100003168551.0,5.0,2019-11-14 22:34:48,外形外观美观不占空间安装服务神速网购以来最快的一次体验超赞美的电器值得拥有,0.9996751043141379
28064,100003168551.0,5.0,2020-06-30 10:28:13,美的非常值得信赖的品牌以前家里都是用的美的,0.9999383407303324
28065,100003168551.0,5.0,2020-05-14 14:50:26,外形外观好安装服务安装服务师傅非常热情效率非常快安装完还把垃圾都打扫干净技术专业5星好评,0.6177325771898515
28068,100003168551.0,5.0,2020-01-07 16:06:55,产品很满意物流快安装师傅也很专业热情,0.8796588869150576
28069,100003168551.0,5.0,2019-11-01 20:46:47,到货速度真的很快服务也好,0.9526278908008937
28070,100003168551.0,5.0,2019-12-19 15:55:51,东西质量很好快递也很快给京东点赞,0.9714131478141
28071,100003168551.0,5.0,2020-01-06 00:39:42,恒温效果好外形外观很好安装服务快速出水速度很大耗能情况很少的,0.9998050252970818
28072,100003168551.0,5.0,2019-11-17 12:03:22,外观特别好看安装老师服务特别好,0.9957722391608568
28073,100003168551.0,5.0,2019-06-15 09:49:19,样子非常喜欢物流很快安装也很细心已经购买三台了,0.997348943380642
28075,100003168551.0,5.0,2019-11-10 18:39:16,热水器颜色款式大气金属外壳很有质感身形精致智能化方便安装师傅认真负责,0.6563860810826976
28076,100003168551.0,5.0,2019-07-20 11:38:16,很好送到家很满意买对了,0.9192942310521354
28077,100003168551.0,5.0,2019-11-12 13:26:58,出水速度非常好噪音大小很小耗能情况满意安装服务满意外形外观漂亮恒温效果棒,0.9999969300055829
28078,100003168551.0,5.0,2019-06-06 11:31:59,东西很不错到货后约售后安装也很快,0.9085185850787666
28080,100003168551.0,5.0,2019-11-07 19:03:23,外形外观精致恒温效果今天刚安装好应该不错用了再来评安装服务周到细致态度很好,0.9999933818594737
28081,100003168551.0,5.0,2019-08-07 12:39:44,安装师傅服务态度好装的很漂亮满意,0.8914167475270596
28082,100003168551.0,5.0,2019-07-10 17:48:18,好东西高端大气上档次,0.995978422488153
28083,100003168551.0,5.0,2019-06-23 18:50:47,安装了很好啊还没用但是很高档,0.8267308923946923
