id,product_id,score,comment_time,comment,sentiment
19690,6863137.0,5.0,2018-08-06 16:39:29,很不错的一款热水器家里4口人选了个14升的足足够了老品牌老口碑了家具冰箱燃气灶空调都选的美的爱生活信赖美的,0.9999851759349316
19691,6863137.0,5.0,2018-09-12 14:30:21,为美的服务点赞很满意棒棒哒师傅也很热心高效率送货和安装速度非常快网上购物最开心的一次接下来还要买美的牌子的燃气灶和浴霸,0.980979904612844
19693,6863137.0,5.0,2020-03-25 18:07:25,一直支持京东又快又好特别感谢安装的师傅服务好做事也负责任非常满意的一次购物希望后期用起来没有质量问题,0.9299496079312478
19694,6863137.0,5.0,2019-11-11 18:24:55,外观很漂亮还未使用物流很快用了再来评价东西还没用五星好评这款免安装费的看好美的售后保修时间长服务准时所以选美的,0.9140148634155165
19695,6863137.0,5.0,2019-02-21 17:34:21,热水器看着很高大上大品牌就是不一样安装师傅很负责很细心还没使用先好评,0.7475081882646283
19696,6863137.0,5.0,2018-12-29 14:17:41,第一次在网上买家电就买的是美的热水器27号买的28号到家的29号售后就来撞上了我们东西都是准备好的安装零元装上了很不错安装师傅也蛮不错的,0.8207419385442267
19698,6863137.0,5.0,2019-12-08 17:07:40,师傅的安装非常好带客户非常到位我真想在家留下吃饭总体非常好值得信赖,0.9929198390015722
19700,6863137.0,5.0,2018-10-11 13:22:15,热水器收到了没让我失望和图片上看到的机器一样高端大气上档次物流很快安装师傅也非常有责任心,0.6180892591114616
19701,6863137.0,5.0,2019-01-03 11:12:23,刚刚安装完毕安装师傅很认真仔细给予好评这款热水器性能没话说很方便很适用,0.8203042140245571
19702,6863137.0,5.0,2018-09-08 14:40:23,京东自营购物很愉快正好遇到美的的促销活动获得免费安装服务在线客服售后服务都很不错送货快安装快每个环节的服务都值得点赞我家的家用电器都在京东自营买的值得推荐,0.9990297086297824
19705,6863137.0,5.0,2018-11-09 17:49:53,看着很喜欢果断当天入手物流非常快第二天就到了由于刚开始装水电没有开封不过美的大品牌值得信赖很放心过段时间再安装,0.9999203073772545
19706,6863137.0,5.0,2018-08-29 13:59:09,外观漂亮还没通气所以还没有试用等试用后再评另外快递很快服务也好安装师傅也很仔细做完还清干净,0.858206602187618
19707,6863137.0,5.0,2018-11-14 22:07:55,物流很给力京东送货员服务很好当时就联系核实是否需要安装但家里电还未装好过几天再联系安装宝贝颜色漂亮看上去质量不错给赞,0.9975641215541813
19708,6863137.0,5.0,2018-06-02 09:07:51,美的热水器高端大气上档次低调有内涵是热水器品类的战斗机是热水器中的宾利劳斯莱斯专业热水器好多年我专业你安心好好,0.9715356492706464
19709,6863137.0,5.0,2019-03-05 12:52:58,热水器安装好了京东服务很的没话说客服很好美的售后也很负责安装不会乱收费产品质量也没得说也很美观大方,0.9494590286991168
19712,6863137.0,5.0,2018-10-03 20:06:59,买回来后预约了安装师傅安装的很细心也很专业特价时候买的真的很划算安装好后感觉比想象的好看很多超出预期推荐购买,0.9805840672931919
19713,6863137.0,5.0,2018-10-04 15:20:18,东西买好了安装的师傅特别的客气家里面的家电一直在京东买美的买的也很多热水器是第二次买了值得信耐家里之前的热水器也一直用美的得,0.9723806301090859
19715,6863137.0,5.0,2018-11-07 22:46:46,自己安装的搞了大半天最终都解决了确实恒温洗澡都舒服了物流也很赞上午下单下午就到,0.8949602908945539
19718,6863137.0,5.0,2018-11-10 21:03:44,用了几天才来评价效果很好很方便出水也比以前快多了,0.7164814834673007
19719,6863137.0,5.0,2019-01-14 13:46:16,安装好了不错声音小安装态度特别好还免安装费不愧是大品牌服务就是好质量就是靠谱,0.974337525817199
19720,6863137.0,5.0,2019-05-23 15:07:21,这款热水器非常实惠美的大品牌性价比很高物超所值物流很快非常给力第一天下单第二天就到了师傅服务好技术非常棒安装不收费值得购买,0.9999760479733177
19721,6863137.0,5.0,2020-01-05 21:14:30,物流很快安装预约也很及时现场安装的师傅很认真很负责态度也非常好热水器颜色很漂亮看上去很有质感家里很多美的的产品很好用大品牌值得信赖,0.9999662811437564
19722,6863137.0,5.0,2018-11-12 01:35:15,美的大品牌值得信赖这个挂在家里特别高大上金色很适合我的厨房我妈妈会喜欢的这里感谢这安装小哥等了1个小时因为送货师傅没来问题出在我两个师傅都超级好帮我搬上楼安装是辅材是明码标价透明的最后还耐心叫我使用和注意事项太感谢了,0.9300641661593867
19723,6863137.0,5.0,2019-01-20 15:06:37,物流很快安装也蛮快头天打电话第二天就来安装了对美的质量很放心暂时还没开始用应该没问题的操作看起来也很简单以后推荐好友也买美的,0.9598583193436019
19724,6863137.0,5.0,2018-05-29 20:14:13,美的牌子的电器综合不错家里的冰箱空调都是用美的的售后安装服务也很好效率很高货到立马就联系安装了师傅现场安装的时候也是提醒了很多的使用细节然后调试什么的真心不错,0.8309743783374335
19725,6863137.0,5.0,2018-11-18 20:34:53,双十一买的热水器由于配送订单多延误了几天不过还挺快提前预约售后人员态度挺好安装师傅也挺认真负责经常买美的的东西不错很满意的一次购物,0.8872285643144447
19726,6863137.0,5.0,2018-12-18 20:13:25,物流很快安装也很快很好完全免费很静音符合要求,0.9978653419753585
19727,6863137.0,5.0,2018-07-29 08:49:10,热水器第二天就到货了安装也很快师傅很有耐心一开始装修留的孔小了都得到了解决很满意的一次购物还买了一台美的净水机大品牌值得信赖,0.9901436811968587
19728,6863137.0,5.0,2018-09-23 16:38:08,物流快送货安装迅速服务态度很好热水器出热水很快,0.7815107889281923
19729,6863137.0,5.0,2018-08-25 15:27:07,热水器发货很快次日就到货外观高大上忘记拍师傅工做照片安装很到位产品质量好五星好评必须的,0.7485304195481598
19732,6863137.0,5.0,2019-10-13 22:06:00,外形外观简单大气身材也很小颜色也很喜欢是我想要的颜色非常显高档用了些时日感觉很不错推荐给大家,0.9999999468148476
19735,6863137.0,5.0,2018-07-23 13:47:27,美的大牌子一直都是非常信赖这款外观挺大方的还没有用天然气没通应该会很好,0.999993576987679
19736,6863137.0,5.0,2018-07-26 12:51:46,热水器外观挺好看的材质都很好很有档次看着挺喜欢的,0.9986752040888972
19737,6863137.0,5.0,2020-03-13 20:14:06,现在的热水器不得不说性价比越来越高越来越智能化质量越来越好价格却比以前低多了非常好的一款值得购买,0.9751092867225659
19740,6863137.0,5.0,2019-05-12 14:16:49,师傅安装非常专业连怎么使用都一一讲解走时还把卫生打扫干净商品高端大气,0.9389020108407677
19741,6863137.0,5.0,2018-11-01 12:53:08,京东服务不错送货快安装快师傅人都很好暂时燃气还没有通上热水器外形很满意等用了之后再来追评谢谢客服耐心解答家电基本都在京东买了,0.8963436843998914
19742,6863137.0,5.0,2018-06-16 19:45:31,京东618买的在网上看了很久很久对比了很多家后来还是选了美的的这款热水器物流很快送货师傅人很好安装师傅也很尽责提前几天就和我联系货到没到然后约好时间过来安装尽职尽责详细的介绍了使用方法和注意事项并且把卫生也打扫的很干净很满意以后还会在京东买家电,0.7537026458228777
19743,6863137.0,5.0,2019-01-11 14:45:28,送货很快打完电话安装师傅很快就到了水量大热的快目前看着不错没毛病,0.9693037744755831
19744,6863137.0,5.0,2018-05-27 13:46:13,东东收到了很不错发货速度简直太快了第一天下单第二天货都到了颜色简单大方上档次跟我家的厨房很配价格参加了活动也算很实惠快递人员送货很及时服务也很热情家电都是在京东上买的很相信美的的质量和品牌下次需要家电了还会来的希望卖家生意越来越好,0.9999996938572704
19746,6863137.0,5.0,2018-11-17 13:40:15,前段时间有些忙现在有空了来评价一下美的的东西没有什么说的很好大品牌值得信赖安装师傅也不错物品到的第二天就主动联系上门安装了总之很满意以后还会到京东购物的谢谢,0.9999819074089721
19747,6863137.0,5.0,2018-11-22 20:03:35,外观设计漂亮大气已经安装好了燃气没通还没试但相信美的的质量出水量能调节很完美安装师傅服务到位产品值得购买服务值得信赖给美的热水器个赞,0.9999999454621139
19748,6863137.0,5.0,2018-07-25 12:24:31,东西很不错已经安装好开始使用了比之前买的其它品牌的好用安装人员服务态度很好已经推荐给身边需要的朋友了祝福美的大卖,0.9999626736211689
19749,6863137.0,5.0,2018-10-17 19:19:37,美的大品牌8年保修机子美观大气性价比高物流速度快售后安装比较神速当天到当天安这款机子目前还免安装费太棒了,0.983185485909041
19750,6863137.0,5.0,2018-05-05 13:51:58,我不在家安装的师傅来我爸看着装的说技术不错管子都走得很整齐解释得也很到位售后都说清楚了热水器很好颜色很亮性能好赞,0.9645797766596201
19751,6863137.0,5.0,2018-12-05 17:56:37,热水器收到了物流特别快装起来很高大上容量很大一家人够用了,0.7212428134671215
19752,6863137.0,5.0,2019-05-05 22:21:37,收货完好无损外观设计简单大方上档次质量好好用安装师傅也很专业非常满意,0.9962574964987841
19753,6863137.0,5.0,2018-09-18 15:11:02,包装完好无损物流也很给力关键是这款美的热水器颜值很高靓丽的外表下透着一种高端感客服也很耐心安排过来的安装师傅耐心热情第一次在京东购买电器大件令我和家人非常满意以后还会一如既往的支持京东,0.9999977802023218
19754,6863137.0,5.0,2018-07-15 18:14:17,这款热水器真的不错非常美观而且呢师傅安装也非常认真负责货还没到装的师傅已经联系我两次总体来说十分满意感谢京东感谢美的,0.878332369169606
19756,6863137.0,5.0,2018-06-21 15:37:57,首先美的大品牌不管是商品质量还是服务质量都值得信赖这件产品性价比不错1899买的还送一年延保和锅具还有只换不修服务选了好久最终还是这款安装师傅真心辛苦从打孔到安装在到安完后清洁都是专业的,0.9999672903945833
19757,6863137.0,5.0,2018-09-21 09:46:27,安装小哥很热心专业技能过硬安装美观线路走的合理装完之后还打扫了卫生五星好评,0.6664171340874445
19759,6863137.0,5.0,2020-04-28 09:59:33,外形外观外观漂亮恒温效果温度很合适安装服务安装专业服务态度好,0.9999746599772577
19760,6863137.0,5.0,2019-10-27 09:31:27,外形外观美观大方安装服务安装师傅服务很好我家的孔打的不理想师傅费了半天劲给装上的恒温效果还没入住无法评价后期追评,0.9792063328123187
19762,6863137.0,5.0,2018-09-04 15:12:47,安装师傅很害羞技术很扎实装的美观大气东西也好用快速制热恒温保护完美,0.997336872139801
19763,6863137.0,5.0,2018-07-28 13:14:48,服务周到送货很快机器安装上效果很好定的是元安装安装师傅装好了确实没收一分钱很满意的一次购物,0.6707440023484406
19764,6863137.0,5.0,2018-12-21 19:26:14,安装好了非常不错师傅挺好的帮着设计了一下噪声也不大喜欢,0.9362818912654602
19766,6863137.0,5.0,2019-02-16 14:46:48,美的牌子一直都很信任昨天下午送到的今天已经装好了送货快安装也快这款热水器外观漂亮大气性价比又高值得推荐,0.99997550540284
19770,6863137.0,5.0,2018-06-30 09:22:56,非常好燃气热水器的外观也很不错棒棒哒安装人员的服务也很棒能为客户考虑不多加收材料费用很满意,0.6137264458457824
19771,6863137.0,5.0,2018-10-24 18:42:02,实物比图片更好看热水恒温声音很轻好评特别点评安装师傅热情周到技术专业五星,0.9794207543930048
19774,6863137.0,5.0,2019-01-19 17:01:51,好评必须好评客服态度很好物流速度也非常快昨天下单今天到货下午就直接安装好了安装师傅也热情美的品牌没得说大品牌值得信赖必须赞赞,0.9999918264870683
19775,6863137.0,5.0,2019-12-25 23:27:22,商品是正品质量很不错样子很美观价格很实惠送货速度快包装很完整下次还会买,0.9999949008504063
19777,6863137.0,5.0,2018-09-08 16:49:36,外观漂亮大气安装师傅耐心服务售后效率也很高必须点赞非常好请大家放心购买国产大品牌值得信赖颜色也好看很喜欢,0.9999998861246028
19780,6863137.0,5.0,2019-05-08 11:40:55,给父母买的相信美的的品牌使用很方便安装也很专业特别感谢安装师傅家里的管路有问题也给解决了感谢,0.9919902425989692
19783,6863137.0,5.0,2018-09-29 15:58:59,很好很强大美的的东西没的说售后服务很好点个赞,0.9930609468612391
19784,6863137.0,5.0,2018-06-27 22:27:39,货收到了包装得非常好并且马上打开看了质量非常棒马上就预约安装师傅上门安了安装师傅态度也非常好安的时候有啥不懂的就问会非常耐心跟我的家人讲解看上去质量也不错物美价廉非常实惠值得大家购买美得牌子的货就是棒还送了首年换新服务这个用起来是非常放心的我家空调也是用的美的,0.9997761398881472
19785,6863137.0,5.0,2018-07-01 14:28:12,电话预约师傅上门安装的手艺很好服务也很好非常满意的一次购物以后有需要还会再来购买美的的东西,0.9065024398521172
19786,6863137.0,5.0,2019-03-10 13:34:17,首先宝贝非常满意颜色很漂亮物流很给力安装师傅很热心不错哦希望后期使用能很好呢,0.9999409441620798
19788,6863137.0,5.0,2018-08-20 12:31:08,送货师傅很负责帮我送到位才走这个一定要好评安装师傅也很快很快就装好了试过以后没有什么问题总的来说很满意,0.9851884393232373
19789,6863137.0,5.0,2018-04-30 15:58:35,质量很好外观大气放在家里很好看安装师傅很耐心在京东买的第四件家电了不后悔服务很到位安装也是免费的赞,0.9999381514186608
19791,6863137.0,5.0,2018-09-14 15:56:35,售后很棒我购买是在一个区安装又在另一个区后面安装给我转过去我家了服务很不错师父到家安装也很守时还帮忙打洞收费合理外观如图大气漂亮,0.9998161801011922
19792,6863137.0,5.0,2018-06-26 17:51:57,这款热水器外观时尚静音非常完美安装师傅很专业安装快捷美观非常感谢,0.9848165686298733
19793,6863137.0,5.0,2018-10-03 16:43:06,一直信赖美的的品牌家里的抽油烟机和煤气灶也是美的美的热水器性价比真的很高而且售后也好是良心企业安装师傅很专业安装费用也少以后还会远美的的,0.9996560835793119
19794,6863137.0,5.0,2018-07-31 08:06:08,京东的服务就是好刚买好售后就主动联系安装货刚收到隔了两个小时安装人员就过来了很效率机器还没有使用看起来质量不错外观很漂亮美的的品质值得信赖,0.9999938434077476
19797,6863137.0,5.0,2018-08-25 09:54:45,热水器到了后看着还是比较漂亮的约了师傅上门安装安装师傅干活很仔细做的很漂亮总体比较满意还没用用了之后再看效果,0.7721989444042041
19798,6863137.0,5.0,2018-09-26 15:06:37,师傅态度超级好很客气一直用的美的的热水器这次新家又买了美的一整套性价比特别高值得购买,0.9990596307225703
19799,6863137.0,5.0,2018-08-27 12:13:19,第一次买美的产品感觉还不错还在装修中还没用热水出的也快性价比很好,0.9594335821197633
19800,6863137.0,5.0,2018-07-29 18:52:23,618买的价格实惠产品外观高端大气上档次安装过程中出现了些小插曲经客服处理得以妥善解决天然气还没通等通好后再来评论,0.9980449945931681
19801,6863137.0,5.0,2018-06-29 12:43:10,收到货后很满意外观时尚大气按键灵敏安装师傅服务态度好给师傅一个赞非常满意京东值得你信赖,0.9989015747031796
19802,6863137.0,5.0,2018-05-07 20:28:23,高端大气上档次物流给力噪音低服务态度很好这是第二次买美的热水器上次的用了8年美的热水器很棒,0.9903826760857745
19803,6863137.0,5.0,2019-12-01 08:31:52,这个是双十一的时候买的前一个月买过一个用着感觉很不错双十一搞活动又买了一个整体感觉上来说性价比很高开始担心各种制热效果不好用了两天之后疑虑完全打消了美的的质量还是信得过的整个服务不错值得购买,0.9999255737999945
19805,6863137.0,5.0,2018-09-06 17:37:03,从下单送货上门安装都还是很顺畅滴可以看出京东美的配合还是不错滴安装师傅很给力很专业很不错的一次购物体验,0.9981996022177978
19806,6863137.0,5.0,2018-06-18 08:14:14,关注了很久了因为新房没有装修好所以一直没买刚好618有活动价格很合适就入手了第二天就收到了上午申请安装下午售后师傅就过来了速度很快安装也很顺利没有额外的收费项目安装好后还详细介绍了使用方法美的售后服务很到位家里的油烟机煤气灶消毒柜空调都是美的的信赖大品牌,0.9999740472297977
19807,6863137.0,5.0,2018-08-19 19:38:45,外观很大气物流也很快商家态度也好安装师傅也很好美的值得信赖只可惜家里还没有开燃气不能马上使用,0.9994570900528318
19809,6863137.0,5.0,2019-03-16 15:18:24,颜色特别装上挺好静音效果也挺好整体热水烧的快,0.9937914630585178
19811,6863137.0,5.0,2018-10-26 21:40:23,安装师傅服务很好装我们家的热水器跑了三趟不厌其烦兢兢业业专业熟练在此说一声师傅辛苦了谢谢另外夸夸美的热水器颜色豪华功能高端14L大水量很赞美的家电真的很不错,0.7774662455258561
19812,6863137.0,5.0,2018-10-04 17:47:55,我购买的美的天然气热水器是京东搞活动买的价格适中这款热水器质量不错出热水挺快的美的热水器大品牌值得信赖京东的东西值得购买商家服务态度非常好物流非常快安装也很到位下次还到京东购物,0.9999965639559155
19813,6863137.0,5.0,2019-06-26 15:33:10,很好用加热很快物流很快服务很好,0.9809709898566741
19814,6863137.0,5.0,2018-06-26 17:06:00,此款热水器外观时尚大气容量购大经济实惠安装师傅很细心值得购买,0.9999666735163619
19818,6863137.0,5.0,2018-04-28 15:39:16,物流很快很准时来安装都是提前预约的服务很到位施工小哥也很专业热水器东西也不错水气双调很叼家人都说好一直很信任京东各方面都很满意好评好评好评下次买别的家电也会选择美的,0.9046324157165454
19819,6863137.0,5.0,2018-06-17 09:07:28,送货很快安装师傅也很专业打了电话马上就来安装了热水器外观很漂亮功能很多非常棒,0.9932686659422811
19820,6863137.0,5.0,2018-12-02 14:23:21,老家刚装修的新房子还没开始使用看上去很大气物流很快货物送到安装师傅第二天就由于管不够长收了一点材料费,0.7370507719442686
19821,6863137.0,5.0,2018-05-06 18:05:19,看着高端大气上档次送货服务都很到位质量用后才知道了,0.9980684577628811
19824,6863137.0,5.0,2019-06-06 09:08:58,送货快服务好值得信赖安装效率高速度也很快还做了燃气安全检查热水器面板漂亮触控灵活操作方便温度设置43度正好热水10几秒后流出温度相当稳定,0.9965852366348272
19825,6863137.0,5.0,2018-11-19 17:48:27,发贷神速第三天就到货了安装师傅也很到位一切都很满意一直信赖的品牌希望在以后使用过程中也能如愿双十一价格也有优惠,0.9987568612168695
19828,6863137.0,5.0,2018-09-18 15:12:13,热水器发货很快收到了看外观挺高大上的安装师傅过来装的时候也挺积极的机器刚装好还没开始使用但是美的品牌价值在那里信得过,0.9885513609651528
19829,6863137.0,5.0,2020-05-18 15:32:46,外形外观小巧恒温效果很好噪音大小很小出水速度很大安装服务非常满意耗能情况一般,0.9990925144766142
19831,6863137.0,5.0,2018-07-31 13:58:04,第一天送到第二天就安装好了工人很负责热水器也很好看感觉很高大上美的值得信赖国产品牌最爱美的,0.9993585402939867
19832,6863137.0,5.0,2018-10-06 16:25:38,和媳妇商量来商量去决定买美的的热水器毕竟大品牌值得信赖而且这款颜色挺好看从心里接受早上下单到中午就送到了真是出乎意料的快送货师傅态度也很好卖家还给我预约安装完了没过多久美的售后就给我打电话说给我上门安装我真是惊呆了服务超好装好了以后就试了试洗了澡可以说大品牌值得信赖没的说价格也不贵放心购买吧,0.9987606253565551
19833,6863137.0,5.0,2020-01-14 08:26:38,都挺好的安装师傅很专业很快就装好了东西也很好没有任何问题,0.9927339967747958
19835,6863137.0,5.0,2018-10-12 20:11:44,安装师傅来的太快了师傅也很细心教我好多问题热水器也很好热的很快后期用用再来评吧,0.9059820465826551
19836,6863137.0,5.0,2018-06-03 11:39:28,美的大品牌值得信赖新房子装修买的美的天然气热水器相当给力安装师傅非常客气总之非常满意后续会给朋友推荐推荐此产品,0.999797874169197
19837,6863137.0,5.0,2019-05-22 15:46:50,商家服务特别好热水器质量不错外环很漂亮还没有使用后续追评,0.879949856080526
19838,6863137.0,5.0,2019-11-19 17:33:19,外形外观外观非常漂亮现在还没通气随后补上使用心得安装服务安装师傅非常专业服务非常好为美的有这样的安装师傅赞一个,0.9833593314985821
19839,6863137.0,5.0,2018-07-08 22:30:00,比较了很多品牌最后选了美的试用了一下还真是好用啊送货也是非常快捷京东一如既往到了当天当地服务商就打电话联系安装,0.9394262071463426
19840,6863137.0,5.0,2018-09-14 17:59:08,发货速度很快物流追踪也很到位售后上门安装预约也很主动商品比我想像中的满意安装师傅服务态度也很好不愧是大品牌厂家的作风等几天燃气公司接通气源,0.7440749338228426
19841,6863137.0,5.0,2018-04-20 10:22:08,商品很好物流也很快安装师傅也很迅速各方面都比较满意希望越做越好在京东购这么多年一直都很满意以后也会继续支持一如既往我还想问下我发了这么多的字到底有没有50个字,0.9484585519022855
19842,6863137.0,5.0,2018-10-06 23:04:23,昨天下单今天下午就到货安装好了外观高大上没得说大屏幕很好看按键很灵敏玫瑰金的外观很是时尚放在厨房里很好看功能也很赞使用后感觉热水器确实越大越好体积倒还好没感觉多大但是水量倒挺大的厨房和洗澡同时用也不会出现冷水不会忽冷忽热的出水恒温国产大品牌就是值得信赖感觉这两年美的的产品越来越好了期待进一步的使用效果谢谢卖家客服的服务,0.9999999155274355
19843,6863137.0,5.0,2018-10-14 14:27:31,纠结了很久最终选定这款机型以前用的就是美的热水器这次毫不犹豫的再次选择了它这款机型非常不错京东物流一直都是很快的安装师傅很快就来安装了,0.9994806583577882
19844,6863137.0,5.0,2018-09-18 12:22:43,很满意的商品美的的品牌一直很信赖热水器自然也不用多说货美价廉安装师傅也很认真仔细很耐心的讲解操作方法总之很好评,0.9999038110577845
19845,6863137.0,5.0,2018-10-11 11:30:10,第一次尝试美的的热水器外观设计很漂亮物流也很快第二天就到了隔天师傅就给安装上了赞一个,0.9993520534935273
19849,6863137.0,5.0,2018-09-22 23:05:39,京东忠实粉丝家电很多大件都在京东上购买以前的热水器不能定温度时冷时热这次更换后不仅可以定温度还可以选择升数有三个升数可供选择美的售后服务也特别好家电我选择美的购买家电上京东,0.995979457274378
19851,6863137.0,5.0,2019-01-17 15:30:58,大品牌值得信赖师傅当我的面猜开箱子还是享受零用安装的师傅态度非常好家里的电器都是美的的值得信赖产品和服务都是非常好的,0.9996364350787691
19852,6863137.0,5.0,2018-10-11 07:35:02,质量非常好与卖家描述的完全一致非常满意真的很喜欢完全超出期望值发货速度非常快包装非常仔细严实物流公司服务态度很好运送速度很快很满意的一次购物师傅安装很细心从顾客角度考虑问题大品牌值得信赖,0.9999998887971774
19853,6863137.0,5.0,2019-01-16 10:05:28,香槟金沉稳大气装上试了下十几秒就出热水了物美价廉,0.996954871109256
19854,6863137.0,5.0,2018-10-11 17:42:34,很稳效果好外观大气上档次服务效率和非常满意愉快的购物经历,0.9999893231815071
