id,product_id,score,comment_time,comment,sentiment
28085,100003168551.0,5.0,2020-04-10 14:19:49,安装服务非常好外形外观高端大气上档次,0.9998851635323227
28086,100003168551.0,5.0,2019-10-15 08:54:38,非常棒效果好零冷水,0.8950504209761501
28087,100003168551.0,5.0,2019-07-31 13:50:33,京东618活动价还是比较便宜的师傅安装很好出热水很快,0.8086991816103682
28088,100003168551.0,5.0,2019-11-03 15:31:22,东西很漂亮安装师傅也很棒,0.9035216761824849
28090,100003168551.0,5.0,2019-08-16 21:45:25,家电节抢的据说扬程10米送货很快赞一个尚未安装后续再评,0.9910519736660647
28093,100003168551.0,5.0,2019-12-08 20:35:20,外观时尚安装也完美,0.9921752321744552
28094,100003168551.0,5.0,2019-11-20 19:35:09,安装很快很完美不错,0.9947466721843969
28095,100003168551.0,5.0,2019-09-17 21:28:10,美的热水器质量不错最主要是价格实在服务好按装维修既时快非常满意值得信赖,0.9985697752438847
28096,100003168551.0,5.0,2020-04-06 11:44:33,安装非常满意送货的人员非常负责非常满意,0.6592693826113765
28097,100003168551.0,5.0,2019-07-04 00:12:02,东西不错送货速度很快质量很好京东的放心的不错,0.9994916406949265
28100,100003168551.0,5.0,2020-01-04 19:31:38,物流很快安装师傅也很快就联系上门安装了,0.6685802701729642
28102,100003168551.0,5.0,2019-11-04 13:06:43,外形外观外观漂亮很好看大气希望好用先好评oo恒温效果还没有使用使用后评价,0.9999989344165529
28103,100003168551.0,5.0,2020-04-27 17:39:25,安装服务安装小哥很不错安装专业一级棒,0.9829980771158595
28104,100003168551.0,5.0,2019-11-15 13:02:07,这个机型小巧好看我很满意这个热水器比实体店卖的同系列功能多还便宜双11买更划算送货速度快送货员直接送到了家现在还没安装等安装好了再来说机器体验,0.9999830755463142
28107,100003168551.0,5.0,2019-12-09 15:27:30,热水器很好用果然美的很安装师傅服务也很周到回头还会再来～么么哒,0.8054535117450081
28109,100003168551.0,5.0,2020-05-17 12:16:14,安装服务安装师傅很认真也认真讲解赞一个,0.9434160939558354
28111,100003168551.0,5.0,2019-11-17 19:38:58,很不错货品收到等师傅安装使用就可以用了东西小巧,0.8991073253688481
28112,100003168551.0,5.0,2019-10-16 16:14:10,安装服务安装师傅专业快速服务很好外形外观美观大气,0.997919518764555
28115,100003168551.0,5.0,2019-11-01 18:45:42,外形外观颜值挺高的价格实在活动力度很大值得购买,0.9980445235659129
28116,100003168551.0,5.0,2019-11-10 23:31:21,外形外观黑灰色很特别挺好看使用方便,0.9983837672636517
28119,100003168551.0,5.0,2020-01-04 16:35:18,安装师傅服务态度特别好非常专业赞,0.6861876351998826
28121,100003168551.0,5.0,2019-11-11 08:48:51,热水器收到了快递也非常快售后服务及时安装人员安装的很好没有乱收费外观小巧漂亮满意的购物,0.924017867242772
28122,100003168551.0,5.0,2019-11-25 20:10:48,热水器已经收到安装师傅态度很好颜值超高还没有用我想应该会不错吧用过之后一定会回评的,0.9631516748406166
28123,100003168551.0,5.0,2020-05-09 18:22:14,物流快安装也快服务态度也很好,0.8756587328992911
28126,100003168551.0,5.0,2019-08-11 09:45:41,京东物流真是个快包装好机器打开用了质量很好,0.8610598743566812
28127,100003168551.0,5.0,2019-07-28 14:30:36,很满意哦一直都在京东购买家里的大小家电售后都挺满意的而且送货速度比较快都是大品牌我选择京东,0.9995951135327845
28128,100003168551.0,5.0,2019-06-01 19:04:01,感觉看起还是非常不错比较高大上希望表里如一能够用得比较久,0.9163041698399607
28130,100003168551.0,5.0,2020-01-13 19:01:29,噪音大小声音非常小值得拥有,0.8885833729731725
28131,100003168551.0,5.0,2020-06-08 16:54:09,发货速度和安装速度都非常快,0.9230918634329678
28132,100003168551.0,5.0,2019-07-01 16:57:34,好卖家真有耐心我终于买到想要的东西了谢谢卖家价格很优惠服务也很好东西不错客服服务热情,0.9778944137079952
28134,100003168551.0,5.0,2019-05-18 09:14:54,大品牌值得信赖配送很快服务好赞,0.9999254685149351
28139,100003168551.0,5.0,2019-06-23 11:39:23,热水器不错性价比很高安装师傅很专业很热心值得推荐,0.9960364223207402
28141,100003168551.0,5.0,2019-09-19 15:15:32,价格实惠目前还没有装装好在来追加吧一直用美的的产品很不错,0.9994285921900076
28144,100003168551.0,5.0,2019-09-28 19:11:05,安装服务产品美观安装刘师傅E0221044非常热情施工精心点赞,0.9774340707705046
28148,100003168551.0,5.0,2019-07-08 17:53:50,京东一直选择信赖买了好几万的东西了值得信赖配送速度很快,0.9999592184772794
28149,100003168551.0,5.0,2019-06-06 17:07:32,非常好用谢谢美的大赞,0.9930070373433886
28150,100003168551.0,5.0,2020-03-02 22:54:46,安装服务非常专业非常满意,0.6479942962292433
28151,100003168551.0,5.0,2019-11-02 12:35:42,安装师傅很热情安装很好满分热水器待评测,0.8614898183592654
28152,100003168551.0,5.0,2019-09-10 12:00:29,东西保护完好物流也很快东西很不错,0.9945834409139149
28154,100003168551.0,5.0,2019-12-03 16:55:29,一流产品质量极佳安装服务一流,0.9988475654103862
28155,100003168551.0,5.0,2019-07-20 13:46:36,包装很好物流也很快还没有安装希望用起来不错,0.9823386676615338
28156,100003168551.0,5.0,2019-12-11 19:46:42,安装很专业送货很快比原来电热水器好用多了,0.8400183686243657
28159,100003168551.0,5.0,2019-11-11 17:25:20,小伙子热情服务业务熟悉安装细心很满意,0.9956586345531259
28160,100003168551.0,5.0,2019-12-07 19:15:34,师傅安装很细心活干的不错给个赞,0.9648344234010461
28162,100003168551.0,5.0,2019-08-05 10:31:48,安装师傅很及时安装位置很好很满意,0.7244255822784573
28163,100003168551.0,5.0,2019-06-22 20:23:56,看着很不错值得推荐活动买的很便宜,0.9966112512164264
28165,100003168551.0,5.0,2019-10-06 12:39:38,安装很好产品也很合适,0.9244796194937974
28168,100003168551.0,5.0,2019-11-11 10:50:39,安装完毕很大气上档次,0.8815875784534993
28169,100003168551.0,5.0,2019-06-02 20:05:56,还没安装先评价下物流超赞说十分钟到就十分钟到,0.8062022624127003
28172,100003168551.0,5.0,2019-11-02 19:20:06,师傅很热情售后很好服务不错,0.8898913129178116
28173,100003168551.0,5.0,2019-11-03 17:10:54,安装服务效果很好安装师傅很细心,0.8697556055616145
28175,100003168551.0,5.0,2019-11-12 12:31:56,师傅安装的很好人很好赞,0.9290571881260921
28176,100003168551.0,5.0,2019-07-16 15:07:59,样式比较大方非常不错,0.9967121495910163
28178,100003168551.0,5.0,2019-10-11 09:39:48,师傅安装好很有耐心很不错,0.8737265512224915
28180,100003168551.0,5.0,2019-06-17 17:13:12,不错很方便热水来的快,0.9593169818956765
28181,100003168551.0,5.0,2019-06-23 13:31:08,性价比很高三口之家刚刚好,0.9889726955588578
28185,100003168551.0,5.0,2019-08-02 18:13:08,安装服务特别好介绍到位,0.8571565130520695
28186,100003168551.0,5.0,2019-11-18 10:33:34,外形外观外观不错服务很好,0.9998902675792603
28187,100003168551.0,5.0,2019-10-04 15:14:43,安装师服务热情很满意,0.6640142986586897
28188,100003168551.0,5.0,2019-09-29 15:14:48,安装速度够快非常满意,0.9480729731980996
28189,100003168551.0,5.0,2019-10-02 14:23:30,很不错安装师傅也用心,0.8170026467337222
28190,100003168551.0,5.0,2019-06-20 16:36:39,安装师傅很专业好评赞,0.6636455555144092
28194,100003168551.0,5.0,2019-06-23 13:08:26,发货挺快安装也很好,0.9210124282002269
28195,100003168551.0,5.0,2019-06-16 18:36:25,零回水很实用美的售后服务很好,0.932160181603562
28200,100003168551.0,5.0,2019-05-15 15:07:16,美的热水器真心不错值得拥有,0.9967885292646267
28202,100003168551.0,5.0,2019-06-17 08:47:16,还没有安排安装很好,0.7138553367138547
28203,100003168551.0,5.0,2019-11-07 14:38:37,在京东购买商品物流就是给力第二天就到货了第三天就安排安装了安装师傅人很好安装速度快而且款热水器非常的大气漂亮闪耀的外壳不显脏材质好外观大方LED触控显示屏特有质感0冷水热水器真的很棒还是智能WIFI即开即热用起来非常方便,0.9982066237567018
28205,100003168551.0,5.0,2020-05-03 13:04:17,这种热水器就是随时用热水都不断的洗澡的时候源源不断的热水温度也不会忽冷忽热的外形外观简约大气很有质感恒温效果设置温度出来的水恒定的温度噪音大小还可以出水速度管子里的水排空就是设定的温度了安装服务安装师傅很好很专业安装的挺快,0.6243961103134289
28207,100003168551.0,5.0,2019-10-05 15:13:41,体积小容量大灰色金属面板简洁大方边角圆滑不会碰磕这款功能齐全智能型Wⅰf可控零冷水太喜欢了家里装修中装修完再使用期待,0.9963189777436999
28208,100003168551.0,5.0,2019-12-20 20:59:29,外观不错体积比原来用的热水器小了不少噪音有但是可以接受智能控制出水速度也可以恒温效果好安装速度快,0.9994728885210327
28209,100003168551.0,5.0,2020-03-31 09:30:55,用了一段时间感觉还行吧外形外观不是很大节约了空间但是颜色好像有点自来旧的感觉出热水还是蛮快的至于噪音能接受接受范围内安装师傅服务态度很好好评,0.7641143471146004
28210,100003168551.0,5.0,2020-02-25 20:06:35,外形外观乌黑发亮像黑钻一样样式与老房子不是很配但也还好毕竟房子也是旧的总体还好恒温效果热水很稳定尤其是零冷水让老房子一下子充满了新的活力尤其适合刚刚出生的母婴家庭老婆刚刚坐月子不适合碰冷水最给力的当然是瀑布洗,0.9998472273530669
28214,100003168551.0,5.0,2019-11-11 21:07:27,恒温效果水温还是比较稳定洗澡过程中没有太明显的忽冷忽热外形外观金属灰色比一般的白色金色更有质感安装服务安装还算快的预约的当天都完成了安装,0.7744888539347966
28215,100003168551.0,5.0,2019-06-15 11:41:03,性价比高颜色漂亮主要是适合我这种没有回水管的老房子的确做到了零冷水还可以手机远程控制以前卧室洗手间等热水要好长时间浪费很多水美的值得信赖老热水器用了17年7000多就是不坏质量也不错不过也该下岗了,0.9961313084450876
28216,100003168551.0,5.0,2019-07-24 13:42:16,买这热水器之前朋友都推荐我买林内史密斯或者万和的热水器说美的不是专业做热水器的不好看到这款热水器一下就被漂亮的外观吸引了小巧的机身节省空间灰色也挺耐看不过时了解了它的功能后就毫不犹豫的买了第二天就收到货马上就安装好了人工和辅材费都免费真正元安装热水器功能强大智能变升很节能零冷水功能也还好用虽然不能做到每个龙头都既开即热比起以前的热水器还是好多了出热水也挺快噪音也小性价比真的不错希望能够稳定耐用相信国产品牌会越做越好,0.999062181300895
28218,100003168551.0,5.0,2019-11-16 15:55:11,安装过程很愉快美的售后一向是最好的整个过程很顺畅预约时间很准时说两点准时两点到门口等候这一点绝对值得称赞回水功能也算是完美至少少浪费点水毕竟现在需要珍惜水资源声音的确是有但也是可以接受的,0.9921685001072581
28219,100003168551.0,5.0,2019-10-06 22:28:26,体积小节省空间外观颜色都不错物流安装到位,0.9949238111383596
28220,100003168551.0,4.0,2019-10-06 17:35:56,小巧好看不占位置外观高大上目前家里还没通气还没打开试用通气后再来追评送货速度快物流迅速安装师傅负责没有额外收费相比其他品牌这款性价比更高值得购买,0.9990232220215159
28222,100003168551.0,5.0,2019-10-08 21:04:54,外形外观小巧漂亮美观大方感觉档次挺高噪音大小声音不算大还没正式使用试用了一下感觉挺好安装服务安装师傅很用心装的效果也不错就是费用感觉有点略高550不知道合理不合理出水速度出水速度不错比现在用的老款的还是好不少,0.9999999815000639
28223,100003168551.0,5.0,2020-03-08 11:54:45,外形外观不错又很小恒温效果洗澡的时候温度恒定没有变化安装服务疫情原因有点慢出水速度10-20s能出热水老房子,0.9924828515783323
28224,100003168551.0,5.0,2019-10-13 21:47:35,外观漂亮时尚功能齐全噪音细静师傅安装态度良好,0.9975336483131605
28225,100003168551.0,5.0,2019-12-14 10:36:09,外形外观挺时尚噪音大小声音不大安装服务很好恒温效果不会忽冷忽热了出水速度几秒就出热水,0.8598878240004835
28229,100003168551.0,5.0,2020-04-11 17:15:56,外形外观时尚高质感出水速度快均匀恒温效果输出稳定噪音大小声音不大抽水泵声音也不大耗能情况没有认真测试安装服务态度好工作认真赞,0.9990387065974013
28230,100003168551.0,5.0,2019-09-20 17:05:43,外形外观厚了点看起来还行安装服务师傅很认真可以的赞噪音大小还未使用美的值得信耐就是又降价了点～能保价成啊哈哈～,0.9995186395736995
28231,100003168551.0,5.0,2020-06-15 17:50:53,这款热水器外观小巧精致材质还是比较好安装师傅太度服务好安装仔细解释到位值得赞扬,0.9993785853954293
28232,100003168551.0,5.0,2019-11-03 22:22:56,外形外观小巧精致美观安装服务安装快捷服务到位功能实用控制方便真的好用,0.9999916368199406
28233,100003168551.0,5.0,2020-05-05 13:21:28,外形不错安装也不错不过这个零冷水也需要等一分钟洗澡之前也需要等一会希望美的尽快攻克难关开水就热,0.8473166157867219
28234,100003168551.0,5.0,2020-04-23 14:20:12,外观漂亮有档次功能强大节能安全出热水快,0.9976136087532476
28235,100003168551.0,5.0,2019-08-27 12:28:39,外观小巧精美师傅安装也细心新家安装还没开始使用安装师傅说这是一款零冷水的大爱能节约用水了,0.6703482422834389
28236,100003168551.0,5.0,2019-11-23 09:42:31,热水器到货速度快小巧质感不错期待安装,0.997171378766141
28237,100003168551.0,5.0,2019-10-27 11:12:10,外形外观灰色我喜欢耐看恒温效果感觉还不错噪音大小还好在阳台外边出水速度挺快的可以安装服务装的很快美观耗能情况应该节能的继续用看看,0.9999598956942248
28238,100003168551.0,5.0,2019-11-03 14:27:20,外形外观小巧精致恒温效果温无变化噪音大小噪音尚可出水速度可大可小安装服务非常满意耗能情况尚不可知,0.9999796950602099
28239,100003168551.0,5.0,2019-10-11 18:10:48,1体积在同类型16升热水器中较小正好适合家里的位置；2热水到得快大户型也没问题；3送货安装和售后服务都比较到位；4保修期长；,0.9909381373089563
28242,100003168551.0,5.0,2019-09-01 20:25:51,外观漂亮使用不错开始会有点冷水几秒就热了,0.9844339335355432
28243,100003168551.0,5.0,2019-12-22 14:52:33,外形外观简洁大方恒温效果不错出水速度出水速度也快热起来也快,0.9999998124637078
28244,100003168551.0,5.0,2019-11-15 00:43:22,包装很好外形美观面板感觉不错颜色也耐脏好看安装服务挺好就是固定墙面的配件建议安装师傅可以备一些不用临时需要还叫人出去买又说耽误时间机器还未使用功能待检验,0.9863092461716629
28245,100003168551.0,5.0,2019-11-24 11:52:54,还是蛮不错的点动零冷水还没有通煤气通了好用再追评,0.751837873665409
28247,100003168551.0,5.0,2019-12-15 19:58:00,外形外观小巧不占地我喜欢恒温效果新房装修还未开通气后期评论安装服务师傅专业很仔细细心,0.9999057001144201
28248,100003168551.0,5.0,2020-01-11 09:37:33,外形外观很适合我家的装修颜色安装服务服务挺好的其他效果都还不知道还没开始使用应该不会差吧,0.9689249979373611
28249,100003168551.0,5.0,2020-05-11 09:03:45,外形外观说是小巧的和一般的热水器大小差不多噪音大小噪音不大出水速度根据自己房间管道的长短出水速度是不一样的安装服务用了两个安装工人恒温效果出水很快出热水的速度不是很快,0.9996247105220406
28250,100003168551.0,5.0,2019-11-05 07:28:23,外形外观外形美观大方安装服务服务也好提前打电话预约,0.9994316665344517
28254,100003168551.0,5.0,2019-07-18 18:08:39,此款天然气热水器物有所值其水为16升零冷水能满足居家生活好,0.8129108996266824
28255,100003168551.0,5.0,2019-09-27 07:30:36,外形外观漂亮外观上档次体积比较小巧还没开机使用师傅态度好,0.999975090593551
28257,100003168551.0,5.0,2019-05-09 20:58:37,美的热水器大品牌值得信赖外观小巧玲珑外观时尚大气智能机操作方便快捷,0.9999995695624909
28259,100003168551.0,5.0,2019-11-28 23:27:35,外形外观美观大方恒温效果稳定噪音大小一般出水速度可以安装服务可以耗能情况节能,0.9999093641206556
28260,100003168551.0,5.0,2019-11-14 21:12:18,热水器确实小巧玲珑今天刚安装好还没有开始用感觉还不错用过后再过来好评,0.8909196958821389
28262,100003168551.0,5.0,2019-06-22 15:24:19,不错高端大气就是我们装不了回水阀自己原因产品不错声音不是很大好评,0.8962931308573574
28266,100003168551.0,5.0,2019-06-23 23:36:58,应该是刚上市的新品功能丰富而且大促打折力度大用了几天感觉不错,0.8353124617787148
28267,100003168551.0,5.0,2019-08-06 22:20:43,今天装上了因新房没通气还试不了不过外观简洁大气很不不错,0.9917454110983943
28268,100003168551.0,5.0,2019-12-11 18:52:43,外形外观比较大气美观占有空间比较小恒温效果恒温效果不错噪音大小声音不是太大安装服务安装比较快服务相当一流出水速度很快不需要等太长时间也就不到一分钟的时间就出热水耗能情况还可以,0.9999126843866929
28272,100003168551.0,5.0,2019-12-11 17:25:22,宝贝收到安装好了颜值确实高装在墙上感觉百搭又不失气质安装师傅安装负责技术专业交代的比较清楚,0.6880949204236889
28273,100003168551.0,5.0,2019-10-03 18:53:09,东西质量不错很喜欢热水很快零冷水也不错一开就有功能也挺齐全外观不错还有wifi功能可以做智能联动就是安装要点费用,0.9999848545175168
28274,100003168551.0,5.0,2019-11-15 17:35:23,装完几天了还没通燃气没有试机外观看还可以时尚大气,0.9165551813864427
28276,100003168551.0,5.0,2019-10-27 12:15:11,噪音大小还没用感觉还可以外形外观大小合适比较秀气安装服务安装挺快的打了好几个电话给我,0.9980375372493123
28277,100003168551.0,5.0,2019-11-03 13:26:58,外观大气功能也不错感觉这个价格还是挺值得的,0.9999350563694911
28279,100003168551.0,5.0,2019-11-03 12:03:39,安装师傅服务周到热水器也好美观大方,0.9756073264903513
28282,100003168551.0,5.0,2019-06-20 16:57:51,2019年新品外观漂亮性价比高目前刚收到货未安装等待安装使用后才能作出质量评价,0.9178644853758295
28283,100003168551.0,5.0,2019-11-11 09:38:26,货已到了好几天外观靓物流速度快因硬装未完成还未安装,0.9971818322191567
28285,100003168551.0,5.0,2019-11-16 16:42:23,外形外观小巧美观恒温效果还没通气后面加评安装服务师傅安装态度好下午打电话下午就来棒棒哒,0.7991211180969099
28287,100003168551.0,5.0,2020-05-16 12:44:52,比较满意恒温效果比较好噪音大小小出水速度比较满意快安装服务一般吧,0.9957131847627596
28288,100003168551.0,5.0,2019-12-13 12:24:18,外形外观相比同性能的其他热水器要小巧一些恒温效果恒温效果很好噪音大小需要点火燃烧天然气热水器的通病吧一般出水速度这个是要根据水管长度来定的比较满意吧安装服务安装师傅服务态度挺好的耗能情况具体没有测算过大差不差吧,0.9979176806808432
28290,100003168551.0,5.0,2019-11-07 21:16:06,感觉蛮不错的样子啊主要还是看中小体积不占地方,0.9995882857440643
28291,100003168551.0,5.0,2019-08-15 10:31:54,小巧功能强大零冷水不用再放半盆水等热水来了还可WIFI控制等待安装期待效果,0.9398175468546108
28294,100003168551.0,5.0,2019-09-20 20:10:59,外形外观大气美观恒温效果效果出众噪音大小噪音小出水速度出热水快安装服务态度好准时耗能情况二级能效,0.9999748875728368
28295,100003168551.0,5.0,2019-11-24 10:55:37,外形外观漂亮出水速度快安装服务服务好恒温效果零冷水打开开关后5秒恒温效果明显噪音大小一般,0.9867251635143286
28298,100003168551.0,5.0,2020-01-11 14:00:45,这次的换货服务让我更加相信京东的品质真的不错虽然中间有些波折但是最终的结局很好值得信赖目前热水器用起来还不错用一段时间再说但是在回收热水器的时候把链接WiFi的天线收走了我不知道该找谁把这个天线要回来,0.8699162286263215
28299,100003168551.0,5.0,2020-03-26 13:00:07,这热水器制热很快体型也小巧不过那个增压好像没什么用,0.8619218435157499
28300,100003168551.0,5.0,2020-05-22 19:00:03,外形外观外形体积小嗓音小恒温效果好出水速度快,0.9998959018453231
28301,100003168551.0,5.0,2020-03-06 18:59:15,恒温效果好出水速度快噪音大小小安装服务好耗能情况要试用一段时间才知道,0.9675802219194184
28303,100003168551.0,5.0,2019-12-01 07:33:36,外形外观好看小巧恒温效果好噪音大小一般出水速度快安装服务安装了3次是70的排气孔耗能情况不错,0.9882504200084161
28304,100003168551.0,5.0,2019-11-07 15:17:33,热水器送到了售后马上就联系上门安装好了师傅安装挺专业的态度也不错还有客服服务也不错有问必答赞一个,0.8031824440221895
28306,100003168551.0,5.0,2019-11-07 13:23:38,外形外观这款外观是最中意的的地方小巧黑酷房子还没装修好等装修好装上不会失望的,0.9993868628020912
28307,100003168551.0,5.0,2019-07-22 00:04:01,功能强劲安装便捷快速美的热水器不错推荐购买,0.9998560199007765
28309,100003168551.0,5.0,2019-12-23 19:10:17,外形外观外观时尚恒温效果恒温效果好噪音大小噪音小出水速度出水速度快安装服务安装专业耗能情况智能变升省煤气,0.9999959587493377
28311,100003168551.0,5.0,2019-10-08 16:10:56,因为是小居室选了好久才选了这款体积小的跟舅舅家是上下楼一起买了两个配送快安装细心值得购买,0.999429944147809
28312,100003168551.0,5.0,2020-01-16 11:31:37,颜值高目前还未使用美的品牌应该值得信赖,0.9994403327528307
28313,100003168551.0,5.0,2019-11-16 13:37:25,声音挺大操作简单质量不错,0.8720337021923615
28314,100003168551.0,5.0,2019-11-12 13:57:04,外形外观美的美的不是一般美安装服务工人联系积极主动服务态度不错,0.9999324317339573
28315,100003168551.0,5.0,2019-06-12 14:02:14,已安装待通气调测外观漂亮质量等用过之才好评论,0.8909039327926773
28316,100003168551.0,5.0,2019-06-28 23:34:28,美的零冷水热水器16升的确实划算好用值得购买还免300以内材料费包修8年性价比超高,0.9608875275414084
28318,100003168551.0,5.0,2019-11-21 18:52:02,外形外观美观体积小安装服务安装师傅响应速度快安装专业,0.9828596012701984
28319,100003168551.0,5.0,2019-10-10 21:50:02,外形外观比常规的体形小装的位置拍不到正面机器不错安装服务师傅安装到位,0.9965614719346964
28320,100003168551.0,5.0,2019-12-12 20:17:11,一直信赖京东包装完好物流没的说房子没装修好还未安装先好评,0.9273787403902519
28322,100003168551.0,5.0,2019-07-05 22:33:51,比较小巧没那么占地儿总体不错,0.9987231322074788
28323,100003168551.0,5.0,2019-11-03 19:54:23,外形外观漂亮噪音大小小安装服务好评耗能情况好,0.9978801734217697
28325,100003168551.0,5.0,2019-11-17 15:49:38,大品牌值得信赖安全性能有保证外观漂亮节能环保,0.9999541822015386
28326,100003168551.0,5.0,2020-01-16 06:17:33,外形外观好质量好喜欢相信京东自营的产品安装服务好恒温效果还未使用,0.9917088062418246
28328,100003168551.0,5.0,2019-09-26 11:38:58,外形外观美观大方恒温效果好噪音大小少出水速度快,0.9999876978461361
28329,100003168551.0,5.0,2019-07-08 00:13:25,外观挺有科技感安装服务也到位好评,0.9936570748787126
28330,100003168551.0,5.0,2019-10-20 08:54:08,恒温效果好外形外观好噪音大小好出水速度好安装服务好耗能情况好,0.999574275502432
28331,100003168551.0,5.0,2020-05-29 14:47:41,送货及时安装也不错,0.8225258730510125
28332,100003168551.0,5.0,2019-11-11 19:13:35,外形外观漂亮恒温效果不错噪音大小小出水速度快安装服务满意耗能情况不清楚,0.9999796871405404
28336,100003168551.0,5.0,2019-06-11 22:52:02,外观时尚大气网络远程控制方便,0.9973157582967122
28339,100003168551.0,5.0,2019-08-03 13:26:56,安装及时服务满意安装师傅管路工艺细致赞,0.8468269554105179
28340,100003168551.0,5.0,2019-08-02 19:25:14,美的产品值得信赖家里全是美的电器,0.9999491637753442
28342,100003168551.0,5.0,2019-11-05 11:40:21,外形外观小巧精致美观大方好评,0.9999951080846007
