id,product_id,score,comment_time,comment
9579,100011323840,5,2020-06-06 20:10:06,安装服务很好恒温效果很好噪音大小很小出水速度很快耗能情况节能外形外观还行
9580,100011323840,5,2020-06-09 22:53:58,安装好啦师傅服务态度很好也很专业宝贝买的挺值期待使用效果
9581,100011323840,5,2020-04-09 15:40:23,恒温效果出水量不错的恒温效果很不错外形外观简单好看很便捷
9582,100011323840,5,2020-04-17 11:14:45,安装服务大厂就是不一样师傅态度很好京东物流也给力解决了我一大堆的糟心事
9583,100011323840,5,2020-04-28 14:54:25,噪音大小非常满意噪音比较小挺安静的
9584,100011323840,5,2020-06-21 12:02:20,噪音大小东西质量非常好与卖家描述的完全一致非常满意真的很喜欢完全超出期望值发货速度非常快包装非常仔细严实物流公司服务态度很好运送速度很快很满意的一次购物
9585,100011323840,5,2020-06-16 13:23:42,送货跟安装都很迅速享受了美的的零元安装服务辅材都不收费不错哦新家还未通气效果以后再验证
9586,100011323840,5,2020-05-12 16:32:30,安装师傅服务态度很好热情专业产品外观时尚五星好评
9587,100011323840,5,2020-05-28 13:39:24,安装的师傅很耐心热水器的外观很好看还能连智能家居很棒
9588,100011323840,5,2020-06-09 09:31:37,质量不错外观漂亮服务态度非常好安装服务Anz安装及时外形外观外观精美
9589,100011323840,5,2020-05-17 14:30:36,已经安装很好看霸气安装师傅也很到位
9590,100011323840,5,2020-03-22 10:31:35,装好了很好用不错老热水器罢工了洗澡总算有热水了哈哈
9591,100011323840,5,2020-07-06 12:08:17,外形外观配厨房墙砖很匹配恒温效果温水温度刚合适
9592,100011323840,5,2020-06-20 11:45:07,外形外观非常好外观很大气好看值得购买的一款
9593,100011323840,5,2020-03-09 11:39:09,第一次买燃气热水器刚开始还在犹豫但是看了它的功能介绍我果断的选了它这款热水器的非常大气漂亮耐脏材质用料好送货也及时安装也不错LED的触控显示屏特别有质感触摸时手感也很舒服调节时很灵敏操作简单字体清晰看得非常清楚底部有出水口燃气口进水口标的很清楚用起来后觉得节能环保是这款燃气热水器最主要的也是最重要的特点
9594,100011323840,5,2020-06-01 12:26:42,噪音大小声音特别子安装服务大品牌服务安装快速外形外观高端大气上档次
9595,100011323840,5,2020-06-21 13:30:49,热水器已经安装好安装师傅非常非常棒很专业非常感谢
9596,100011323840,5,2020-06-06 11:31:46,外形外观好看很棒恒温效果还没用以后再看看噪音大小还没用还不知道出水速度还没用还不知道安装服务服务非常棒师傅很负责干活很细致耗能情况应该还行吧性价比很高
9597,100011323840,5,2020-06-20 09:57:25,安装师傅很辛苦尽心尽责安装灰尘用布垫在下面
9598,100011323840,5,2020-03-20 10:36:54,送货很快包装很好还没有拆开家里还没有装修好装修好装完以后再看看效果
9599,100011323840,5,2020-07-03 09:03:49,设备完好师傅安装十分认真帮忙设计力求最美观的效果
9600,100011323840,5,2020-06-20 07:51:27,安装非常顺利有些不太会使用快递太给力了光速
9601,100011323840,5,2020-06-05 07:02:31,安装服务安装非常认真好评恒温效果还不错噪音大小声音不算大可以接受
9602,100011323840,5,2020-05-19 19:45:57,安装服务非常好安装人员很热情安装的十分满意
9603,100011323840,5,2020-06-20 12:12:39,赶618买的还不具备安装条件但是以前我买过美的不少家电安装和售后非常好尤其是安装净水机后该换滤芯了会有服务人员给你打电话上门更换不用自己记时间非常贴心
9604,100011323840,5,2020-06-25 16:41:07,安装很及时师父服务态度很好技术厉害感谢美的给我们提供很大的便利
9605,100011323840,5,2020-05-29 08:57:36,很不错的热水器送货很快安装师傅很耐心态度很好非常满意
9606,100011323840,5,2020-06-07 17:03:33,安装服务安装师傅专业到位认真负责提供安装建议做好卫生很好
9607,100011323840,5,2020-03-28 11:07:19,热水器不错温度控制非常精准很快就能来热水全程循环更是解决了困扰家里很久的大问题好用不贵美的品质值得信赖还能在手机端实时显示并且控制早上起床就可以直接点击好直接去洗澡不用漫长的等待热水超赞
9608,100011323840,5,2020-05-23 20:20:52,恒温效果非常好安装师傅非常专业还帮我改了以前的水管
9609,100011323840,5,2020-06-18 19:38:11,安装服务非常满意噪音大小小恒温效果好外形外观美出水速度快耗能情况小
9610,100011323840,5,2020-06-20 00:34:36,看起很高大上还没通气安装师傅很负责讲解也很到位
9611,100011323840,5,2020-05-02 20:12:39,外形外观很好看屏幕很大满意恒温效果因为天然气还没有开通还不清楚用过后再评价噪音大小因为天然气还没有开通还不清楚用过后再评价出水速度因为天然气还没有开通还不清楚用过后再评价安装服务安装的师傅很专业很细心我们安装回水阀的地方很不方便师傅是躺在地上安装的真的很敬业必须五星耗能情况因为天然气还没有开通还不清楚用过后再评价
9612,100011323840,5,2020-06-18 09:44:08,安装完成服务态度非常好机器漂亮好使
9613,100011323840,5,2020-04-22 14:36:10,安装服务很快很及时服务很好
9614,100011323840,5,2020-06-24 13:39:43,安装师傅很好上午到的货中午就来安装了谢谢
9615,100011323840,5,2020-06-27 15:39:13,美观大方价格便宜服务很好不错
9616,100011323840,5,2020-06-27 23:03:36,东西不错京东速度杠杠的老客户了有需要还会购买
9617,100011323840,5,2020-05-08 18:31:22,外观设计挺漂服务很好不错
9618,100011323840,5,2020-06-15 10:10:32,安装完毕安装师傅很专业还用纸盒子包好了
9619,100011323840,5,2020-05-08 19:12:18,很高大上操作方便安装师傅很专业安装非常负责认真
9620,100011323840,5,2020-06-20 21:51:45,外观时尚功能齐全很不错热水速度没的说
9621,100011323840,5,2020-06-24 16:23:04,样子很好看安装师傅也特别负责非常的满意
9622,100011323840,5,2020-03-11 10:06:13,外形外观颜色漂亮外形高端大气噪音大小噪音基本可以忽略比以前的好太多安装服务服务真是没得说售后安装跟进也很及时到位出水速度出水速度也非常快冷水时间比以前短太多恒温效果恒温非常好不会像以前的一时冷水一时热水冬天洗澡不用担心突然冷到跳起来
9623,100011323840,5,2020-06-08 23:24:37,安装服务安装师傅服务很好由于我在外地安装师傅把每个细节都拍照发给我看装好后帮我把打孔弄脏的地方弄得干干净净很满意的一次安装体验价格透明
9624,100011323840,5,2020-05-26 19:41:55,不错功能很好零冷水功能很好安装师傅服务很到位
9625,100011323840,5,2020-06-15 15:20:19,安装服务很满意准时上门外形外观好看耗能情况还可以恒温效果不错
9626,100011323840,5,2020-06-23 16:51:10,各方面都很好师傅做事很细心
9627,100011323840,5,2020-04-13 18:21:32,产品很不错安装完成试机很好值得拥有
9628,100011323840,5,2020-04-26 15:45:19,外形外观很漂亮噪音大小很小出水速度很快
9629,100011323840,5,2020-05-30 15:15:52,安装服务非常满意外形外观好看很复核年轻人审美
9630,100011323840,5,2020-06-14 20:09:51,外形外观外观漂亮小巧恒温效果还没试用刚装修完房子还没入住安装服务安装师傅非常负责及时给联系问怎么安装位置放在哪
9631,100011323840,5,2020-06-27 18:08:21,安装服务安装师傅很幸苦好评满分
9632,100011323840,5,2020-03-26 14:27:55,商品不到一天时间就到了快递小哥很热情直接送货进家东西还没拆买了等新家装修好再装期待使用效果
9633,100011323840,5,2020-06-07 21:58:59,很快就收到了售后服务非常好安装很及时师傅也很专业非常满意
9634,100011323840,5,2020-06-03 08:52:27,外形外观外型很好看暂时还没有安装后续安装了再续评
9635,100011323840,5,2020-06-04 20:17:00,零冷水让家人告别小厨宝再远也不用放很久冷水产品功能强性价比高安装师傅棒棒的
9636,100011323840,5,2020-07-04 15:45:17,机器质量不错安装冯师傅很专业服务态度很好必须好评收费透明合理
9637,100011323840,5,2020-04-22 16:03:23,东西很好美的品牌值得信赖安装师傅很好热情
9638,100011323840,5,2020-07-02 08:21:00,安装服务安装师傅给我把瓷砖打破了真伤心
9639,100011323840,5,2020-07-04 13:41:38,商品很好安装专业服务好效率高
9640,100011323840,5,2020-06-04 14:26:19,送货及时售后上门安装及时服务态度非常好安装非常合理师傅辛苦了
9641,100011323840,5,2020-06-15 14:43:08,安装服务安装师傅很好提前预约时间准时到达
9642,100011323840,5,2020-07-07 22:04:38,外形外观热水器没什么问题等用了之后再来评价安装师傅很好特别细心
9643,100011323840,5,2020-06-03 15:52:22,安装服务安装师傅非常耐心不懂的地方一点一点的指点还很健谈非常满意
9644,100011323840,5,2020-03-26 06:20:01,比电热水器方便大多了热水随用随有非常好
9645,100011323840,5,2020-05-28 17:50:15,安装服务上午收到货下午就马上有师傅上门安装了师傅态度很积极很专业很耐心的讲解了使用步骤大牌就是信得过外形外观高大上档次
9646,100011323840,5,2020-04-27 07:45:33,东西好产品外观也好使用起来很方便售后特别好下次还会回购
9647,100011323840,5,2020-06-23 09:59:37,618买的还没安装等装修好了在安装售后去家里指导安装位置水电位置很赞
9648,100011323840,5,2020-04-06 12:54:57,安装服务师傅很准时安装速度快很赞哈
9649,100011323840,5,2020-06-21 19:14:17,安装师傅技术不错服务也很好
9650,100011323840,5,2020-05-01 19:23:06,外形外观外观很好看屏幕是个亮点安装服务还没有用但是感觉应该不错之前看别人测评效果很好师傅送货很快但是京东只负责配送后期美的服务站会联系安装
9651,100011323840,5,2020-06-28 10:31:30,非常好安装师傅特别给力很惊艳
9652,100011323840,5,2020-06-26 16:28:08,外观高大上安装师傅按的非常好做工精细
9653,100011323840,5,2020-06-20 17:46:09,安装完成好用师傅安装手艺很好
9654,100011323840,5,2020-06-18 19:26:54,安装服务很满意服务态度好外形外观还可以
9655,100011323840,5,2020-05-05 19:13:26,安装非常满意热水器挺智能的
9656,100011323840,5,2020-05-15 15:06:46,安装服务安装人员很负责热情约定时间提前到达安装后场地也收拾干净
9657,100011323840,5,2020-07-04 07:07:28,包装完好无损的送到我妈妈手里快递师傅服务态度没得说很好具体还没用
9658,100011323840,5,2020-06-19 18:00:37,外形外观美观大方上档次也是要好看我没有安装应该好用超值价格便宜下次还会光顾
9659,100011323840,5,2020-07-05 12:29:09,1宝贝收到了师傅帮安装好了很喜欢看上去高大上在实体店去看了好几家后来还是确定了在你家买质量杠杠滴喜欢的赶快入手我相信品牌的力量用了一个星期才来评价的我相信品牌的力量我们全家都信得过京东想不到网上买大家电也这么省心3非常满意的一次购物商家发货及时诚实守信机器非常好用使用后再续评已经多次购买了五分京东购物就是比实体店便宜客服人员电话态度超好不管专业技术还是时效都很GOOD客服人员电话态度超好
9660,100011323840,5,2020-06-07 19:09:36,热水器不错师傅安装的也很认真
9661,100011323840,5,2020-06-25 11:15:01,很好热水出的很快
9662,100011323840,5,2020-03-11 18:25:45,外形外观外形很漂亮恒温效果目前刚开始用几秒就出热水了安装服务安装师傅很到位
9663,100011323840,5,2020-04-14 10:58:04,很好用很喜欢的东西大家可以购买没有太大的区别真的很好哦看到的可以买了
9664,100011323840,5,2020-07-10 09:51:10,安转师傅很专业安装很好外形外观外观很好很时尚
9665,100011323840,5,2020-06-19 11:21:00,安装师傅非常尽职尽责非常满意
9666,100011323840,5,2020-05-19 19:19:17,安装服务对安装师傅非常满意特别好一直给调整忙前忙后好几个小时真的很辛苦给师傅一个大大的好评
9667,100011323840,5,2020-06-09 11:04:45,外形外观外观很美安装服务服务到位
9668,100011323840,5,2020-06-23 14:34:01,安装师傅很好很有耐心热水器出水速度也很快赞
9669,100011323840,5,2020-05-19 23:31:21,还没安装等师傅上门很好的师傅认真负责
9670,100011323840,5,2020-06-21 13:05:42,外形外观漂亮大气恒温效果目前为止一直恒温噪音大小噪音很小
9671,100011323840,5,2020-04-21 21:39:12,物流速度好快售后服务态度很好忙到很晚才忙完还打扫了卫生感谢
9672,100011323840,5,2020-06-11 11:39:03,售后服务非常好师傅安装很到位
9673,100011323840,5,2020-06-06 18:19:54,师傅安装很细心相信美的
9674,100011323840,5,2020-06-09 14:32:09,很安装服务安装很及时师傅人很好
9675,100011323840,5,2020-06-04 19:07:16,安装师傅特别好机器也很好
9676,100011323840,5,2020-06-06 12:27:53,师傅上门安装技术好特别满意
9677,100011323840,5,2020-06-21 15:56:13,安装服务师傅已经安装完毕非常满意
9678,100011323840,5,2020-06-04 13:17:26,恒温效果很好噪音大小声音小安装服务很周到耗能情况比较低
9679,100011323840,5,2020-06-03 17:10:02,上门安装很好师傅也专业
9680,100011323840,5,2020-05-13 17:01:16,外形外观外观很好看制热也快
9681,100011323840,5,2020-06-29 12:27:47,非常不错的油烟机安装很负责
9682,100011323840,5,2020-06-07 14:50:53,非常好师傅安装专业态度很好
9683,100011323840,5,2020-06-19 17:53:39,买到家了还没安装看着很高大上很不错买的很便宜
9684,100011323840,5,2020-04-26 15:17:02,服务非常好以为我房子还没装好所以和安装协调了一下等装修好了他们会上门安装服务很周到
9685,100011323840,5,2020-05-20 18:10:39,现在房子才在装修安装师傅已经安装好了要等到入住的时候还要过来是调试服务很到位
9686,100011323840,5,2020-04-12 14:56:30,安装师傅很专业安装很漂亮
9687,100011323840,5,2020-06-08 11:26:34,安装非常仔细及时
9688,100011323840,5,2020-03-26 15:33:52,安装服务安装满意师傅走气路水路设计合理服务态度很好
9689,100011323840,5,2020-07-02 16:40:04,外形外观再换还可以安装服务安装很满意出水速度家里面积小出水很快
9690,100011323840,5,2020-06-21 20:19:54,外形外观非常漂亮的一款热水器款式尊贵大方恒温效果恒温效果好安装服务安装服务专业快捷很为客户着想美的国货大品牌信得过之前只在京东购买日用品家电等还是选择了门店这两年渐渐大件的家电也都开始从京东选购物流迅速价格碰到活动格外美丽
9691,100011323840,5,2020-06-06 14:39:51,挺好安装师傅很专业满意
9692,100011323840,5,2020-05-14 11:19:17,京东服务一直很好这几天不在家送货小哥帮忙搬运到家里了服务热情细心非常满意回去后约时间安装
9693,100011323840,5,2020-06-25 11:01:44,安装服务完美安装师傅绝对
9694,100011323840,5,2020-06-27 14:54:34,安装服务不错点赞很可以
9695,100011323840,5,2020-04-17 18:22:32,安装服务安装得非常好看安装师傅很热情还帮搞好了卫生很棒
9696,100011323840,5,2020-06-20 16:37:57,安装服务安装师傅安装的很好服务到位外观大气上档次
9697,100011323840,5,2020-06-10 17:39:55,货已收到送货速度很快占时还没有安装装好后再追评
9698,100011323840,5,2020-06-03 10:36:03,安装服务安装师傅特别好注意事项全都讲明白了很热心
9699,100011323840,5,2020-06-18 09:06:19,东西已收到客服服务态度很好很满意的一次购物快递小哥哥太给力了下单没几个小时已经送货上门可服务态度太好了（本人不在家所以想拍个视频图片都没办法拍）
9700,100011323840,5,2020-05-11 13:10:09,商品质量非常好安装师傅技术很好服务很周到
9701,100011323840,5,2020-07-01 13:17:23,安装服务安装及时师傅服务态度好安装很满意外形外观外观设计美观大方恒温效果零冷水的用起来方便
9702,100011323840,5,2020-06-06 12:08:12,很好迟点时间再安装
9703,100011323840,5,2020-06-18 18:39:15,也太快了618晚上下单下午送到明天上门安装美的质量值得信赖
9704,100011323840,5,2020-06-21 09:10:29,外形外观简单大气噪音大小可以接受出水速度水流顺畅安装服务服务周到618买的当天就送到了速度还是很快的第二天就上门安装了安装师傅态度很好服务很周到东西很漂亮很喜欢家里还没通气使用完在过来追评
9705,100011323840,5,2020-07-04 19:49:01,好安装师傅态度很好
9706,100011323840,5,2020-05-29 16:16:06,安装服务非常好很细心
9707,100011323840,5,2020-06-02 12:53:55,快递已送到1号夜里下单第二天上午就到简直神速还没安装等待周末装了再说
9708,100011323840,5,2020-06-08 20:29:41,家人看着装的安装人员很热心还没看到实物后期用了再来追评安装服务五星
9709,100011323840,5,2020-06-04 16:56:13,安装服务安装师傅很耐心很专业很棒推荐
9710,100011323840,5,2020-06-20 09:23:56,物流超快啊隔天就到非常满意还没有安装美的大牌子应该不错的
9711,100011323840,5,2020-07-06 13:23:38,快递小哥很给力衣着整洁速度很快也很贴心
9712,100011323840,5,2020-06-19 14:34:30,京东服务很好送货快配送员态度好服务周到家里还在装修先囤货
9713,100011323840,5,2020-04-12 07:56:27,外观大气上档次零冷水功能很不错
9714,100011323840,5,2020-06-28 10:41:18,安装服务安装完成安装免费师傅非常专业外形外观好
9715,100011323840,5,2020-06-02 13:27:34,安装服务安装很快各方面询问比较细服务态度很好
9716,100011323840,5,2020-06-28 13:26:17,安装很好服务不错比预约时间提前了不少
9717,100011323840,5,2020-06-21 13:38:36,噪音大小声音很小比之前用的小多了安装服务安装很不错
9718,100011323840,5,2020-04-24 08:57:20,外观大方出水快安装师傅很到位
9719,100011323840,5,2020-05-24 18:01:04,物流配送员超好安装师傅很认真负责安装很专业服务态度超棒
9720,100011323840,5,2020-04-24 08:00:40,美的大品牌值得信赖安装师傅很专业配件都免费超值
9721,100011323840,5,2020-06-03 10:43:17,安装服务安装师傅非常细心安装的非常到位我非常满意宝贝外观看上去很漂亮
9722,100011323840,5,2020-06-14 15:17:10,刚收到宝贝整体包装和送货速度都是很快的现在还没有安装等安装使用过后在来追加评论
9723,100011323840,5,2020-06-09 17:47:34,新房子装修看到很多人推荐所以赶紧入手了客服还会主动打电话确认收货和安装时间快递小哥也会主动提前咨询并且送到家服务很周到
9724,100011323840,5,2020-04-28 16:19:25,商品已收到送货安装非常及时送货人员送货上门安装师傅讲解使用方法下次购物还上京东
9725,100011323840,5,2020-06-17 16:18:08,新家装修买的安装上了还没用不知道怎么样呢安装师傅很负责还教我怎么使用态度很好
9726,100011323840,5,2020-06-23 14:13:35,零冷水非常喜欢既节能又来得快
9727,100011323840,5,2020-06-27 11:04:29,恒温效果效果很好外形外观外观漂亮安装服务服务也很好解决问题非常及时
9728,100011323840,5,2020-06-03 14:36:21,外形外观很好恒温效果很好安装服务好
9729,100011323840,5,2020-06-21 17:24:01,外形外观时尚恒温效果恒温很好噪音大小噪音小出水速度出水快安装服务专业
9730,100011323840,5,2020-06-21 19:18:51,外形外观外观很好看安装服务安装师傅第一时间联系安装服务很不错
9731,100011323840,5,2020-05-05 22:10:37,噪音大小噪音很小安装服务服务很好出水速度很快
9732,100011323840,5,2020-06-19 10:44:12,安装服务安装师傅很仔细服务非常满意大品品牌值得信任
9734,100011323840,5,2020-06-29 12:31:48,安装师傅速度快非常满意如果卖家把承诺给我的赠品给我就好了
9735,100011323840,5,2020-06-12 16:19:40,物流很给力售后师傅安装及时服务态度超级好很满意的购物体验
9736,100011323840,5,2020-06-23 14:59:37,东西很好安装也很给力
9737,100011323840,5,2020-06-03 10:34:42,宝贝已收到物流配送服务都很给力还没安装其他待安装好了再评价吧
9738,100011323840,5,2020-06-26 14:48:25,安装满意热水器很好师傅细心安装
9739,100011323840,5,2020-07-05 09:12:45,朋友315买的看到颜值很高我就买了实物确实很棒还没安装用后追评
9740,100011323840,5,2020-06-09 22:30:09,安装服务很好师傅很认真负责赞还没用不过相信美的大品牌
9741,100011323840,5,2020-05-27 14:36:42,安装服务安装师傅很好热水器也很好
9742,100011323840,5,2020-07-04 22:26:38,安装服务师傅装的很不错很有耐心装完几天以后有咨询他他很细心的解答
9743,100011323840,5,2020-04-20 20:11:25,外形外观挺好看的目前还没有使用等用了再评安装服务安装师傅很有耐心很认真
9744,100011323840,5,2020-06-06 11:56:00,热水器很不错性价比高安装人员也很好
9745,100011323840,5,2020-05-28 15:50:56,送货速度很快直接送进家里快递员很尽责还没装等装来再来追评了
9746,100011323840,5,2020-05-19 11:21:15,安装服务安装师傅很好外形外观外观挺好看的出水速度出水速度很快零冷水很好
9747,100011323840,5,2020-07-02 15:17:57,快递速度快包装完好安装师傅非常认真负责态度非常好
9748,100011323840,5,2020-06-22 12:46:47,外形外观最满意的一次购物外观和性能都非常棒
9749,100011323840,5,2020-04-25 16:32:29,安装服务速度快技术好非常满意
9750,100011323840,5,2020-06-01 04:49:36,买的土豪金美观安装师傅服务好很有耐心
9751,100011323840,5,2020-06-27 21:23:25,外形外观漂亮恒温效果还没有使用后期追加噪音大小适中安装服务师傅很耐心
9752,100011323840,5,2020-06-29 11:13:14,外形外观外形好看恒温效果还没有使用用后追评安装服务安装师傅很热情
9753,100011323840,5,2020-06-13 18:15:38,安装师傅服务很好很满意下雨天还赶过来安装好
9754,100011323840,5,2020-06-20 13:36:24,安装师傅安装的很到位非常棒下次有需要了就介绍这家
9755,100011323840,5,2020-03-20 17:46:49,安装服务非常好师傅帮忙把其他管道都一起处理了很给力
9756,100011323840,5,2020-03-10 18:26:50,安装师父很认真很仔细然后也帮忙介绍使用关注要点很赞
9757,100011323840,5,2020-05-08 11:22:56,外形外观漂亮恒温效果不错噪音大小很小出水速度很稳定安装服务技能熟练耗能情况还不知道怎么样
9758,100011323840,5,2020-06-03 09:41:58,师傅态度很好美的热水器大品牌值得信赖一直信赖京东
9759,100011323840,5,2020-06-27 18:24:25,外形外观很好看恒温效果很好出水速度大噪音大小小
9760,100011323840,5,2020-04-06 18:20:47,安装好评师傅很耐心的讲解热水器功能帮忙app连接热水器
9761,100011323840,5,2020-07-10 06:21:18,美的真的很不错性价比高颜值也很给力新房子装修看了很多以前一直纠结买电热水器还是燃气热水器最后还是选择这款零冷水的美的燃气热水器东西收到了特别惊喜包装完美机子很大气金属面板美的安装师傅也特别给力中午送货下午师傅就来安装的半个小时搞定专业的事交给专业的人没错朋友们可以下手放心买买
9762,100011323840,5,2020-07-09 13:45:21,物流很快安装师傅很用心有需要还会在来买的
9763,100011323840,5,2020-04-27 13:59:45,产品高大上物流配送快很好
9764,100011323840,5,2020-05-18 11:10:36,物品收到物流很给力还没安装用了再追加评论
9765,100011323840,5,2020-05-30 14:19:23,安装服务安装师傅服务特别好感谢安装师傅你辛苦了
9766,100011323840,5,2020-06-29 18:37:46,上海美的安装师傅非常仔细认真也没收取任何费用
9767,100011323840,5,2020-06-11 17:56:28,安装师傅很专业安装安装熟练服务周到
9768,100011323840,5,2020-06-04 12:10:40,安装服务很好服务很好师傅很专业很细心
9769,100011323840,5,2020-06-12 20:59:31,安装服务服务到位安装师傅也很用心老乡就是好点赞
9770,100011323840,5,2020-07-10 09:45:35,已经安装成功安装师傅很专业服务态度也很好点赞
9771,100011323840,5,2020-06-22 11:09:24,安装服务安装满意小哥哥太有耐心了一一给我说明怎么使用
9772,100011323840,5,2020-06-19 14:36:07,这次购物体验太好了各种省爱死京东了
9773,100011323840,5,2020-04-14 15:14:05,安装上了非常高端大气上档次大爱
9774,100011323840,5,2020-05-22 17:24:55,发货快安装快效果好安装师傅非常细致认真
9775,100011323840,5,2020-03-21 13:22:55,非常满意出热水快声音小
9776,100011323840,5,2020-06-02 14:34:51,安装师傅上门及时态度很好hellip
9777,100011323840,5,2020-06-03 22:42:11,安装师傅服务很到位很贴心公司要多多嘉奖奖金
