id,product_id,score,comment_time,comment
12789,6723160,5,2018-08-18 15:03:42,售后安装师傅服务超级棒物流快机子美丽打方安装0收费活动机型给力送辅材
12790,6723160,5,2018-12-25 23:44:08,热水器用着挺方便的而且燃气的还挺节能的已经用了一个多月了非常适合小家庭使用好评
12791,6723160,5,2019-03-25 20:59:50,东西买回来了一直在用美的的电器热水器感觉不错装上以后非常大方比较美观售后服务非常到位师傅很专业本来有配件需要我们多花钱但师傅替我们考虑用自己的技术解决了问题非常不错谢谢希望越来越好
12792,6723160,5,2020-05-05 16:13:31,首先物流就特别赞热水器当天买的第二天就送到了神速货品外观精美大方具体使用效果如何现在还不知道因为买去新房子用得目前还没有入住安装方面呢就有点乱了因为我买的收货地址和安装地址不一样我自己又预约了师傅然后呢京东又给我自主约了师傅搞的我一天接了好几个安装的电话安装当天小师傅挺好的还提前到了等我了一下安装速度也很快谢谢了
12793,6723160,5,2019-01-01 12:27:16,上门安装师傅安装很好安装师傅很细心安好后教我怎样使用怎样放水东西更好用温度调好后也不会忽冷忽热
12794,6723160,5,2020-03-15 14:46:59,外形外观外形外观美观大方值得拥有恒温效果横纹效果良好需要使用一段时间之后才能知道使用的稳定性噪音大小声音不大可以接受出水速度出水效果良好没有异常安装服务安装师傅态度很好对我们的疑问都给予专业指导耗能情况耗能方面得有待一段时间观察才方便评论
12795,6723160,5,2019-02-23 15:13:58,京东物流速度快货到了还安排师傅安装热水器价格也很实惠最重要是16L够大一直相信大品牌质量售后都不错其他电器产品也会考虑美的产品希望值得信赖hellip
12796,6723160,5,2018-11-26 23:09:34,家里的热水器坏了网上对比了很多最后选了这款赶上活动价格的时候赶紧买了选了配送时间后开打电话与我核实送货前又打电话核实服务很好快递师傅给送到楼上放到厨房里安装比较顺利用了两天了有不明白的客服能给解答挺满意的
12797,6723160,5,2020-05-28 11:31:31,京东已经买了很多电器第一次在网上买热水器配件不齐需要自理很多配件费用这是很头痛的本来买了设备肯定是需要配件齐全不然买来干嘛呢安装小哥哥服务很好
12798,6723160,5,2018-08-10 09:32:13,物流很快安装师傅也很负责热水来的很快这个热水器真心不错
12799,6723160,5,2018-10-13 20:42:59,下单后送货师傅及时送货安装师傅水平高超服务周到使用后热水出水快出水稳定很满意德一次购物
12800,6723160,5,2018-08-20 13:23:08,首先颜值满分高贵优雅金色也很有质感送货上门再预约安装很方便手机上搞搞就行了不用去店里也很省事
12801,6723160,5,2019-11-24 18:32:33,恒温效果特别完美安装服务安装师傅特别好收费明确安装完又特意给擦擦完美
12802,6723160,5,2019-12-19 09:35:33,美的燃气热水器装上特意用几天再来评价外观高端大气上档次安装师傅挺不错工作认真整机保修8年比较放心点赞
12803,6723160,5,2019-04-11 17:08:25,产品不错外观很漂亮安装师傅也很有责任心目前还没有通气过段时间师傅说来接气调试客服也很热情期待后面实际使用过程中的表现
12804,6723160,5,2019-11-12 14:08:22,下单第二天都送来了包装也很好今天联系了师傅来安装安装速度也挺快热水器颜色外观我也挺喜欢物美价廉值得购买
12805,6723160,5,2019-11-18 12:25:25,外形外观外观时尚靓丽恒温效果效果很好出水速度快安装服务好很好噪音大小没有
12806,6723160,5,2018-10-05 17:51:37,美的的热水器很好质量很好配送很快三天就送到了送货上门安装也很快预约好时间按时间上门态度很好材料费不超过200家里天然气需要燃气公司安装过几天接上气就能用了应该很好用
12807,6723160,5,2019-04-09 14:59:26,昨天买的今天就到货安装了京东的速度真快东西是正品也很满意安装师傅装的很认真也很热情美的大品牌值得信赖
12808,6723160,5,2019-11-12 11:46:42,热水器已经安装好高端大气功能齐全16升大容量三室两厅都能用水京东快递速度7小时到家包安装不超过24小时为商家和京东点赞值得购买
12809,6723160,5,2018-10-27 18:41:12,机器到了外观简约大方触屏的功能齐全安装师傅很专业服务态度好总之很愉快的一次购物
12810,6723160,5,2018-11-20 22:16:04,京东自营店发货速度就是快下单也快下单后就有售后人员预约送货时间和安装时间这款热水器外观漂亮大气性能方面16L完全满足家里日常用热水量这次在京东自营店购买非常满意
12811,6723160,5,2019-03-27 10:09:46,真的很不错好看时尚大气用着感觉不错很喜欢下次还会光顾得朋友有需要的话我也会强烈推荐这款燃气热水器因为这款热水器物美价廉
12812,6723160,5,2019-04-06 15:22:49,物流挺快当天下单第二天就收到货快递哥也很负责产品包装不错安装师傅服务态度挺好手法也很熟练装完之后全部测试测试了一遍都没问题总体感觉还不错挺喜欢
12813,6723160,5,2020-05-18 11:07:14,已安装安装师傅技术挺好服务态度很棒技术过关
12814,6723160,5,2019-02-16 18:09:55,第一次在京东购买电器类产品送货速度快客服态度很好有不懂的随问随答家里人就认美的品牌老牌子值得信赖16升的热水器足够一家人使用
12815,6723160,5,2018-10-15 16:49:47,很好外观大气预约快上门安装服务和宣传的是一样的这个超划算
12816,6723160,5,2019-02-10 18:53:55,老家在镇上京东物流不仅送到乡镇上而且过年期间也送货物流特别给力以前都喜欢在买东西现在越来越喜欢在京东买了过年期间红包也送很多的五福积了那么久还不如京东送的红包和京豆热水器很好用安装也安排的很快以前的旧热水器送给安装师傅了
12817,6723160,5,2019-08-10 15:47:34,比想象要好热水很快没有忽冷忽热可以调好最高温度孩子自己洗澡也放心了
12818,6723160,5,2018-08-10 16:47:47,第一次在京东买电器8号下单9号到10号安装这流程真的很赞安装师傅不错热水器很漂亮款式大气16升大容量这下两个卫生间都用热水都不怕了
12819,6723160,5,2019-02-21 20:29:14,非常不错的机器物流快服务好特别是安装师傅经验丰富还收拾卫生自带鞋套热水器出水快水量大比原来的即热的热水器和太阳能的热水器好用多了推荐购买值得信赖相信美的
12820,6723160,5,2018-12-02 21:36:05,热水器很好比实体店便宜很多款式也很好看跟实体店看的款式一样的16l足够用了送货超级快售后也还不错挺满意的一直信任美的的牌子家里电器大部分都是美的的
12821,6723160,5,2019-09-01 12:56:09,热水器已经安装好了试用了一下出热水很快热水器外观也比较时尚能衬得起任何装修风格价格也很合适值得入手
12822,6723160,5,2019-12-06 12:42:56,外形外观颜色很漂亮恒温效果很不错噪音大小不大出水速度比较快安装服务非常好耗能情况节省型
12823,6723160,5,2019-03-10 19:33:55,第一次买美的的热水器外观很漂亮质感也非常棒安装师傅非常辛苦相信大品牌物流就更不用说了第二天就到了性价比也很高值得推荐以后买电器还会选美的
12824,6723160,5,2019-01-16 19:01:00,用了一段时间了很好用出热水很快也不会有那种一会凉一会热的感觉总之很满意很好用
12825,6723160,5,2019-07-02 09:42:53,热水比较快升水可以设置温度可以自动调节都说便宜没好货这是物美价廉
12826,6723160,5,2018-12-28 13:08:51,很好的一次购物物流快安装快服务好质量也很好刚安装上热水就出来了京东购物放心
12827,6723160,5,2018-11-17 21:58:36,旧的杂牌热水器用了不到一年就坏了在大品牌中徘徊了好久最终还是选择了美的款式漂亮大气快递员很给力那么重直接给搬上楼态度特别好比预期的早到一天美的值得信赖
12828,6723160,5,2018-11-27 14:52:32,热水器看了好久下单双十一挺优惠看起来也高大上买给爸妈用的爸妈很喜欢用起来也很方便安装师傅服务好
12829,6723160,5,2020-02-29 16:34:28,恒温效果很好外形外观是我想要的效果噪音大小能接受出水速度快安装服务良好耗能情况良好
12830,6723160,5,2018-12-25 17:53:17,美的这款热水器很好冬天用水温稳定有厨房用模式设置非常方便也有智能模式安装的师傅我很好物管帮忙开门就一直安装等到我来元安装活动也很给力新房安装只付了热水器的燃气管钱很划算
12831,6723160,5,2019-06-03 09:29:05,这款热水器颜色比较耐脏发货速度很快售后安装人员服务很好触摸屏的显得更加高大上使用起来也比较方便一直比较信赖美的产品期待等待过段正式适用的效果
12832,6723160,5,2019-03-15 21:42:47,LED的触控显示屏特别有质感触摸时手感也很舒服调节时很灵敏操作简单老年人也能上手快字体清晰看得非常清楚底部有出水口燃气口进水口标的很清楚降低了安装的难度节能环保是这款燃气热水器最主要的也是最重要的特点
12833,6723160,5,2019-02-28 15:59:44,促销购买的便宜了不少对比了你家最后还是选择美的京东送货很快第二天就到安装师傅第二天就到很快安装过程很愉快没有买错推荐大家购买哦
12834,6723160,5,2018-08-21 07:15:21,特意用了几天用很小的水压可以打开现在设置的水温比以前买的宽多了响应也比较快一如既往的支持美的看着也美观很好的产品
12835,6723160,5,2018-08-13 19:50:24,一直信赖京东物流快服务售后都非常好也是美的的忠实粉丝金色的外观非常的漂亮安装师傅也很细心检查仔细安装仔细会一直支持京东
12836,6723160,5,2018-10-14 11:22:05,京东送货真是快啊前一天晚上买的第二天就到了包装真的很好预约安装工作人员也很上心很认真很快外观很高大上
12837,6723160,5,2019-10-12 14:59:23,外形外观外观挺大器的颜色是我喜欢的颜色京东物流也特别快下单第二天就收到货安装师傅态度特别好吧安装的也很好总之是一次愉快的购物相信京东家用电器基本都是在京东上买的
12838,6723160,5,2018-11-21 21:46:16,物流很给力速度很快双11前凌晨下单上午10点多就到了满满的惊喜要安装给美的售后服务部早上打电话很快就安排师傅来了很快安装师傅就到了安装师傅动作很熟练很快就安装好了还跟我讲了热水器的使用方法和注意事项服务很周到整机淡金色的外观很漂亮和宣传图片一样功能也齐全容量大最主要的是安全以后洗澡可以放心了
12839,6723160,5,2019-07-17 11:47:54,外观金色大气很有质感出水快师傅手艺好
12840,6723160,5,2019-05-28 11:01:24,京东的效率就是快每次都是下单后第二天就配送前段时间自己家买了一个现在又给妈妈家买了一个确实不错我一直是美的的忠实粉丝外观大气上档次质量也是非常的好值得信赖的品牌
12841,6723160,5,2019-01-06 11:09:49,热水器很漂亮16升足够用了声音不大制热效果好
12842,6723160,5,2019-08-01 23:38:12,之前听说林内的热水器最好但是对比下来觉得价格实在太贵了所以就买了美的结果也很好用的特别是安装师傅也很耐心之前是我老公指挥所以按的不太好就让师傅上门来重新安了一次还是免费的有一次我无意见把插头下来了怎么都没有热水检查下来发现是没有插电一插上去很快就来水了所以我觉得这个热水器真的性价比还是蛮高的
12843,6723160,5,2018-10-11 14:13:42,新房子装修还没有通燃气还看不出效果以后在追评值得说的就是京东自营的发货速度就是快头一天下单第二天就到了安装也是很给力货还没到就来电预约安装安装师傅非常认真专业态度也很好热水器外观漂亮大气大屏显示高大上16升水量虽然还没有用但已能想象的到肯定会很给力的
12844,6723160,5,2019-07-07 11:57:13,师傅挺好很快就装好试用水热的很快安装费300多
12845,6723160,5,2019-12-25 23:03:25,外形外观外观美观大气简洁大方挺养眼恒温效果开机就有热水冷暖适中随意调整舒适合理噪音大小基本没噪音声音小出水速度出水速度快捷安装服务安装师傅很棒耐心解答所遇到的问题和提示需注意事项美的服务就是好耗能情况目前还未知等用过一段时间后再评价整体五星级推荐活动优惠购买值得推荐
12846,6723160,5,2018-08-16 15:30:11,热水器产品收到了京东快递送货非常快安装师傅非常专业客服态度很好热水器装上后看上去高大上美的一直是我信赖的品牌
12848,6723160,5,2019-06-29 17:06:41,这款热水器产品质量非常好性价比非常高安装速度很快第一天买第二天就来安装了有什么问题客服人员直接解答服务比较满意物流发货速度比较快安装比较标准元免安装
12849,6723160,5,2019-11-14 12:09:24,外形外观很美观恒温效果热水来的很快噪音大小非常小安装服务安装小伙很热情出水速度很快
12850,6723160,5,2019-08-24 12:37:13,美的热水器非常大气漂亮耐脏材质用料好送货也及时安装师傅热情没有乱收费LED的触控显示屏特别有质感调节时很灵敏操作简单老年人也能上手快字帖清晰看的非常清楚节能环保是这款热水器最主要的也是最重要的特点
12851,6723160,5,2019-07-04 20:06:40,感觉还是很不错的出热水非常的快非常值得推荐送的东西也是很多的以后要买肯定还是这一家最主要的是耗电也是不多的推荐购买性价比非常的高
12852,6723160,5,2019-08-20 15:02:34,这是家里买的第三台美的热水器了质量一如既往的好前两台是给岳母家买的京东质量有保障物流快第一天下午三点下单第二天早上八点就收到了下午安装师傅就来给装上了安装师傅干活工作整洁走时把垃圾还给清理了给师傅五星好评
12853,6723160,5,2019-08-13 10:42:11,送货快热水器颜值高师傅安装细致服务周到安完试了试出水量大恒温没有一会热一会冷的情况家人都很喜欢
12854,6723160,5,2019-11-15 20:55:43,外形外观外观非常漂亮双十一购买的送货速度快安装服务安装也非常有耐心预约了师傅很快就到家安装总的来说美的的产品价格实惠质量有保证
12855,6723160,5,2019-12-14 21:40:26,外形外观好看恒温效果稳定噪音大小不大出水速度匀速安装服务很好耗能情况节能环保
12856,6723160,5,2018-08-16 20:54:57,原来家里的热水器供水忽冷忽热果断在京东挑选了这款颜值高性能好的小美头天下单第二天到货安装一气呵成特别谢谢安装师傅人热情技术也好认真仔细给我讲解用法真的是服务特别棒hellip
12857,6723160,5,2020-07-02 22:27:54,外形外观高档大气恒温效果非常好噪音大小无出水速度快安装服务到位耗能情况节能
12858,6723160,5,2018-09-30 16:29:14,一直很信任美的安装师傅也很有责任心这个热水器不仅外观漂亮质量也是相当不错家里的家电都买的美的反正就是很高大上有需求的赶紧下单吧别等了这个价格也是非常美丽的而且免费安装没有收取一分钱喜欢喜欢赶紧下单
12859,6723160,5,2019-11-29 16:08:06,不错客服态度很好产品质量很好值得购买推荐购买
12860,6723160,5,2019-04-07 11:11:49,很棒的热水器金色看起来很上档次京东物流很快安装师傅第二天来安装很用心对比了一下价目表价格也按照表上的收取总之很棒的一次购物体验
12861,6723160,5,2019-04-10 19:02:29,送货很准时当天就有师傅联系安装了服务很到位第二天师傅上门穿着工服佩戴工牌比较正规热水器用了几天温度恒定质量不错信任美的大品牌
12862,6723160,5,2020-05-30 08:04:21,外形外观挺好看的金色大气恒温效果即开即洗自己控制噪音大小基本没有出水速度很快安装服务安装师傅不会乱收费耗能情况总体来说不是很耗电也很直天然气特别方便用了那么久完全没有问题
12863,6723160,5,2018-12-25 14:24:29,热水器真的物美价廉特意用了才来评价声音小热水快发货也不慢安装师傅上门安装态度也好热水器的外观也高大上
12864,6723160,5,2020-07-04 10:10:34,质量很好噪音很小超赞送货师傅服务热情安装师傅服务热情态度很好赞赞出水速度出水很快没有产生忽冷忽热的现象赞
12865,6723160,5,2020-01-01 19:00:19,双十一买的外观非常好看非常好用物超所值啊噪音也很小喜欢给卖家笔芯-
12866,6723160,5,2018-11-18 21:54:21,实物比较美观大气安装师傅很热情出了两条管的钱如果买这款建议提前买好进水管和出水管的波纹管方便安装时使用hellip燃气口需要燃气公司接
12867,6723160,5,2019-04-24 16:09:14,物流速度快装上外观美观大气还没正式用有试了一下感觉水热的挺快的操作简单家里老人也会调一键次厨房洗很不错希望一直好用
12868,6723160,5,2018-10-21 16:28:07,昨天下午下单今天上午就到货了下午就来人免费安装好了一个字快二个字真快三个字特别快龙头一打开热水就出来爽啊
12869,6723160,5,2018-11-20 09:26:33,很满意的一次购物京东快递发货快早就收到货了只是自己忙一直没时间这次京东上门安装服务态度也很好着制式服装态度很好工作很专业安装很好教我们怎么调试设备特意嘱咐售后联系电话很满意的一次购物
12870,6723160,5,2018-09-17 15:45:11,到货很快实物很好安装专业使用方便水量很大都有热水
12871,6723160,5,2018-06-02 22:34:01,首先要说送货真的很快6月1日凌晨下单1号当天收到货2号中午过来安装京东物流速度产品看起来还不错颜色很大气喜欢电子显示屏幕很好看目前还没用等用了再来追加评论
12872,6723160,5,2019-04-02 16:15:49,从下单到收货都非常方便快捷送货和安装师傅态度都很好热水器外观好看外挂也没有大的声音出热水快值得购买
12873,6723160,5,2019-04-04 14:29:16,很不错的热水器挺美观的时尚大气安装师傅特别好
12874,6723160,5,2020-06-20 13:52:33,机器已经安装好了很好看大气上档次安装师傅服务也很好很专业
12875,6723160,5,2020-04-03 08:10:52,我第二次购买这款产品了美的品质及售后加上京东自营的服务完美五星好评安装好后洗了个澡感觉很舒服水温非常稳定
12876,6723160,5,2018-10-13 10:56:02,热水器看上去很好安装师傅也很专业负责燃气还没开通需要后续再看总体满意
12877,6723160,5,2019-01-28 19:54:48,热水器很不错热水来得比较快温度也很稳定值得拥有昨晚下的单现在就安好了
12878,6723160,5,2018-06-13 18:02:48,新装修的还没有通燃气通了燃气会来追加评价安装师傅很给力让公公很开心给燃气打眼要自己找人打16升的要打7CM的眼打眼的时候要测量好燃气管道和热水器和烟道之间的距离要不打错了得改我家就是好尴尬
12879,6723160,5,2018-09-30 23:04:52,京东的物流速度非常快宝贝今天上午收到了下午师傅就来安装了太给力了美的服务非常好机子很漂亮装上后看着很大气有档次美的电器值得信赖
12880,6723160,5,2019-12-15 11:35:03,东西还不错双十一买的很优惠包装也可以最近才装修美的的师傅过来给我安装好了跟家里也很搭哈哈哈以后还会继续购买美的
12881,6723160,5,2019-04-09 11:35:45,安装师傅细节做的很到位进门这套地垫等等该有的都有机子也不错噪音小一直喜欢用美的没原因
12882,6723160,5,2019-03-07 22:32:43,哈哈当天晚上12点下单的中午就收到了速度没话说收到后感觉不错期待使用外观也高端大气上档次颜色很漂亮希望使用效果和外观一样好
12883,6723160,5,2018-08-14 16:29:37,热水器很好价廉物美这下厨房卫生间都可以同时使用热水了很赞安装师傅也非常细心到位很满意
12884,6723160,5,2018-10-20 13:19:48,商品颜值高很喜欢各项功能很强大适合大家庭使用还可以调节容量安装师傅服务很好
12885,6723160,5,2018-06-20 10:25:56,质量很好热水快点火声音也不大物流也快安装师傅认真仔细态度很好
12886,6723160,5,2018-09-14 10:44:26,安装非常完美师傅手艺不错很细心热水器也很高大上燃气还没接等通气后使用了追评
12887,6723160,5,2019-03-28 15:21:24,美的热水器京东物流物流迅速安装到位安装人员也很耐心东西很好
12888,6723160,5,2019-09-12 09:53:52,非常高大上整体大方美观不愧美的用起来超方便
12889,6723160,5,2019-03-08 22:00:39,物流很快安装完试用了一下水热的很快质量很好没有噪音安装服务也不错物有所值值得购买
12890,6723160,5,2018-10-06 12:46:25,发货很快安装也很快热水器很好看功能挺齐全的试了一下出热水速度很快同时开了两个花洒水还是很热
12891,6723160,5,2019-05-20 10:20:37,又在美的家购买了热水器家里的电器都是美的价格实惠质量又好用安全性也非常高外观也很上档次新房子安装好了就等搬迁进去享受了
12892,6723160,5,2019-12-09 11:46:54,外形外观触摸屏安逸恒温效果三档变升噪音大小小出水速度很快安装服务师傅态度服务非常满意耗能情况节能
12893,6723160,5,2019-11-08 16:30:09,好很好非常好热水很快安装很快_
12894,6723160,5,2020-06-18 14:19:21,外形外观外观还不多呢还没有用送货很快快递小哥还不错说是安装在和官方预约就可以了就是等着装修好在安装我们家的家电都是在京东上买的一直很信赖它赠送的礼物也超级不错真的还挺不错吹风机都是必备用的刚好不用再买了谢谢老板
12895,6723160,5,2019-05-22 18:15:47,很愉快的购物体验下单后发货很快京东自营仓库巨给力啊安装的小哥很负责装修公司疏忽忘了打孔安装小哥很细心的把吊顶掀起来打好孔再恢复原状因为我人在外地安装小哥把材料清单和说明书保修卡给我放好并拍图给我赞
12896,6723160,5,2020-01-15 21:28:43,安装很好包装完好安装也很快东西不错一直用京东很好
12897,6723160,5,2019-02-27 18:11:56,很好的一次购物体验刚好元宵节减价整整一千哇厉害啦用着还行安装售后也很负责总之都还很不错样子不错颜色不错一分价钱一分货不错不错这是真的很不错哈哈
12898,6723160,5,2018-10-17 13:08:59,所有电器都在京东买的还都是美的的客服也很耐心讲解推荐第一次买成电热水器了还能上门取件换真心不错之后马上换成燃气的怕自己弄不清楚还问了客服很多下单就有收到电话说什么时候货会到什么时候安装这样就不用在家等着
12899,6723160,5,2019-12-22 15:20:27,京东商城值得拥有物美价廉美的大品牌外观圆润手感细腻性能强劲
12900,6723160,5,2018-11-16 13:04:39,很好服务周到师傅安装的很好使用过了都很好外观很好看总之一切都很好
12901,6723160,5,2020-06-04 17:04:14,师傅服务态度很好技术好一会安装完了没有乱收费的现象燃气还没开通开通后再试一下
12902,6723160,5,2018-10-16 19:35:39,安装我是很满意的师傅预约安装都很准时很专业工作服鞋套工牌都有～而且尽心尽力费用方面中间有点小插曲可能是我理解不正确大牌子美的洗碗机洗衣机热水器等等全部美的原来生活可以更美的～
12903,6723160,5,2018-04-28 15:28:57,价格高一点的东西东西质量确实很好做工很精致安装的师傅也很认真现在还没通水没有试过试过以后再补评
12904,6723160,5,2018-10-08 12:50:05,京东物流送货快第二天就来安装了安装安装师傅水平也很高楼上楼下都可以同时供热水美的热水器质量确实很好工作起来声音也不大一件启动厨房供热水很好用很方便
12905,6723160,5,2019-04-03 18:06:32,美的的燃气热水器真好非常非常的好家里人都喜欢外观漂亮质量非常好水温恒定出水快噪音小非常好的选择
12906,6723160,5,2018-09-14 11:39:32,送货速度快隔天就送到家了报装也非常快速方便安装师傅也很好安装专业快捷没有乱七八糟的费用临走还把垃圾都收拾干净了热水器装好了之后看起来非常不错整体很美观师傅在安装好之后进行了试机操作以后还会来复购的
12907,6723160,5,2020-05-02 07:56:14,老公在家的时候师傅来安装的他说质量很好安装师傅做工也很细很负责很满意值得购买
12908,6723160,5,2018-06-02 17:41:05,家里一直使用美的的产品冰箱洗衣机空调热水器原来有款12升用着感觉非常不错所以新房子依然选择美的热水器保修8年让人很省心不用担心出问题维修费用了安装师傅态度各方面都非常满意机器也非常漂亮设计功能合理
12909,6723160,5,2019-12-29 12:10:00,外形外观很漂亮大气上档次恒温效果嗯恒温效果很好噪音大小噪音很小基本上就没有出水速度也很快
