id,product_id,score,comment_time,comment
9359,100011323840,1,2020-06-01 15:25:47,噪音大小非常大噪音
9360,100011323840,1,2020-06-05 12:00:19,京东感觉完全没有客服服务客服说话模棱两可完全给不了客户任何意见人工客服也跟机器人一样
9361,100011323840,1,2020-06-10 09:21:38,一星都不想给啊这个最便宜是一零四舅元大家看看价格吧另外说送吹风机也不送垃圾美的
9362,100011323840,1,2020-04-12 10:21:20,外形外观拿到新品外边有刮花因之前有新品互换个人觉得应该换的也是二手的谨慎购买
9363,100011323840,1,2020-07-07 11:48:03,买时讲好的有赠品后来的后来客服说送完了送完了不早说窝火最讨厌言而无信联系客服了N次竟是机器人说些没用的
9364,100011323840,1,2020-05-29 10:03:17,安装服务一个破燃淋等了三天了告诉我需要自己联系就这还敢自称服务态度好客服人员也是沟通起来费劲以后在也不考虑美的hellip
9365,100011323840,1,2020-06-05 11:42:41,你们换促销换的挺溜啊上午说打七折促销我说办退货重新抢你说可以到了下午一看7折促销没了逗我玩是吗？我退了也不你们的垃圾一点不靠谱
9366,100011323840,1,2020-05-29 22:50:25,恒温效果不咋地第一次十分钟凉一下接着凉的就有点频繁安装服务安装差得不行我都忘了我是在京东买的了材料费收我650找客服客服还说收的少真比意外蛋我找干装修连工加料才二百块钱没买过美的什么东西买了之后感觉没个好东西
9367,100011323840,1,2020-06-17 22:51:15,一星都多618保价一次都没用不能申请保价以后再也不在你家买东西了
9368,100011323840,1,2020-07-08 09:27:00,安装的时候不在家让师傅直接安装的水管处理的太丑了然后再看看邻居家海尔热水器安装的颜值真的是一个天上一个地下
9369,100011323840,1,2020-06-18 10:58:51,质量真的太差了都没用过就坏了今天早上师傅说里面的电脑板坏了要修我服了买了个坏的机器真的差自己考虑吧半句假话天打雷劈早知道加钱买能率个林内了贪便宜了下次不会选择美的的产品了刚买就坏也只有你了美的
9370,100011323840,1,2020-06-17 22:57:17,差评烂货一个刚装上几天就坏了这款最好大家别买服务又差货坏了又不管京东买的最差的一款东西提醒大家千万别买
9371,100011323840,1,2020-07-01 11:52:43,差评质量差用了一个多礼拜就坏了每天洗着洗着就突然变冷水跟京东说要换货就说没货一直拖着十几天了只会一句在反馈24小时回复然后就一天天拖延让我等他们到货还骗我去退货对差价只字不提要是我不说就打算让我吃哑巴亏了
9372,100011323840,1,2020-06-23 12:40:58,说好的赠品毛都没有发现京东就是送不起东西你就不要广告搞的那么好垃圾跟客服沟通一会送一会用不送了感觉就是我就不送了你能拿我怎么样的感觉如果有零星我就给你们凭零星以后大家买东西有优惠活动最好截图不然京东不认账的认账也可以反悔的他们说了算
9373,100011323840,1,2020-04-12 13:00:33,产品质量有问题体验很差装完后才发现冷水接口处零件有裂痕漏水
9374,100011323840,1,2020-06-22 21:27:59,满满的套路和坑如果你是北方的千万不要买说好的零冷水（升级版不用回水管都可以用）结果回来用不了坑1里面的循环只能用个点循环其他的功能摆设坑2点火声音大的要死不知道的人以为有人骑摩托车在走廊玩呢坑3最坑的地方是你要用热水因为零冷水用不了你要在那放好一会儿的水出来热水终于出来了舒舒服服的洗个热水吧结果热水不能持续输出刚冲了个头冷水出来的（出来的毫无防备）而且是持续的出冷水把热水开关调最大不管用心里一万只奔腾而过坑4总不能每次洗澡上半场热水洗下半场冷水洗吧问客服有没有解决的办法这客服你问她千百遍她都懒得理你一次我hellip美的的东西能不能吗不知道到这款燃气热水器坚决不能买买了就要做好和它斗的心里准备五星差评hellip
9375,100011323840,1,2020-06-18 16:34:58,说是黄金60秒价是结果是套路我是33秒买的结果价格是没有诚信
9376,100011323840,1,2020-06-20 15:27:39,收费太贵说好的不要钱收这么多劝大家不要买垃圾
9377,100011323840,1,2020-06-18 01:00:42,刚买几天优惠了大还不给补差价我建议不要买
9378,100011323840,1,2020-07-04 14:22:36,1星给物流商品销售妥妥的套路写的下单送牙刷0点1分钟内抢购的竟然被告知赠品当天没有了直到现在还挂着下单送牙刷
9379,100011323840,1,2020-06-18 11:06:52,虚假宣传说的前30分钟83折我订单时间3分44秒不按宣传价格计算问客服说什么以实际价格为准
9380,100011323840,1,2020-06-08 22:32:13,差评做活动价格和宣传价格严重不符投诉客服也没有任何用商家
9381,100011323840,1,2020-06-05 15:35:41,产品缺配件角阀烟道还要自己买光买配件就花了元安装费还收元发票为证明显是买了热水器但是缺配件你是买也得买不买也得买的架势
9382,100011323840,1,2020-06-21 09:32:09,美的这款产品虚假宣传我是6月18号前5分钟下单只要可实际元为这我觉也没睡等到12点可恶大家看下我发的图片希望美的给个说法不然我就去找消协安装服务小伙子安装热情服务态度很好
9383,100011323840,1,2020-06-28 09:55:07,全都是套路61活动是前一分钟半价售价是优惠券下来价格也有结果只返还了750的京豆垃圾
9384,100011323840,1,2020-06-08 00:28:39,买了还不到一个月五一活动降价还没有安装想申请退货重新拍客服却说只支持七天无理由退货美的真的太坑了各位买的时候注意了
9385,100011323840,1,2020-03-19 11:45:25,耗能情况非常耗燃气一个星期元燃气费噪音大小声音非常大建议大家不要买这款我家才买一个星期耗燃气非常大就报了两次障了用电燃都不要这么多还不如买电烧的
9387,100011323840,1,2020-06-05 10:20:07,产品未用质量跟价格对应但是商家不讲信誉说送电动牙刷到结果6月2日确认说一件送完到今天6月5日改了促销信息改了优惠力度但还是有赠送电动牙刷商家是蒙人不打草稿还是怎地？建议那些左右摇摆的买家不要选这家热水器到时可能会说赠品已经送完了
9389,100011323840,5,2020-05-16 13:03:26,热水器的外形很简约恒温效果很好零冷水的打开都可以用了噪音不是很大出水速度很快安装服务态度很好
9390,100011323840,5,2020-03-13 16:39:05,产品很好看功能很全质量很好水量大美的售后速度快服务态度很好进行了现场指导收费合理疫情期间按要求带口罩
9391,100011323840,5,2020-03-19 22:23:42,外形外观挑选对比了好多家的燃气热水器最后选择了这款美观大方很满意噪音大小开机试用整体效果不错噪音小很满意出水速度安装结束后特地启动试验了一下出水速度很快满意安装服务安装工很有礼貌安装后又细心的做了漏气测试测试结果很好满意
9392,100011323840,5,2020-03-26 06:59:02,外形外观外形时尚美观又大气显示屏也大看着心里舒服虽然现在没有用但是用起来效果应该很不错很期待﹉安装服务师傅安装的很不错很有耐心预约时间提前人到现场真的很不多很守时安装的服务态度也好售后也不错下次还会购买
9393,100011323840,5,2020-05-19 09:39:13,外形外观渐变显示屏看起来很时尚很靓丽家人看了都很喜欢恒温效果相比之前家里美的的一款老型号出热水速度快多了基本没有啥凉水噪音大小正常燃气燃烧的声音能接受出水速度出水速度还可以跟水压也有一点关系安装服务安装很及时打洞和燃气管收费了总共300多点吧
9394,100011323840,5,2020-03-13 21:50:08,恒温效果非常不错现在两个厕所可以同时用水解决了以前最大用水问题两个卫生间不能同时洗澡形同虚设外形外观外观也很简洁时尚零件部件做工好年轻人喜欢安装服务服务师傅疫情期间也来安装感谢噪音大小基本没有什么噪音很强大出水速度出水也很快喜欢他们的零冷水这样在洗澡的过程中可以随时开关不会冷血宝宝全程热水这个是最满意的耗能情况能耗这个不清楚要多使用才清楚总之还是很满意促销力度也很大
9395,100011323840,5,2020-05-24 15:49:53,外形外观简约大气屏幕够大轻易恒温效果效果很好噪音大小可以接受正常出水速度快速高效安装服务快速周到基础安装不收费耗能情况符合效果
9396,100011323840,5,2020-03-10 18:00:08,外形外观外形美丽幻彩大屏幕手动操作也方便恒温效果恒温效果非常好噪音大小噪音也不大出水速度出水速度又快又大安装服务安装师傅非常负责还耐心讲解耗能情况今天刚安装起从使用的情况看更智能更节能物流也非常快前天下单昨天送达今天已使用
9397,100011323840,5,2020-06-28 21:06:11,热水器没有什么噪音热水来得快安装师傅服务态度很好也很细心把我们所有都换啦0安装费
9398,100011323840,5,2020-03-15 20:09:42,外形外观热水器非常大气上档次很喜欢的颜色恒温效果零冷水最想要的效果不用再等水热洗澡真舒服噪音大小没什么声音安装服务预约时间准时安装师傅专业负责
9399,100011323840,5,2020-05-24 15:03:03,热水器按时送到安装师傅及时到达安装他们很敬业专业技术很强操作非常闲熟服务态度非常好干的活干净利索美的热水器大品牌质量有保障声音不大热的快出水大温度调节很方便价格优惠好产品
9400,100011323840,5,2020-06-09 20:51:49,外形外观在外观很漂亮屏幕渐变效果很好噪音大小噪音不是很小跟以前区别不大出水速度出水速度挺快零冷水很好用再也不用接凉水了安装服务安装工人有点不太专业总体还行吧耗能情况很省气可以连wifi很方便价格也很实惠总体来说是一款不错的热水器
9401,100011323840,5,2020-06-06 21:23:40,外形外观外观大气看着很上档次恒温效果恒温效果很好不会忽冷忽热还是零冷水热水一开就来没有回水管也可以安装服务安装0服务费很快就安装好了服务态度很好关键自带wifi远程就能开关机调节水温非常方便体验数字化生活
9402,100011323840,5,2020-03-22 18:10:42,外形外观非常惊艳大气恒温效果水温比较稳定噪音大小噪音很小基本听不到出水速度出水速度快几秒水就热了安装服务安装师傅专业耐心耗能情况能耗比较小
9403,100011323840,5,2020-06-20 12:11:14,外形外观挺好看的安装服务安装师傅很好噪音大小还能接受比以前坏的那个风机好多了恒温效果很好出水速度很快尤其是零冷水这个功能在冬天很实用有时候突然搞忘了水关了要很久才能出热水
9404,100011323840,5,2020-06-18 15:30:56,外形还可以看起来蛮大气的618十二点下单下午两点就能装就喜欢京东自营的速度装修的师傅服务也蛮好的还送了两节免费的管子等天然气安装好了再试下效果0冷水应该不会差这个一千多是真划算物美价廉了准备这套房全买一整套美的家电的
9405,100011323840,5,2020-04-13 13:48:23,外形外观外观方方正正简单大方非常不错的一次购物安装服务安装师傅尽心尽力还教怎么使用
9406,100011323840,5,2020-03-24 13:44:20,安装服务安装小哥腿脚麻利安装完之后还给老人讲解一遍用法态度很好外形外观外形大气感觉比之前家里美的的样式好噪音方面也小一些
9407,100011323840,5,2020-03-09 11:48:35,外形外观外观漂亮显示界面很吸引目光紫光渐变恒温效果看到很多特留意的是内置循环水泵可以避免外加装循环泵套件影响美观这个是我购买的重点和美的的品牌影响力噪音大小暂时未投入使用准备新房装修再安装出水速度这个主要是当地自来水压大小影响这款内置水置肯定能起到一定作用的安装服务暂不安装京东自营是我购物的信念和保障基础耗能情况16升水箱相对大容量能耗肯定大点主要是使用频率和方式决定相对的有好的使用体验才是重点京东自营很好的购物体验一直优先选择京东能买到称心如意的产品
9408,100011323840,5,2020-04-14 19:06:06,安装师傅特别细心安装免费挺好的大气美观我还挺喜欢不知道用着咋样期待
9409,100011323840,5,2020-06-24 13:47:57,收到很多家里新房设计装修中618活动先购买了等一段时间再安装大气上档次与装修风格也搭配外形外观外观造型很好看的恒温效果效果也很不错噪音大小声音还可以接受出水速度很好出水也快安装服务安装到时联系售后吧耗能情况还可以希望一切都好用的
9410,100011323840,5,2020-06-02 12:06:19,外形外观外观很不错大屏很给力安装服务师傅很专业收费有明细恒温效果第一次用暂不做评论噪音大小噪音可以接受出水速度水流很快足够用耗能情况第一次用暂不做评论
9411,100011323840,5,2020-05-04 09:00:06,恒温效果很棒告别忽冷忽热出水速度很快外形外观外观很大气安装服务安装师傅很专业很敬业；由于急用热水器师傅大晚上的来给安装给师傅点赞
9412,100011323840,5,2020-04-17 06:44:38,外形外观高端大气上档次安装服务师傅水平高不乱收费出水速度很快水压大耗能情况很省电省气噪音大小小恒温效果非常好
9413,100011323840,5,2020-05-09 12:43:42,外形外观外观很时尚大屏时尚实用恒温效果效果很好基本零冷水冲凉就不用等水热啦噪音大小声音非常小很安静出水速度出水速度非常快量也大安装服务安装服务美的非常好我下订单一小时就安装售后给电话预约安排师傅安装这个服务非常满意之前买美的其他产品看到服务这么好所以今次也选美的安装师傅服务非常好进门就带鞋套这个细节不错安装后详细解释使用方法特别第一次用零冷水的热水器耗能情况变频的热水器确实省气屏幕直接小时用气百分比这样确实看到节能效果
9414,100011323840,5,2020-07-06 15:23:10,外观好看物流很快美的产品在合适的时间是物美价廉的安装师傅也很专业共安装了热水器和洗碗机两样东西调试了一下使用起来也很方便很智能化事先把所有的东西准备好这样师傅过来安装很快速而且也不收费
9415,100011323840,5,2020-07-03 12:49:18,热水器外观大气好看功能全面噪音小质量也挺好的还可以手机远程控制送货到家安装师傅也很好经验丰富很快就安装好了
9416,100011323840,5,2020-06-14 17:05:21,外形外观外观来看确实很大气金色外壳配彩色大屏看着高端大气上档次安装服务安装师傅很专业按照约定的时间准时到达而且这次安装真的做到了0安装费全程没有花费一分钱这一点还是很棒的耗能情况毕竟是个一级能耗的设备耗电量耗气量都很低
9417,100011323840,5,2020-03-26 20:55:58,外形外观很绚丽高端大气上档次低调奢华有内涵恒温效果很好主要是零冷水功能很好没有装回水管也能用噪音大小能够接受出水速度可以安装服务可以送货速度很快耗能情况一个月后才知道
9418,100011323840,5,2020-03-17 02:41:56,外形外观时尚简洁金属拉丝面板和触摸屏看起来比较大气恒温效果还没得开通燃气到时候试试出水速度不错楼栋本身水压还可以没有发现异常安装服务很到位师傅很耐心加装排气管道和两个五金件花了叁佰块（封顶价）因为新家还没有安装无线网络所以wifi功能还没得测试安装师傅留了联系方式说如果联系不上再找他服务态度还不错噪音大小正常范围内
9419,100011323840,5,2020-04-04 17:42:14,外形外观很漂亮很喜欢安装服务安装师傅很好服务周到讲解详细还戴了鞋套垃圾还带走安装效果为客户考虑很满意helliphelliphelliphelliphelliphelliphelliphelliphelliphelliphelliphelliphelliphelliphelliphelliphelliphelliphelliphelliphelliphellip很好很满意恒温效果还没试未开通燃气噪音大小声音不大可接受出水速度很快很好
9420,100011323840,5,2020-06-25 10:36:02,外形外观外观看着比较大气显示屏很大很不错恒温效果燃气还没通上效果不知道安装服务安装服务非常不错安装师傅服务特别好师傅还给我免费安装了活干完以后把卫生清理的干干净净噪音大小燃气热水器的噪音都有出水速度出水速度试用后再说吧
9421,100011323840,5,2020-04-01 18:17:41,京东前一天下单第二天就送到了物流是非常快吃哈这个必须好评到货后联系售后安排专业人员安装调试中间因为零件问题跑了几趟大哥也是很热情的细心安装好评
9422,100011323840,5,2020-04-01 17:24:11,外形外观外观大气好看恒温效果温度很稳定出水速度出水速度还能接受安装服务免费拆了旧机
9423,100011323840,5,2020-06-14 14:58:27,买了两周了上周末预约师傅安装结果师傅排满了今天师傅上门安装了态度很好也没有收取其他费用这款主要是看上了零冷水冬天洗澡方便其次是免安装费用原价4999这次趁着618活动就入手了可以说很划算了
9424,100011323840,5,2020-04-10 15:19:58,恒温效果非常好噪音大小没有噪音出水速度很快安装服务安装师傅很好很专业
9425,100011323840,5,2020-06-05 21:41:06,金色机高端大气很漂亮噪音很小一台热水器可同时厨房卫生间同时使用热水安装在阳台位置刚刚好出水速度快非常不错安装师傅人很好很尽责技术一流安装完成后还带走了外包装箱性价比高很不错的购物值得购买
9426,100011323840,5,2020-06-10 21:49:01,零冷水和八年免费质保吸引了我价格也很优惠昨天半夜下单的今天下午收到货了速度很快包装很精美纸箱外还有塑料包装等待明天售后师傅的上门安装
9427,100011323840,5,2020-06-30 21:38:28,一直相信美的这个牌子第一次使用这种燃气的产品感觉不错就是很省电的外观也比较美观喜欢比较智能可以手机操作零冷水效果还算可以毕竟水路长了烧热需要时间安装费用和自己家装修有关系客观的评价产品整体感觉很不错我会推荐给我朋友使用美的质量没的说了
9428,100011323840,5,2020-03-18 12:03:00,外形外观外观好看高大上的产品然后还可以手机调节温度太方便了恒温效果师傅安装好之后立马洗了一个热水澡简直爽的不要不要的开水就有热水太方便了出水速度出水速度特别快几乎不用等就有热水而且零冷水真的好用快递小哥服务特别好包送楼整体很满意非常不错
9429,100011323840,5,2020-06-18 16:54:41,超快收货618凌晨秒杀当天中午就到了家电大到洗衣机冰箱空调热水器小到小烤箱电饭煲电高压锅油烟机碗柜燃气灶还有啥？记不清了全是美的的还有风扇哈哈哈老品牌非常信赖十几年前父母也是一直用美的本来想买经典款最后选择最新款的期待使用效果
9430,100011323840,5,2020-03-29 17:20:11,噪音大小非常小安装服务安装工的态度很好手脚麻利出水速度热水还是很快的外形外观外观高大上
9431,100011323840,5,2020-06-24 16:50:42,安装服务师傅安装速度很快也很专业热水器零冷水效果也特别好热水器外观大气
9432,100011323840,5,2020-07-07 12:53:43,外形外观外形满分恒温效果很好水不烫噪音大小声音不大卧室完全听不到出水速度出水速度还行要放冷水安装服务安装师傅很年轻很专业好评耗能情况耗能还没研究时间长了才知道
9433,100011323840,5,2020-05-05 12:46:41,安装服务非常满意安装工人非常仔细也非常耐心基本一步到位外形外观外形漂亮美观颜色也非常好看恒温效果恒温效果良好使用一段时间再看看出水速度出水速度也非常快满意噪音大小噪音还可以能接受范围耗能情况暂时还不清楚等使用一段时间再来追评
9434,100011323840,5,2020-06-02 18:37:54,很好热水器很快就送到了送到家门口的优惠还可以前一分钟抢的反了700多京豆真的很不错装修房子太费钱了精打细算
9435,100011323840,5,2020-03-16 16:59:45,热水器高端大气上档次看中了增压零冷水预约了明天安装家里电器都是美的相信美的的品质与服务
9436,100011323840,5,2020-06-27 10:57:38,外形外观时尚潮流好看美观恒温效果很好可以设定各种温度模式多样方便噪音大小装室外听不到安装服务安装完成非常好
9437,100011323840,5,2020-06-13 16:27:24,帮同事买的他说非常好用当时买的时候价格非常优惠而且付款时银行卡还搞活动可以说非常超值了安装过程也很顺利没有额外的收费项目大品牌还是很有保障的送货服务上也很到位总体是一次满意的购物
9438,100011323840,5,2020-06-19 16:22:07,安装服务非常好很细致特别满意外形外观很好时尚恒温效果完美特别好出水速度很快耗能情况不知道
9439,100011323840,5,2020-05-18 21:12:19,在京東第一次買熱水器挑了很久選中美的買之前請美的師傅上門看了下安裝環境免費服務非常好之後下單買了這款新產品太贊了零冷水靜音恆溫使用效果非常好機器外觀設計也很時尚家人非常喜歡比之前家中熱水節省很多而且水量也大了美的的服務一直在跟蹤很棒一天送貨上門一天安裝無後顧之憂小哥很辛苦為你們的優質服務點贊
9440,100011323840,5,2020-03-09 13:36:21,外观挺好看零冷水功能感觉挺好用还没有安装上活动买的性价比超高今天安装好后试一下在做追评安装是否收费费用多少之后都会追评的评价为了要音响
9441,100011323840,5,2020-03-09 15:23:33,新品首发立马就拍外形非常漂亮大气零冷水是家用首先相信美的这个品牌还没安装下次追评
9442,100011323840,5,2020-07-06 20:33:11,嗯不错价格很实惠师傅安装很专业很细心非常不错哦
9443,100011323840,5,2020-06-24 23:44:53,东西收到了趁着618活动买的在6月18日凌晨买的活动力度还是很大的感觉这款热水器应该还是很不错的价格又实惠父亲很喜欢由于北京疫情问题家里装修被叫停了估计得耽误一段时间了先给商品好评
9444,100011323840,5,2020-05-24 08:43:13,外形外观外形好看颜色也是我喜欢的看起来就很有质感恒温效果效果的话由于暂时还没有使用所以具体怎么样现在还不好做出客观的评价噪音大小目前还未觉得有噪音大的现象存在安装服务安装师傅很棒很快速使用材料的费用也是明码标价很满意
9445,100011323840,5,2020-03-15 10:54:28,外形外观没还小巧好看恒温效果温度稳定噪音大小适中出水速度水量可以满足用量安装服务家里管路比较混乱售后耐心安装好了很满意耗能情况还没统计出来
9446,100011323840,5,2020-06-19 12:02:54,热水器很好外观漂亮噪音很小出热水快还有恒温功能
9447,100011323840,5,2020-06-18 11:01:50,外观高档机身很大不愧是16升花洒没到还没用上洗澡应该很爽
9448,100011323840,5,2020-06-26 10:25:55,售后服务满意外形外观满意很喜欢618半夜起来抢的恒温效果效果还没用家里以前用的满意噪音大小声音不大很不错很好用出水速度出水很快不错的热水器很好用很好的热水器不错安装服务安装满意很好很负责师傅很不错耗能情况还没用应该不大用过同系列的
9449,100011323840,5,2020-06-07 12:40:36,热水器很好用直接可以使用可以供2个洗手间用很赞
9450,100011323840,5,2020-05-14 08:31:37,这个牌子的热水器可以的昨天安装完了收费合理比从前的升数大了一倍还有燃气用量显示感觉很高大上啊物流也给力好评
9451,100011323840,5,2020-06-08 16:46:38,东西不错质量好性价比高还送礼品安装师傅服务态度好耐心等待业主回来安装出水速度热水很快安装服务非常好噪音大小声音小外形外观漂亮
9452,100011323840,5,2020-06-25 11:27:32,安装服务满意很好外形外观很好恒温效果很满意噪音大小很小物流很快送货很及时师傅很专业很满意出水速度很满意很可以哦推荐购买外观简单大气方便实用还带WiFi安装态度很好美的值得信奈一如既往支持京东购买耗能情况很小
9453,100011323840,5,2020-06-25 00:29:53,外形外观很漂亮恒温效果还不错试用中噪音大小不算小也可以接受出水速度很快安装服务由于旧房子电热水器换燃气热水器自己找人改的水路费很大力气最后没找售后来安装耗能情况二级能耗应该是平均水平看中的是美的的品牌和京东的服务在准备换用燃气热水器的时候首选美的等了很久等到搞活动果断入手价格很合算
9454,100011323840,5,2020-06-19 11:01:18,外形外观外观简洁漂亮上墙效果整体不错比较满意恒温效果正在装修还未使用待使用后再做评价看着是零冷水功能购买的属于智能产品使用效果应该不错安装服务安装师傅服务非常到位预约安装时间也很及时耐心讲解各项使用功能
