id,product_id,score,comment_time,comment
14971,100006906796,5,2019-12-18 16:25:34,家里改通天然气看了好几个品牌最后锁定美的GT5这款性价比很高家里有老人和孩子安全是第一重要的这款热水器具有多重安全防护用起来安心操作盘简单直观液晶显示字大清晰老人使用很方便最大的特色是无极恒温舱不会让开断的时候水温骤冷骤热熊孩子自己洗澡不担心被烫伤还有几个模式母婴模式厨卫洗很实用不用频繁调整水温省心不少外观一般使用了几天感觉很好推荐给大家安装也很方便自己就可以搞定
14979,100006906796,5,2019-11-30 16:05:08,热水器收到了就马上安装上使用买的时候一直纠结美的和史密斯最终选择了美的我买的16升的安装上尺寸刚好呢收到的时候没有破损的热水器现在已经安装上在使用了配件很齐全我买的这个是带wifi的热水器这个功能还是挺方便的天冷了调水温都不用出卫生间手机就可以中途关一会再开中间没有冷水这个超赞的热水器功能简单易懂很实在产品的配件不错做工也精良没有瑕疵是正品他们的售前售后服务也很不错客服都很耐心解答我的疑问赞
14980,100006906796,5,2019-11-29 01:43:43,热水器不错期待效果家里有浴缸安装燃气热水器泡澡更加实用外观大气上档次颜色也很喜欢安装师傅专业热情技术娴熟希望效果理想
14986,100006906796,5,2019-11-23 10:51:53,外形外观大了一点点噪音大小满意出水速度满意安装服务非常满意安装师傅特别好耐心好说话比飞利浦的垃圾师傅好多了
14992,100006906796,5,2019-11-16 12:13:53,这款我看是新产品外形优美外形外观新产品外形设计比较简约金色大气安装服务安装师傅安装产品也很用心点赞恒温效果打算试一段时间再来评价
15003,100006906796,5,2019-11-06 13:29:33,外形外观外形漂亮简单大方恒温效果很好不用担心出冷水了噪音大小声音特别小很好出水速度很快安装服务服务态度极好很积极的上门安装安装的很到位耗能情况节约省电
15030,100006906796,3,2019-12-14 18:18:08,服务太奇葩了说了元安装其实所有辅材都要出钱出钱就出钱吧结果约了两天当天又等了很久才等来的师傅说他什么辅材都没带打孔也要自己找人打前后拖很久最后我们自己安的一生黑
15048,100006906796,5,2019-09-04 11:56:17,美的热水器新品安装很专业隔好几个屋子的卫生间半分钟就出热水一直很信赖美的电器质量好服务态度好国产品牌加油推荐大家选购美的热水器
15049,100002419329,1,2020-05-06 09:08:00,差评出水管胶圈渗水
15050,100002419329,1,2019-08-19 15:23:13,差评妥妥的客服下单前说有218的电动牙刷赠送到货了并没有看到这是欺诈消费者一问客服就说送完了我哪知道你有没有头一次遇到这么坑的京东自营店还说给好评送家纺价值1499我谢谢你昂留着你自己盖被子吧真垃圾第一次京东差评留给你了快递小哥还是很好的
15051,100002419329,1,2019-05-25 21:31:03,本人也是京东老客户了最不好的用户体验我家的热水器坏了又换的你们的产品先不说产品如何下面两件事让我十分恼火1你们宣传的免费安装这我可以给后面买的人说这个根本就是虚假宣传安装费花我俩白多而且安装师傅态度十分的不好和我老婆都吵起来啦他安装只图自个省事安装工艺太差2说的嗮单送赠品询问客服后得知新疆西藏的没实物赠品这种条款是对我们新疆歧视我建议新疆要买的要看清楚中间跟网上客服沟通也没给出合理解释我前面也在京东买的美的热水器所以这次才又买的产品还没有用几次不想太麻烦就没退我认为这次广告有虚假宣传做为商家店大欺客想买美的朋友可以看看
15052,100002419329,1,2019-11-23 21:52:10,热水器声音大安装热水器收费元我热水器才真坑安装师傅三根管子都是用燃气管水管没必要进水水管长度不到两米两头还都安装阀门多浪费的阀门还不是我们自己买单各种配件费用太贵以后再也不买美的产品了太劝大家买东西一定要长心别被坑了太气人了
15053,100002419329,1,2019-06-23 20:02:38,这一星是给安装人员约的4点快5点了打电话客服说问问看5点十几分给我打电话问我还装不装我5点24的火车你说装不装？后来又说客服给我约的是4点到6点可是我当时说的是4点4点跟6点可隔了两个小时美的的服务质量真是越来越差约的油烟机安装的说4点人家准时就到了还在那里等我十来分钟真是没得比
15054,100002419329,1,2019-08-02 10:50:40,安装费页面显示零元安装结果花了小600劝各位别任性我认为有误导消费客服互相推缷责任
15055,100002419329,1,2019-06-21 09:36:34,使用非常差必须要给差评声音跟打雷一样比打雷还大声618的价格更低但京东就是没法让你保价什么有赠品什么用白条～你有那么多条件那你宣传页面保价618说个锤子
15056,100002419329,1,2019-06-18 22:25:52,花了300多安装真是有点骗人挨着天然气接头就在窗户下面材料费还要了300多我觉得太坑了不抱怨安装人员制度问题差评
15057,100002419329,1,2020-04-27 14:43:41,千万不要买打火延迟问题严重洗澡时每次关了水都要重新放冷水真的很浪费水
15058,100002419329,1,2020-03-26 17:17:51,1变相免费安装耗材太贵了耗材将近需要花五六百什么都要收费的购买需慎用2热水效果不是很好都会放很多冷水的
15059,100002419329,5,2019-10-01 15:54:59,外形外观美观好看比想象的要大大触屏三种智能模式操作简单噪音大小噪音小出水速度出水良好安装服务师傅很好第一来的时候排气管不够当误了师傅白跑一趟安装过程沟通良好根据实际安装情况调整了排管很好的安装师傅小哥
15060,100002419329,5,2019-12-26 17:42:52,美观大方亮面设计高端大气上档次好看时尚选了好几天最后选了这款出热水的非常快洗澡洗碗同时用也是很热很喜欢安装师傅认真负责安装整齐漂亮出水量恒定温度不会忽高忽低没有杂噪音具体的效果待使用一段时间后再追评外形外观美观大方噪音大小比较小恒温效果还可以出水速度挺快的
15061,100002419329,5,2020-01-05 16:26:57,热水器外观漂亮大方出热水快水量也大噪音比较小触摸手感也很舒服安装师傅也比较热情周到感觉还不错推荐购买
15062,100002419329,5,2019-10-13 10:46:34,外观大气显示屏大看起来很舒服恒温效果也不错噪音不大出水均匀安装服务态度也很好第一次家里没人师傅第二天来家里安装能耗也很低很节能
15063,100002419329,5,2019-11-08 10:45:26,东西非常好大品牌就是大品牌用的也非常方便颜值很高emspemspldquo恒温效果好停了再开温度稳定出水量也很大rdquoldquo做工非常好温度也非常好夏天洗澡再也不怕水烫了rdquoldquo样式很好看操作很方便关键价格很合适性价比高rdquoldquo声音比较小跟其他品牌比起来可以说是静音了不会呼呼响的让人害怕
15064,100002419329,5,2019-12-15 20:17:15,外形外观大气时尚恒温效果很好噪音大小很小声不影响出水速度大安装服务服务态度好服务周到美的灵动热水器预防和监控双重防御如何降低CO中毒的几率保障家人的使用安全预防是第一要务美的灵动热水器MK3采用的是顶驱式风机配合搭载APS风压传感器在使用过程中全程检测风压强力抽氧助燃使燃烧更加充分能够从根源上降低CO的产生概率此外CO智能检测系统能够做到开机自检实时监测CO浓度变化如有异常立刻启动自动防护系统08s内蜂鸣警报18s内关闭阀门有效预防CO超标美的灵动热水器MK3以最灵敏的监控最快的速度最强大的双重防御时时刻刻保障您的安全使用给您最安心的使用感受变频智能调节水温水量相信很多人都经历过洗澡的时候厨房或厕所用水突然水量变少水温升高差点就被ldquo烫熟rdquo了或者楼层太高水压不够出水忽冷忽热一不小心就着凉冻感冒了为了节省用水使用沐浴露或者洗发水时关水再开水温忽然变冷又骤升helliphellip多变的用水环
15065,100002419329,5,2020-01-09 15:22:37,外形外观香槟色大气时尚外观圆润触摸屏漂亮清晰恒温效果有三种加热方式选的恒温不用调方便冬天温度也不低变频省电需要温度高可以随意调噪音大小加热有声音不算很大能接受出水速度有一段冷水但热水来的快安装服务师傅安装快而且专业耗能情况变频省电这款活动价买的挺划算还有赠品挺满意京东自营值得信耐售前售后服务到位物流也非常好
15066,100002419329,5,2019-11-03 16:54:48,京东自营物流就是快包装大气客服和气态度好安装师傅技术好态度好大品牌外观漂亮恒温效果非常好噪音很小出水速度快还非常节能
15067,100002419329,5,2020-02-24 17:54:07,外形外观高大上摩卡金跟橱柜很搭恒温效果智能变压随肤恒温厨房刷碗秒出温水噪音大小噪音不大还没有水声大出水速度超级快安装服务下单物流就联系确认了上午到货下午就来安装了公众号预约安装超级快师傅提前打电话约时间戴口罩穿鞋套很让人安心安装速度也快耗能情况二级能耗京东送货师傅辛苦了非常时期家电坏了唯有信赖京东自营美的性价比也很高家里洗衣机热水器都换的美的都没有让人失望
15068,100002419329,5,2020-01-10 14:46:12,商品质量很好放在厨房也不占地方出水就热几乎没有噪音水流大洗澡很舒服耗能也很小总之是很不错的产品美的还是很信得过
15069,100002419329,5,2020-01-02 14:29:13,外形外观美观大气上档次恒温效果效果非常好噪音大小噪音很小出水速度出水大洗澡舒服安装服务安装师傅服务态度非常好耗能情况节能环保
15070,100002419329,5,2020-01-21 19:37:41,美的燃气热水器性价比很高双12活动抢到的京东自营的送货很快热水出水稳定目前没有忽冷忽热的情况买的水伺服的声音也在可以接受的范围内出水速度还行没有工作的时候还是要稍微等一下的总体来说性价比全是很不错的了对得起这个价格
15071,100002419329,5,2019-11-02 21:39:09,做工精美颜色很好看LED显示大频很清晰老人小孩很容易上手物流很快售后服务很到位
15072,100002419329,5,2019-12-21 20:37:23,外形外观外观大气出水速度快安装师傅好很耐心安装仔细颜色土豪金very好看没有噪音水度不会忽冷忽热很有档次耗能小总之是很不错的产品节能环保可以自动恒温价格实惠烧水快洗澡很舒服值得信赖很满意的一次购
15073,100002419329,5,2019-09-22 11:42:02,外形外观美观简约时尚恒温效果基本没有浮动温差感安装服务速度快专业热情出水速度很快噪音大小可以按受比同款类其他产品要表现的好
15074,100002419329,5,2019-10-17 17:17:49,热水器的非常大气时尚材质好送货也及时安装也不错没有乱收费LED的触控显示屏特别有质感触摸时手感也很舒服调节时很灵敏操作简单老年人也能上手快字体清晰看得非常清楚底部有出水口燃气口进水口标的很清楚降低了安装的难度节能环保是这款燃气热水器最主要的也是最重要的特点值得推荐京东购物就是棒给五星级评价·点五星赞
15075,100002419329,5,2019-12-20 17:58:23,买的热水器很快就收到了师傅安装的很好服务态度也好装好就用了非常方便水热的很快用起来很好再也不用冷水了热水器也不怕冬天冻坏了有防冻功能还可以手机控制太好了家里人都非常喜欢可以每天在家洗澡了大家可以放心购买
15076,100002419329,5,2019-12-25 11:11:29,外形外观金色外观设计很大气出水速度很快安装服务安装为客户着想想办法为客户省安装费用用了两次感觉很不错服务态度非常好热水器的出水量也很不错好多功能还不会用得研究研究再追评
15077,100002419329,5,2019-09-20 14:20:27,外形外观外形大气上档次恒温效果出水快温度恒定噪音大小无太大噪声出水速度出水速度快温度温度安装服务师傅提好的热心适用人数老人孩子都可以方便耗能情况能耗小
15078,100002419329,5,2019-10-26 18:05:12,外形外观好看安装服务完美师傅人很亲切啥都帮着弄好了上门及时人很友好机器也很好很好看质量也不错声音也不大低水压也能打热感觉买值了好评很满意耗能情况2恒温效果好噪音大小低出水速度快
15079,100002419329,5,2019-12-21 11:44:50,物流速度很快第二天就收到了安装师傅很专业指导讲解最佳安装位置我家安装到阳台上排烟比较好产品外观美观大方运行噪音小超喜欢
15080,100002419329,5,2019-12-21 22:48:35,热水器了收到了很高端很大气质量也很好送货很快活动好优惠真是物有所值还带防漏气功能和恒温功能师傅安装的也很好很漂亮
15081,100002419329,5,2019-11-13 23:13:24,外形外观美的外观设计好看颜色也是很耐脏啊恒温效果恒温效果还是不错的出热水的速度还是可以的声音嘛我觉得燃气热水器的打火声音都差不多安装专业显示器哦看着显档次出水口和进水口很好辨认家里老人家操作起来简单很容易就上手了关了再打开会有几秒的冷水耗能情况燃气耗能还可以
15082,100002419329,5,2019-12-01 16:09:02,热水器安装上了16升的有点大家用的话不知道会不会特别废燃气外观很好大屏幕热水嗖嗖的其他情况等入住了再分享好评
15083,100002419329,5,2020-01-21 19:22:01,热水器安装好了大牌的就是好非常好用值得拥有安装服务货到了之后等了2天安装的人没来就自己动手装上去了
15084,100002419329,5,2019-12-16 19:31:07,外形外观整洁大方金色的机身不管与什么颜色其实是百搭个人感觉很温馨不像全不锈钢的颜色那么冷调噪音大小用过不少牌子的燃气热水器有些风扇和燃烧时的声音确实很大但是这款机器不得不说运行声音真的很小出水速度出水速度完全够用运转灵敏度很不错基本没有等待机器就能运转恒温效果恒温效果试了一下中间关闭再开启后温度没有太大变化基本上能保证恒温中间没有那种冷水实用性很强特意测试了一下厨房和淋浴同时工作16L的机器完全能保证同时用水的需求水温没有变化安装服务安装师傅非常认真安装速度快着装规范能看出美的的品牌真是越来越好给师傅点个赞
15085,100002419329,5,2019-10-20 16:57:23,外形外观很喜欢的颜色漂亮耐脏外形大气恒温效果温度可调很棒噪音大小噪音还可以不是很大可以接受出水速度出水很快而且很稳安装服务安装师傅很耐心字体很大老人用的也很好安装服务安装师傅很耐心服务态度很好恒温效果温度可调很棒
15086,100002419329,5,2019-08-27 18:34:22,热水器颜值高物流速度快安装速度也快安装之前还怕之前预留的控不合适师傅来了之后一看果然不够就想办法帮忙处理态度非常好安装之后师傅帮忙开机试水结果还帮忙发现家里一条热水管不通大赞安装师傅
15087,100002419329,5,2019-09-15 10:30:29,预约安装很便捷第一天晚上预约的第二天上午就来给安装好了师傅服务态度很好没有因为是零元安装有啥不愉快机器使用很便捷操作方便师傅给简单介绍了一下方便
15088,100002419329,5,2020-05-20 10:58:54,外形外观外观简洁时尚颜色耐脏看着很舒服恒温效果还不错水温很稳定持续出热水而且热水来的很快基本打开水龙头两三秒就出热水噪音大小基本没有什么声音非常的安静出水速度出水也很稳定水流大没有断流的情况安装服务师傅上门技术安装迅速态度很好耗能情况这个没有注意啊～～
15089,100002419329,5,2019-10-14 22:12:29,出水速度很快没几秒热水就来了噪音大小机器工作时声音很轻而且声音还很柔和恒温效果机器出水温度很稳定多个水龙头打开水温也没什么大波动安装服务售后安装很快预约第二天就马上来安装了还送了安装材料
15090,100002419329,5,2019-10-15 17:19:01,很好的一次购买经历因为喜欢京东喜欢美的品牌所以这次更换热水器直接在京东上购买下单了价格很便宜实惠而且还送了电动牙刷从美的的做工来说没得说堪称一流品质给一万个放心用20年没问题
15091,100002419329,5,2019-12-29 11:57:04,配送和安装都很给力这款热水器的随温感功能非常好用水温刚刚好无需自己去一点点调节水稳使用过程中水温基本没有起伏变化非常舒适
15092,100002419329,5,2019-11-30 22:52:31,东西收到了看上去做工真的很不错打开基本没什么味道的细节方面挺好的京东自营信得过物流很快包装很完好安装师傅上门速度快服务很好也很专业出水速度很快很满意这次购物下次还来京东买电器一样一如既往的好用耐用
15093,100002419329,5,2019-09-19 16:13:35,刚刚装上热水器质量很好样子也高端大气服务人员在我收到货的第一时间打来电话确认安装时间和地点安装试用热水来的特别快几乎一两秒出水而且几个水管同时打开用水不会影响热水的出水量很满意的一次购物
15094,100002419329,5,2019-07-01 22:48:31,这款热水器外观大气操作也方便还有水量伺服这种高端智能的配置刚好赶上618购买的优惠力度很大比平时便宜了不少安装师傅也很有耐心很负责很好的一次购物体验
15095,100002419329,5,2019-10-22 19:24:02,外形外观很喜欢颜色漂亮耐脏外形大气美观恒温效果温度可调效果很好噪音大小噪音很小的可以忽略不计出水速度出水很快且很稳安装服务安装师傅很专业很有耐心服务态度好
15096,100002419329,5,2019-05-29 12:27:22,热水器功能很齐全活动价买的很实惠物流超快货收到后联系安装美的的安装师傅很快就来安装了服务很到位还没开气期待实际用的效果
15097,100002419329,5,2020-01-11 23:25:29,外形外观外形美观大方配合我那淡淡的黄墙壁那是真的好看用起来也好2浴室用的总体感觉稳定安装服务安装师傅大老远不辞幸苦跑来安装也是工作很努力看看细节就知道一丝不苟管子也安的规规矩矩的大爱认真工作的人
15098,100002419329,5,2019-07-10 20:18:50,今天收到包裹了预约师傅过来装好了预约要二天时间质量很好辅材还是免费的装了一个多小时就好了搞到师傅满头大汗全五星好评
15099,100002419329,5,2019-11-12 15:10:48,外形外观非常大气家人很满意恒温效果还没通煤气所以不太清楚不过相信美的的品质安装服务服务态度非常好因为通风口的问题麻烦安装人员跑了两次才安装好这款热水器是精挑细选出来的性价比非常高主要考虑多点同时用水所以买了大容量
15100,100002419329,5,2019-06-05 13:50:50,美的这款热水器外表美观大气很满意的一款智能变升温度感应不用担心水温忽冷热的问题了而且操作简单易懂方便老人使用而且安装师傅服务态度好
15101,100002419329,5,2019-06-08 15:04:06,机器非常好声音很小水温恒定外观漂亮大方安装服务到位安装人员给出合理化建议16升能满足日常的需求出热水很快厨房厕所同时用水影响很小总之非常满意
15102,100002419329,5,2020-01-05 15:46:25,美的产品不错值得信赖外形外观外观漂亮高大上恒温效果我几个点同时用水效果很好噪音大小正常范围内出水速度很快安装服务很到位耗能情况正常范围内
15103,100002419329,5,2020-01-04 17:14:20,我刚收到货很快快递给一级棒还没安装看着挺漂亮的应该质量是可以
15104,100002419329,5,2019-11-11 10:25:42,首先说下购买吧在京东搜索燃气热水器第一眼看到的就是美的的品牌促销力度非常大较其他品牌要好很多；而且还有额外的赠品赠送；其次说下送货的问题原先选择的是12月份送货因考虑近期比较忙所以选择的延迟送货但看到有活动所以提前送货找京东很快解决了送货非常快快递服务非常好；最后说下安装和售后问题快递还没送到美的售后已经主动联系确认收到商品没服务意识非常好收到后因为家里停电但安装环境是需要师傅确认能否使用师傅还是不劳辛苦的跑了一趟确认可以安装后第二天师傅早早就过来安装整个安装过程中基本上没有什么比较大的噪音而且师傅在厨房间安装的时候都会先铺垫一层隔灰垫整体让我感受非常好安装好之后师傅会主动告知你怎么使用有什么需要注意的地方并且把费用明细确认清楚告知你整体来说对美的售后的服务态度没得说真的很美的很nice的一次购物感谢美的外形外观洗澡可以一直洗不会其次说下送货的问题原先选择的是12月份送货因考虑近期比较忙所以选择的延迟送货但看有洗洗就没热水的情况够一家人使用恒温效果温度随气温变化自主变更适合人体的温度基本上不需要手动设置
15105,100002419329,5,2019-05-26 14:35:37,这款美的燃气热水器美观大气使用起来也方便出热水也快出水量大烧水时声音也小安装师傅安装的很到位
15106,100002419329,5,2019-09-29 19:39:49,热水器安装上有一段时间了分享一下感受首先外观大气好看很有档次感其次噪音还很小不会让人听着心烦然后就是水量很足两个卫生间一起用也不会忽冷忽热的很满意的一次网购
15107,100002419329,5,2019-11-04 16:01:38,外形外观做工精美颜色高贵大气恒温效果四季随温感操作方便简单噪音大小噪音小出水速度出水速度快安装服务安装师傅很用心到位我家是和太阳能联在一起的师傅耐心讲解使用方法非常感谢
15108,100002419329,5,2019-07-02 17:30:34,使用了几天非常棒大品牌值得信任安装师傅态度很好送货安装都很快家里有的电器都是美的很好
15109,100002419329,5,2019-06-24 11:17:24,这款热水器的颜值高材料好看起来不错节能环保操作简单安装好看师傅动作快认真负责给个好评辅材费用110很便宜
15110,100002419329,5,2019-06-22 22:20:10,是18号0点秒杀抢到的非常划算当时过了10分钟就收到短信说次日可以送货上门还以为只是开玩笑结果19号中午就送来了简直神速了这不刚装好总体非常满意功能也非常多希望可以长期使用因为这是第一次使用16L的没想到家里的煤气表还不行又跑了一趟燃气公司做了扩容操作才能使用这个产品听师傅讲可以质保8年那是相当的划算呢
15111,100002419329,5,2019-09-28 20:58:00,外形外观暗金色很漂亮外观设计不错出水速度出水很流畅水流犀利噪音大小声音还行不算大安装服务师傅不错有耐心恒温效果试用时感觉很稳定具体效果有待以后观察
15112,100002419329,5,2019-12-12 20:40:26,外形外观设计弧度美观大方颜色新颖靓丽恒温效果温度稳定可靠供热水连续体验非常好噪音大小安装在阳台上对日常生活没有任何噪音影响出水速度出热水速度迅速可靠性强安装服务安装师傅服务态度好善于沟通耗能情况二级性能换热效果好不错的购物体验
15113,100002419329,5,2019-06-17 04:51:22,颜色很大气外观漂亮出水快16升家用很宽裕安装师傅说两个卫生间可以同时使用安装师傅很辛苦干完活晚上八点半多了
15114,100002419329,5,2019-12-05 23:09:47,双十一比较拥挤到货不是很快但是外观美丽安装师傅很专业主动讲解如何使用安装师傅热心细心耐心专业服务很好安装的很漂亮呢并没有乱收费现象使用后再给大家追评上图使用效果呢说有电动牙刷送不知道为什么一直没发货后续给大家一起上锅子和电动牙刷照片呢
15115,100002419329,5,2019-05-19 16:13:35,一直关注美的这款燃气热水器很久了这次新房装修又赶上美的优惠活动果断入手收到货后迫不及待的打开热水器颜值挺高啊8年包修还带有水量伺服告别忽冷忽热的感觉16升水量绝对满足全家个个地方热水使用超赞京东自营商品质量物流配送一流的
15116,100002419329,5,2019-12-15 12:30:15,热水器收到了LED的触控显示屏特别的有质感整体的材质用料很不错非常的大气上档次触摸时手感也很不错也很舒服调节时很灵敏操作也非常简单恒温效果非常不错出水速度快不浪费水噪音也非常小安装师傅态度非常好非常有耐心的讲解总体来说非常满意
15117,100002419329,5,2019-12-15 08:40:45,美的这个品牌不错就是冲着这个品牌买的家里的电器基本上都是用的这个品牌国产质量杠杠的这款热水器是双12买的价格优惠土豪金外观非常漂亮外面使用起来非常不错无噪音出热水快过程中温度保持非常好不会忽冷忽热客服小姐姐态度非常好安装师傅也十分用心送货也比较快整体体验非常好
