product_id,score,comment_time,comment
100003859066.0,1.0,2020-02-03 22:31:39,15分钟
100003859066.0,1.0,2020-04-12 18:23:39,五分钟
100003859066.0,1.0,2020-06-22 01:11:23,调到70度用正常热水洗澡最多维持15分钟水温就降到16度了冻成狗本来家里热水器2000瓦现成的也没坏就是看这款3000瓦功率的以为会好一点结果更差真的很失望枉费了对海尔期望值这么高
100003859066.0,3.0,2020-02-23 16:58:51,这真有60l速热吗刚装好时老婆花了10来分钟洗了个头从显示的70度直接掉到30来度如果一家三口人都要洗得等多久那些对使用体验表示满意的都是单身吗
100003859066.0,5.0,2020-06-08 14:52:22,四五个人连续洗澡也有热水而且设有晨浴晚浴非常方便
100003859066.0,5.0,2020-05-04 17:58:48,可以WIFI预约早晚洗澡水热后自动关机
100003859066.0,5.0,2020-06-14 15:38:05,可以洗挺久够我们家三个人洗洗完还有多
100003859066.0,5.0,2020-04-24 13:50:53,加热70℃可以洗两三个人
100003859066.0,5.0,2020-05-25 12:44:43,可供一家人洗澡方便快捷
100003859066.0,5.0,2020-06-30 16:58:26,分晨浴和晚浴非常方便
100003859066.0,5.0,2020-07-07 07:27:04,水量大洗浴时间短舒服
100003859066.0,5.0,2020-02-02 17:16:14,60升大容量增加了洗浴时间一家三口洗澡都没问题的
100003859066.0,5.0,2020-06-03 22:07:34,刚安装好就迫不及待的试了试两个人洗才用了很少的热水烧一次热水能用很长时间
100003859066.0,5.0,2020-06-01 17:16:04,60升有速热增容模式智能抑菌模式安全随便用
100003859066.0,5.0,2020-05-09 11:27:22,边洗浴变加热俩个人足够用
100003859066.0,5.0,2020-07-04 15:07:43,一个人洗漱很长时间
100003859066.0,5.0,2020-06-27 20:17:05,我感觉一家三口一个一个用可以用好久够用了一个多小时
100003859066.0,5.0,2020-05-25 21:54:32,能Wifi控制挺方便的
100003859066.0,5.0,2020-01-04 21:13:02,可以设定洗浴时间晨洗晚洗功能设置很方便
100003859066.0,5.0,2020-05-24 10:20:34,想洗多久就洗多久的感觉反正是一家三口人洗澡绝对够用了
100003859066.0,5.0,2020-01-22 18:48:44,三口人够用平时使用起来很方便热水随叫随到
100003859066.0,5.0,2020-04-26 18:01:12,随时控制
100003859066.0,5.0,2020-03-23 22:17:55,全家人陆陆续续洗的没有太多间隔整体感觉还不错
100003859066.0,5.0,2020-01-29 10:21:43,75度可以洗两个人半小时左右
100003859066.0,5.0,2020-05-27 17:31:50,一家人洗浴热水不用等六倍增容畅洗无忧
100003859066.0,5.0,2020-05-03 17:17:57,加热速度加快热水比以前更够用
100003859066.0,5.0,2020-06-15 10:37:03,够一家三口洗浴
100003859066.0,5.0,2020-07-02 13:10:57,自己洗完全够了
100003859066.0,5.0,2020-01-24 12:52:50,一家三口一直洗没问题放心吧
100003859066.0,5.0,2020-07-07 23:11:12,随时随地
100003859066.0,5.0,2020-04-06 18:08:54,60升容量满足家庭需要
100003859066.0,5.0,2020-05-07 21:08:17,手机APP随时控制早晚浴可以随时设置
100003859066.0,5.0,2020-06-01 18:14:51,就是看好的晨晚洗很喜欢
100003859066.0,5.0,2020-04-23 20:01:55,一家三口足够了
100003859066.0,5.0,2020-01-16 11:23:00,即使洗很久也没关系
100003859066.0,5.0,2020-05-03 17:05:52,时间段可以预约很棒不用等待了只要提前预约就完事
100003859066.0,5.0,2020-04-17 17:23:53,一家三口洗澡没问题
100003859066.0,5.0,2020-05-30 11:49:37,60升的容量足够一家五口人使用
100003859066.0,5.0,2019-12-22 12:04:09,本好评一家三口用完还有40多度
100003859066.0,5.0,2020-03-24 19:50:45,一家4个人洗澡都没有问题
100003859066.0,5.0,2020-05-05 16:20:35,自主选择加热时间再也不用担心早起床和晚睡觉前没热水了
100003859066.0,5.0,2020-05-13 22:40:15,洗澡速度快的一家3口完全没压力
100003859066.0,5.0,2019-10-31 21:32:35,一家人洗够用的2-3人的用量45分钟左右吧
100003859066.0,5.0,2019-11-26 16:01:12,够一家三口洗了
100003859066.0,5.0,2020-06-23 19:15:54,可以预约早晚洗澡很方便
100003859066.0,5.0,2020-05-17 11:16:00,省时间
100003859066.0,5.0,2020-05-02 11:06:23,两三个人洗澡足够用
100003859066.0,5.0,2019-11-10 16:02:30,两个人洗足足的之前的热水器一个人都不够用现在舒舒服服的泡了很久总之这款热水器性价比高售后也很棒值得推荐
100003859066.0,5.0,2019-11-29 19:00:04,家里目前只有两个人洗浴够用
100003859066.0,5.0,2020-05-18 15:44:36,功能齐全等用起来再来追评继续点赞
100003859066.0,5.0,2020-06-21 16:03:06,冲淋三个人没问题洗澡两个人
100003859066.0,5.0,2020-06-29 19:26:38,洗浴效果非常不错
100003859066.0,5.0,2020-06-30 13:39:29,烧到七十几度的话三四个人洗够用了不过这个因人而异男生洗澡会快一些
100003859066.0,5.0,2019-11-24 13:53:18,通电半小时就洗了20分钟一家3口肯定没问题啊
100003859066.0,5.0,2020-01-11 19:35:27,我洗澡比较快洗完澡才掉一度温度
100003859066.0,5.0,2020-04-29 08:48:14,分白天跟晚上还可以预约很方便
100003859066.0,5.0,2020-05-03 12:09:39,可以连续一家洗
100003859066.0,5.0,2020-06-04 16:57:44,60升够两三个人洗澡了够用
100003859066.0,5.0,2020-06-15 10:49:36,一个人冲凉下降10℃
100003859066.0,5.0,2020-05-22 10:04:53,一个小时没问题加热速度也快
100003859066.0,5.0,2020-04-29 14:27:48,有晨浴和晚浴两个时间段选择还有智能抑菌功能
100003859066.0,5.0,2019-10-28 13:06:31,一般情况下可以使用45分钟足够家庭三人洗浴的用量
100003859066.0,5.0,2020-05-18 15:08:52,加热速度快应该差不了
100003859066.0,5.0,2020-06-23 07:57:33,冷热均有洗澡厨房都可以
100003859066.0,5.0,2020-05-17 16:17:06,一家人用足够了方便的
100003859066.0,5.0,2020-06-23 12:49:12,超长
100003859066.0,5.0,2020-04-30 13:46:41,中午可以好好洗澡了以前的只能洗10分钟现在不用担心我洗了20分钟温度还很高
100003859066.0,5.0,2020-06-20 19:42:25,两个人冲澡没有问题即使用完了也很快就会烧热非常棒的一款热水器非常信赖海尔的品牌
100003859066.0,5.0,2020-01-12 20:04:12,60的一家三口连续洗澡没问题
100003859066.0,5.0,2020-05-06 17:53:46,还没使用感觉应该不会赖
100003859066.0,5.0,2020-05-23 11:20:32,可以预约洗浴
100003859066.0,5.0,2020-05-13 22:31:24,这款非常喜欢烧水可以手机提前打开烧水很前卫
100003859066.0,5.0,2020-04-26 05:51:08,一次加热可以满足我们全家人的洗浴一直信赖海尔的品牌
100003859066.0,5.0,2020-06-13 08:49:10,家里有两个人容量给两个人洗绰绰有余了很满意
100003859066.0,5.0,2019-11-18 15:48:47,早晚可以设定
100003859066.0,5.0,2020-07-05 11:53:40,手机定时控制真的是太好了
100003859066.0,5.0,2020-05-27 14:15:34,目前只洗了一个人目测够我们一家冲澡完全够用也连上了洗手池出水很足够用没问题
100003859066.0,5.0,2020-04-24 10:01:16,60升得绝对够用了以后再也不用担心水不够用了家里四口人
100003859066.0,5.0,2020-06-07 15:36:50,可随意设定晨浴晚浴自由选择
100003859066.0,5.0,2020-01-23 13:36:39,很好哦
100003859066.0,5.0,2020-04-19 12:08:32,一家五口绝对没问题
100003859066.0,5.0,2019-12-14 19:47:19,洗浴时间长
100003859066.0,5.0,2020-04-24 15:53:14,时没有后续追加
100003859066.0,5.0,2020-03-22 12:04:27,可以预约节能省心
100003859066.0,5.0,2020-04-01 21:03:13,够一家三口洗了6倍增容智能
100003859066.0,5.0,2020-04-25 20:02:50,60L足够家里人使用容量充足
100003859066.0,5.0,2020-03-27 05:45:52,3到4个人洗澡没问题
100003859066.0,5.0,2020-06-10 09:43:09,适合三四个人洗澡并且水量充足
100003859066.0,5.0,2020-06-18 22:24:15,有晨浴晚浴都有两个时段可以选择
100003859066.0,5.0,2020-06-19 12:31:00,洗浴时间等用了再追加评价
100003859066.0,5.0,2020-04-09 12:47:19,我洗的比较久半个小时左右吧不会没热水加热速度很快所以没感觉没热水
100003859066.0,5.0,2020-01-10 13:02:32,60升两人没问题
100003859066.0,5.0,2020-03-29 15:08:51,三个人没有问题
100003859066.0,5.0,2020-06-13 17:15:58,晨浴和晚浴家里两个老人足够用
100003859066.0,5.0,2020-04-29 13:52:17,感觉一家人洗应该没问题朋友买的即热的感觉还没有这种更方便一些吧
100003859066.0,5.0,2020-05-08 13:29:27,够用
100003859066.0,5.0,2020-07-06 12:27:07,家里2口人使用水量完全没问题
100003859066.0,5.0,2020-01-24 09:05:15,能供2个人洗澡
100003859066.0,5.0,2020-01-14 15:35:01,时间可以预定
100003859066.0,5.0,2020-05-20 20:46:53,一般半小时内就可以洗澡了
100003859066.0,5.0,2020-04-24 16:17:20,有早晚浴这点不错
100003859066.0,5.0,2020-05-26 10:02:34,加热速快
100003859066.0,5.0,2019-11-19 09:12:42,支持3000瓦快速加热大大缩短烧水时间60升可以满足三口一家的家庭
100003859066.0,5.0,2020-05-02 12:41:20,很舒服
100003859066.0,5.0,2020-01-15 21:10:02,四个时段充分考虑家庭成员的洗澡时间规律
100003859066.0,5.0,2020-05-17 08:42:40,洗浴时间可以分为晨浴晚浴2种很人性化设定
100003859066.0,5.0,2020-03-05 13:35:10,60升满足一家人的需求够用了
100003859066.0,5.0,2020-07-05 15:37:48,60L大容量一家人沐浴没问题
100003859066.0,5.0,2020-05-14 19:34:27,40分钟左右足够了热水
100003859066.0,5.0,2020-05-21 18:53:32,三口之家绰绰有余
100003859066.0,5.0,2020-05-05 22:25:40,晨浴晚洗能够满足全家人的需求
100003859066.0,5.0,2020-06-08 14:02:29,热水足够
100003859066.0,5.0,2020-03-31 22:46:41,四口洗浴足够用
100003859066.0,5.0,2020-06-20 19:30:46,满意非常成功非常愉快的一次网上之前关注了挺长时间618果断拍下颜色大小跟你想象中心目中的一模一样海尔不愧为大企业家里的所有电器
100003859066.0,5.0,2020-06-19 18:02:09,一家三口用足够了
100003859066.0,5.0,2020-04-28 17:19:03,出水大洗浴时间长
100003859066.0,5.0,2020-01-27 20:39:29,两个人洗是没有问题的三个人有点不太够家庭使用足够了
100003859066.0,5.0,2020-04-26 16:57:28,可以设定洗浴时间用着方便
100003859066.0,5.0,2020-05-04 19:25:13,很长时间
100003859066.0,5.0,2020-06-07 12:30:02,怎么也能洗几个人吧
100003859066.0,5.0,2020-05-06 12:11:30,六倍扩容不用担心突然没热水
100003859066.0,5.0,2020-04-06 14:11:37,拥有晨浴晚浴功能还可以联网手机控制晚回家也不担心没有热水了
100003859066.0,5.0,2020-05-29 23:47:17,完全够三个大人洗澡
100003859066.0,5.0,2020-05-07 18:14:09,有预约时间的这项功能非常好
100003859066.0,5.0,2020-05-24 13:42:34,反正能支撑我们三口人洗完不断热
100003859066.0,5.0,2020-04-14 22:09:49,预约洗浴
100003859066.0,5.0,2020-05-03 22:11:34,加热70度能洗两三人
100003859066.0,5.0,2020-03-19 19:02:49,我个人洗澡是比较墨迹的但是两个人洗澡完全没有问题产品质量是不错的首先我相信京东更相信海尔尤其要评价一下这个售后是相当的负责任总而言之我很满意
100003859066.0,5.0,2020-07-09 15:55:55,有晨浴晚浴两个时间选择很方便贴心
100003859066.0,5.0,2019-11-02 20:32:43,什么鬼
100003859066.0,5.0,2020-04-22 19:14:12,能满足一家人洗浴
100003859066.0,5.0,2020-05-26 20:07:07,1家3口完全够用大品牌值得信赖
100003859066.0,5.0,2020-03-22 14:23:45,三口之家60升足够
100003859066.0,5.0,2020-05-07 13:23:30,60升的估计应该够用今天准备试一试
100003859066.0,5.0,2020-04-03 09:39:00,可以满足两到三人使用
100003859066.0,5.0,2020-06-18 17:41:07,容积有60L4个人洗应该够用了
100003859066.0,5.0,2020-05-24 09:42:27,还没洗一会试试
100003859066.0,5.0,2020-04-27 09:40:52,已经使用洗浴时间超长
100003859066.0,5.0,2020-01-12 14:15:01,60升大容量满足一家三口需求
100003859066.0,5.0,2020-04-19 09:56:55,晨浴晚浴好功能
100003859066.0,5.0,2020-04-18 21:00:09,2-3人足够了
100003859066.0,5.0,2020-06-28 14:53:53,洗浴水量充量增倍很好
100003859066.0,5.0,2020-04-26 22:52:29,持久
100003859066.0,5.0,2020-05-24 11:20:39,洗浴时间可以设置早晚浴
100003859066.0,5.0,2020-03-16 23:40:36,洗浴时间挺长的加热一次一家三口洗没问题
100003859066.0,5.0,2020-06-07 16:35:38,能洗两人很好很满意
100003859066.0,5.0,2020-04-05 14:35:03,不错非常不错可以很久
100003859066.0,5.0,2019-11-26 20:19:37,今天刚装上还没洗澡呢
100003859066.0,5.0,2020-05-01 20:33:08,非常满意
100003859066.0,5.0,2020-04-06 20:28:27,洗浴时间可以调控选择时间晨浴晚浴可以选择很方便
100003859066.0,5.0,2020-06-01 12:32:05,个人觉得两个人肯定是没有问题的
100003859066.0,5.0,2019-11-09 15:34:46,这个应该没有问题
100003859066.0,5.0,2020-05-27 10:06:46,一般也就三个人够用了
100003859066.0,5.0,2020-05-07 06:00:20,可以满足4个人洗澡
100003859066.0,5.0,2020-06-24 14:58:33,洗浴时间很长晚上的热水用不完早上也能用保温效果好
100003859066.0,5.0,2020-05-22 19:34:03,安装完试了一下30分钟应该温度从72变化到20度还能继续出热水
100003859066.0,5.0,2020-06-11 19:19:12,还没用
100003859066.0,5.0,2019-11-09 16:46:09,一家三口的话60升随便够用了
100003859066.0,5.0,2020-06-10 13:48:59,够用
100003859066.0,5.0,2020-05-24 15:43:06,可以设定洗浴时间很方便
100003859066.0,5.0,2020-06-11 11:03:57,可以够三四个人使用
100003859066.0,5.0,2020-06-19 15:08:40,还没试
100003859066.0,5.0,2019-11-26 21:00:54,按一个人洗澡5分钟来算的话一家子用绝对没有问题
100003859066.0,5.0,2020-06-29 23:17:08,给父母买的说很不错
100003859066.0,5.0,2019-12-25 06:54:10,冬天洗碗再也不用担心水冷手冷了
100003859066.0,5.0,2020-06-03 22:58:28,三口之家足够实用
100003859066.0,5.0,2020-05-18 14:51:14,加热一次可以洗两个人省去了再加热一次的时间特别好
100003859066.0,5.0,2020-03-27 08:10:11,超长够用
100003859066.0,5.0,2019-11-18 12:14:57,加热到75度一个人洗澡半个小时没问题
100003859066.0,5.0,2020-03-01 21:36:29,感觉还可以
100003859066.0,5.0,2020-06-13 10:28:50,有两个模式选择
100003859066.0,5.0,2019-11-22 23:11:56,60L足够一家人洗的了
100003859066.0,5.0,2019-11-28 21:45:59,出水真的超多的在
100003859066.0,5.0,2020-05-27 16:34:05,很好感觉一家五口人都够用很好用
100003859066.0,5.0,2019-11-21 14:15:10,洗浴有六倍的水量适合喜欢泡澡的我
100003859066.0,5.0,2019-11-12 21:57:44,够一家两口洗澡估计再加两个人也够用洗澡泡脚完之后还有热水总之很方便很喜欢简直不要太好
100003859066.0,5.0,2020-06-21 20:45:49,60deg两人洗澡没问题
100003859066.0,5.0,2019-11-21 20:35:05,时间也挺长的持续热水
100003859066.0,5.0,2020-06-07 20:22:28,三秒出热水真不是吹的
100003859066.0,5.0,2020-04-29 12:16:02,挺好
100003859066.0,5.0,2019-12-05 13:22:49,基本满足4人家庭的需求
100003859066.0,5.0,2020-06-20 14:11:28,洗浴时间还行呢可以满足需要
100003859066.0,5.0,2019-11-14 19:09:17,够两三个人洗一次
100003859066.0,5.0,2020-05-25 06:56:08,完全够用俩个人的
100003859066.0,5.0,2020-01-18 21:13:41,随自己定洗得舒服
100003859066.0,5.0,2020-02-14 14:35:22,时间还是比较久的
100003859066.0,5.0,2020-05-03 12:24:20,很好
100003859066.0,5.0,2020-06-15 08:39:39,晨晚两浴上很方便
100003859066.0,5.0,2020-07-07 15:50:12,晨洗晚浴海尔的设计还是挺到位的很多都能帮你想到
100003859066.0,5.0,2020-05-21 11:24:02,够用
100003859066.0,5.0,2020-04-06 18:29:10,还行
100003859066.0,5.0,2020-04-27 12:33:13,没测过
100003859066.0,5.0,2020-07-12 13:50:39,洗两个人足够了大水量洗澡一个人是足够的
100003859066.0,5.0,2020-06-27 21:48:24,还没试过
100003859066.0,5.0,2020-04-18 11:17:55,容量大足够一家三四口使用
100003859066.0,5.0,2020-02-23 12:40:23,刚刚安好还没用过不过听朋友说上水加热很快够一家人洗澡
100003859066.0,5.0,2020-05-17 19:05:07,这么大一桶热水我和小孩洗的很爽
100003859066.0,5.0,2020-05-15 19:00:25,六倍增容
100003859066.0,5.0,2020-06-29 15:39:18,三人连续洗澡后水温还保持在60度非常好
100003859066.0,5.0,2020-03-30 23:19:48,目测可以洗2-3个人
100003859066.0,5.0,2020-05-24 08:19:44,一家四口够用
100003859066.0,5.0,2020-01-18 15:43:40,还没使用安装师傅很负责任
100003859066.0,5.0,2020-05-21 07:20:34,平时别的热水器一个人洗这款三个人都用不完非常经济实惠
100003859066.0,5.0,2020-01-15 14:49:53,很快
100003859066.0,5.0,2020-06-02 07:30:47,能设置早浴晚浴特别方便
100003859066.0,5.0,2020-07-01 17:50:54,轻松舒服
100003859066.0,5.0,2020-07-09 22:11:46,有六倍增容一个人快速洗五分钟左右也只降低两三度
100003859066.0,5.0,2020-02-23 12:33:13,热水持续提供充足
100003859066.0,5.0,2019-12-08 20:21:28,够全家人的享用
100003859066.0,5.0,2020-04-19 13:45:53,之前用45瓦的热水器两个人洗就没有水了现在可以洗一家四口
100003859066.0,5.0,2020-03-24 19:32:43,两个人都够用呢
100003859066.0,5.0,2020-06-21 20:45:02,20分钟完全满足
100003859066.0,5.0,2020-06-27 10:57:12,热水器是60L还是够用的洗的话就是正常洗是OK的
